source,source_file,column_name,sample_values,blind_label,blind_confidence,finetype_label,finetype_confidence,agreement,final_label,reasoning,ground_truth_label,ground_truth_source
sherlock,,,"[""2108 W. Concord Ln."", ""171 N. Waters Edge Dr. #302"", ""2123 W. Concord Ln."", ""11 Cornell Ct."", ""2162 W. Concord Ln."", ""46 Bosworth Dr."", ""1917 Brockton Ln."", ""2160 W. Adobe Dr."", ""2197 Gladstone Dr."", ""21W780 Park Ave.""]",geography.address.full_address,high,representation.text.entity_name,0.4500,no,geography.address.full_address,Low FineType confidence (0.45); blind classification preferred.,address,sherlock
sherlock,,,"[""Route 214"", ""Route 215""]",representation.text.plain_text,medium,representation.text.entity_name,1.0000,no,representation.text.plain_text,"Route names (Route 214, Route 215); entity_name is plausible but plain_text is better.",area,sherlock
sherlock,,,"[""Moffat"", ""Moffat""]",geography.location.city,low,datetime.component.day_of_week,1.0000,no,geography.location.city,Single place name 'Moffat'; city is plausible.,county,sherlock
sherlock,,,"[""79.1"", ""78.2"", ""77.4"", ""77.6"", ""78.2""]",representation.numeric.decimal_number,high,representation.numeric.decimal_number,1.0000,yes,representation.numeric.decimal_number,,depth,sherlock
sherlock,,,"[""Norwegian"", ""Swedish""]",representation.text.word,medium,geography.location.country,0.5000,no,representation.text.word,"Language names (Norwegian, Swedish); country is incorrect.",language,sherlock
sherlock,,,"[""Tony Roots"", ""Culture Freeman"", ""Black Slate"", ""Delroy Washington"", ""Still Cool"", ""Rising Son"", ""Rising Son"", ""Fred Locks & Creation Steppers"", ""Doc Alimantado"", ""Big Youth""]",identity.person.full_name,medium,representation.text.entity_name,0.4500,no,identity.person.full_name,Musician/artist names; entity_name is plausible but many are full person names.,artist,sherlock
sherlock,,,"[""Ghost Ballads"", ""The Unicorn"", ""Early English Ballads"", ""Tony & Irene Saletan"", ""Farewell Nancy"", ""Death & The Lady"", ""The Raven And The Crow"", ""The Fox Jumps Over the Parson's Gate"", ""Dark Ships in the Forest"", ""For Old Time's Sake""]",representation.text.plain_text,medium,representation.text.entity_name,0.8333,no,representation.text.plain_text,Album/music collection titles; entity_name is plausible but plain_text better fits.,album,sherlock
sherlock,,,"[""city"", ""town"", ""town"", ""town""]",representation.discrete.categorical,high,representation.text.word,0.7500,no,representation.discrete.categorical,"Settlement type (city, town); categorical is correct.",type,sherlock
sherlock,,,"[""B M Cash"", ""R Johnson"", ""B M Cash"", ""R C Colgan"", ""William Twiston-Davies"", ""James Doyle"", ""M Dwyer"", ""William Carson"", ""J Fanning"", ""William Carson""]",identity.person.full_name,high,representation.text.entity_name,0.5500,no,identity.person.full_name,Low FineType confidence (0.55); blind classification preferred.,jockey,sherlock
sherlock,,,"[""Better Man"", ""Last Kiss"", ""Yellow Ledbetter"", ""Love, Reign O'er Me"", ""Just Breathe"", ""Even Flow"", ""Jeremy"", ""Jeremy (2008 Brendan O'Brien Mix)"", ""Black"", ""Sirens""]",representation.text.plain_text,medium,identity.person.last_name,0.4000,no,representation.text.plain_text,Song titles; entity_name is plausible but plain_text better fits song titles.,name,sherlock
sherlock,,,"[""Adult, Hentai"", ""Adult, Hentai"", ""Adult, Hentai"", ""Adult, Hentai"", ""Adult, Hentai"", ""Adult, Hentai"", ""Adult, Hentai"", ""Adult, Hentai"", ""Adult, Hentai"", ""Adult, Hentai""]",representation.discrete.categorical,medium,identity.person.full_name,1.0000,no,representation.discrete.categorical,Genre tags; categorical is correct.,genre,sherlock
sherlock,,,"[""1"", ""2"", ""3"", ""4"", ""5"", ""6"", ""7"", ""8"", ""9"", ""10""]",representation.identifier.increment,high,representation.identifier.numeric_code,0.5500,no,representation.identifier.increment,"Sequential integers 1-20; FineType's categorical is incorrect, increment is correct.",rank,sherlock
sherlock,,,"[""18-24"", ""25-34"", ""45-44"", ""45-54"", ""55-64"", ""65+""]",representation.text.plain_text,medium,representation.numeric.integer_number,0.8333,no,representation.text.plain_text,"Age range bands (18-24, 25-34); plain_text is better than whitespace_separated.",age,sherlock
sherlock,,,"[""Steel Guitar Magic - Hawaiian Style"", ""Steel Guitar Magic - Hawaiian Style"", ""Steel Guitar Magic - Hawaiian Style"", ""Steel Guitar Magic - Hawaiian Style"", ""Steel Guitar Magic - Hawaiian Style""]",representation.text.plain_text,high,geography.address.full_address,1.0000,no,representation.text.plain_text,Album title repeated; plain_text is correct.,album,sherlock
sherlock,,,"[""jpwhiting"", ""ruphy"", ""ruphy"", ""ruphy"", ""pumphaus/Arno Rehn"", ""cryos?"", ""jmho"", ""ruphy"", ""jobermayr"", ""ruphy""]",identity.person.username,high,representation.discrete.categorical,0.5000,no,identity.person.username,Low FineType confidence (0.50); blind classification preferred.,owner,sherlock
sherlock,,,"[""3 ACTIVE"", ""2 CHURNER"", ""1 INACTIVE"", ""3 ACTIVE"", ""2 CHURNER"", ""1 INACTIVE"", ""3 ACTIVE"", ""2 CHURNER"", ""1 INACTIVE"", ""3 ACTIVE""]",representation.discrete.categorical,medium,representation.numeric.integer_number,0.5000,no,representation.discrete.categorical,Status codes with numeric prefix; categorical is correct.,status,sherlock
sherlock,,,"[""On recent kernel Cool'n'Quiet is supported by acpi-cpufreq"", ""LCD brightness control supported in kernel version >= 3.7"", ""Required a recent kernel for KMS support and non-free firmwares"", ""No special procedure required during installation""]",representation.text.sentence,high,container.array.whitespace_separated,0.5625,no,representation.text.sentence,Technical notes/sentences; sentence is correct.,notes,sherlock
sherlock,,,"[""The Bugsnag Events REST API allows developers to access and integrate the event functionality of Bugsnag with other applications. The API methods include listing project events, retrieving event..."", ""The Bugsnag Errors REST API allows developers to access and integrate the errors functionality of Bugsnag with other applications. The API methods include listing account and project errors,...""]",representation.text.paragraph,high,representation.text.sentence,0.8000,no,representation.text.paragraph,Long API description paragraphs; sentence is too short a classification.,description,sherlock
sherlock,,,"[""1972"", ""1979"", ""1968"", ""1970"", ""1979"", ""1980"", ""1971"", ""1992"", ""1978"", ""1967""]",datetime.component.year,high,datetime.component.year,1.0000,yes,datetime.component.year,,year,sherlock
sherlock,,,"[""131"", ""293"", ""396""]",representation.numeric.integer_number,medium,representation.identifier.numeric_code,1.0000,no,representation.numeric.integer_number,Integer ranking values; numeric_code is less precise.,ranking,sherlock
sherlock,,,"[""6"", ""17""]",representation.numeric.integer_number,medium,representation.boolean.initials,0.5000,no,representation.numeric.integer_number,Small integers; boolean initials is incorrect.,rank,sherlock
