source,source_file,column_name,sample_values,blind_label,blind_confidence,finetype_label,finetype_confidence,agreement,final_label,reasoning,ground_truth_label,ground_truth_source
sherlock,,,"[""Motor vehicle and parts dealers"", ""Motor vehicle and parts dealers"", ""Motor vehicle and parts dealers"", ""Motor vehicle and parts dealers"", ""Furniture and home furnishings stores"", ""Furniture and home furnishings stores"", ""Furniture and home furnishings stores"", ""Electronics and appliance stores"", ""Electronics and appliance stores"", ""Electronics and appliance stores""]",representation.discrete.categorical,high,representation.text.entity_name,0.5,no,representation.discrete.categorical,Blind classification is more appropriate based on domain context.,category,sherlock
sherlock,,,"[""D Swift"", ""D Swift"", ""D Swift""]",identity.person.full_name,medium,representation.text.entity_name,1.0,no,identity.person.full_name,Abbreviated person names (D Swift); FineType's entity_name agrees but full_name is more specific.,jockey,sherlock
sherlock,,,"[""Hard copy"", ""PDF download [1.9 MB] Bypass cart and download""]",representation.discrete.categorical,medium,representation.discrete.categorical,0.5,yes,representation.discrete.categorical,,format,sherlock
sherlock,,,"[""Kitchen/prep area"", ""Storage room"", ""Kitchen/prep area"", ""Bar"", ""Kitchen/prep area"", ""Sushi bar"", ""Sushi bar"", ""Sushi bar"", ""Sushi bar"", ""Hallway""]",representation.discrete.categorical,high,geography.location.region,0.4,no,representation.discrete.categorical,"Venue area types (Kitchen, Bar, Sushi bar); FineType's region is incorrect.",location,sherlock
sherlock,,,"[""TESS"", ""ESI"", ""GES"", ""TECD"", ""SANM""]",representation.identifier.alphanumeric_id,medium,representation.identifier.alphanumeric_id,0.6,yes,representation.identifier.alphanumeric_id,,symbol,sherlock
sherlock,,,"[""Edith Teter Elementary School"", ""Silverheels Middle School"", ""South Park High School""]",representation.text.entity_name,high,representation.text.entity_name,1.0,yes,representation.text.entity_name,,name,sherlock
sherlock,,,"[""Hardness, Shore D"", ""Tensile Strength, p.s.i."", ""Elongation, %""]",representation.text.plain_text,medium,representation.text.entity_name,0.667,no,representation.text.plain_text,Material property descriptions; FineType's entity_name is incorrect.,requirement,sherlock
sherlock,,,"[""Code"", ""Code"", ""Miscellaneous"", ""User interface"", ""Code"", ""Code"", ""Code"", ""Code"", ""Code"", ""Code""]",representation.discrete.categorical,high,geography.location.region,0.075,no,representation.discrete.categorical,"Code category labels (Code, Miscellaneous, Documentation); FineType's region is incorrect.",component,sherlock
sherlock,,,"[""Karen"", ""Stephanie"", ""Rachel Malcolm"", ""Actor"", ""Actor"", ""Holly Brandon""]",identity.person.first_name,medium,identity.person.last_name,0.5,no,identity.person.first_name,"Mostly first names (Karen, Stephanie, Holly); FineType's last_name is incorrect.",credit,sherlock
sherlock,,,"[""DNA Racing"", """", ""Midwestern State University"", ""Midwestern State University"", ""Midwestern State University"", ""Midwestern State University"", ""DNA Racing"", ""DNA Racing"", ""DNA Racing"", ""Midwestern State University""]",representation.text.entity_name,high,representation.text.entity_name,0.625,yes,representation.text.entity_name,,team Name,sherlock
sherlock,,,"[""St. Anselm"", ""St. Anselm"", ""St. Anselm"", """"]",representation.text.entity_name,medium,identity.person.full_name,0.75,no,representation.text.entity_name,School/institution name repeated; FineType's full_name is incorrect.,team,sherlock
sherlock,,,"[""AS"", ""FPAY"", ""REMI"", ""LAPS""]",representation.identifier.alphanumeric_id,medium,geography.transportation.icao_code,0.75,no,representation.identifier.alphanumeric_id,"Patent action codes (AS, FPAY, REMI, LAPS); FineType's icao_code is incorrect.",code,sherlock
sherlock,,,"["""", ""F"", """", ""F"", """", ""F"", """", ""F"", ""F"", """", ""F"", """", ""F"", """", ""F"", """", ""F"", """", ""F"", """"]",representation.boolean.initials,medium,representation.boolean.initials,0.8,yes,representation.boolean.initials,,sex,sherlock
sherlock,,,"[""Minneapolis, MN, USA"", ""V\u00e4ster\u00e5s, SWE"", ""St. Paul, AB, CAN"", ""Vancouver, BC, CAN"", ""Omsk, RUS"", ""Helsinki, FIN"", ""Summerside, PE, CAN"", ""Norrkoping, SWE"", ""Toronto, ON, CAN"", ""Winnipeg, MB, CAN""]",geography.location.city,high,identity.person.full_name,1.0,no,geography.location.city,"City+country code format (Minneapolis, MN, USA); FineType's full_name is incorrect.",birth Place,sherlock
sherlock,,,"[""AS"", ""FPAY"", ""AS"", ""FPAY""]",representation.identifier.alphanumeric_id,medium,geography.location.country_code,0.5,no,representation.identifier.alphanumeric_id,"Patent action codes (AS, FPAY); FineType's country_code is incorrect.",code,sherlock
sherlock,,,"["""", ""Professional Services"", ""Professional Services""]",representation.discrete.categorical,medium,representation.text.entity_name,0.667,no,representation.discrete.categorical,Service category values (Professional Services); FineType's entity_name is incorrect.,category,sherlock
sherlock,,,"[""Route 101"", ""Route 102"", ""Route 103""]",representation.text.plain_text,medium,representation.text.entity_name,1.0,no,representation.text.plain_text,Route number identifiers; FineType's entity_name is less accurate.,area,sherlock
sherlock,,,"["""", ""Goalkeeper"", ""Defender"", """", """", ""Defender"", """", """", ""Midfielder"", """"]",representation.discrete.categorical,high,geography.location.region,0.075,no,representation.discrete.categorical,"Sports position categories (Goalkeeper, Defender, Midfielder); FineType's region is incorrect.",position,sherlock
sherlock,,,"[""4.6"", ""0.0""]",representation.numeric.decimal_number,medium,representation.numeric.decimal_number,1.0,yes,representation.numeric.decimal_number,,elevation,sherlock
sherlock,,,"[""18. MK Dons"", ""19. Preston"", ""20. Q.P.R."", ""21. Reading"", ""22. Rotherham"", ""23. Sheff Wed"", ""24. Wolves""]",representation.discrete.ordinal,medium,geography.location.region,0.429,no,representation.discrete.ordinal,Ranked team list with position number prefix; FineType's region is incorrect.,team,sherlock
sherlock,,,"[""Jun 1, 1982"", ""Apr 8, 1985"", ""Aug 3, 1984"", ""Apr 17, 1983"", ""Mar 4, 1983"", ""Jan 7, 1986"", ""Dec 22, 1982"", ""May 1, 1984"", ""Jun 27, 1985"", ""Aug 28, 1983""]",datetime.date.abbreviated_month,high,datetime.date.long_full_month,0.5,no,datetime.date.abbreviated_month,"Dates like 'Jun 1, 1982'; FineType's long_full_month is incorrect, abbreviated_month (Jun) is the right format.",birth Date,sherlock
sherlock,,,"[""CALM"", ""TEP"", ""TESS"", ""SLP"", ""GES""]",representation.identifier.alphanumeric_id,medium,finance.currency.currency_code,0.4,no,representation.identifier.alphanumeric_id,"Short ticker/code values (CALM, TEP, TESS); FineType's currency_code is incorrect.",symbol,sherlock
sherlock,,,"[""12M"", ""18M"", ""24M""]",representation.text.word,medium,representation.numeric.si_number,1.0,no,representation.text.word,"Age/duration codes (12M, 18M, 24M) represent months; FineType's si_number is incorrect.",age,sherlock
sherlock,,,"[""San Francisco"", ""West Hollywood"", ""San Juan Capistrano"", ""Tokyo"", ""Tokyo"", ""Tokyo"", ""Brooklyn"", ""Sellersville""]",geography.location.city,high,representation.text.entity_name,0.375,no,geography.location.city,Clear city names; FineType's entity_name is less specific.,city,sherlock
