source,source_file,column_name,sample_values,blind_label,blind_confidence,finetype_label,finetype_confidence,agreement,final_label,reasoning,ground_truth_label,ground_truth_source
sherlock,,,"[""M\u00e4nnlich"", ""Weiblich""]",identity.person.gender,high,datetime.component.periodicity,0.5000,no,identity.person.gender,Values are German for Male/Female; blind correctly identifies gender. FineType's 'periodicity' is wrong.,gender,sherlock
sherlock,,,"[""Electronic Commerce Website"", ""Specialty Retail Store"", ""Internet Radio Website"", ""Home Shopping"", ""Real Estate Website"", ""Airline"", ""Retail Store"", ""Courier"", ""Telecommunications"", ""Retail Store"", ""Gaming System"", ""Video Hosting Website"", ""Real Estate Website""]",representation.discrete.categorical,high,representation.text.entity_name,0.3850,no,representation.discrete.categorical,Business category names; blind correct. FineType entity_name is less precise.,category,sherlock
sherlock,,,"[""Reykjavik (Iceland)"", ""Ankara (Turkey)""]",geography.location.city,high,representation.text.entity_name,1.0000,no,geography.location.city,City names with country in parentheses; blind is more precise. FineType entity_name is too generic.,location,sherlock
sherlock,,,"[""outdated"", ""outdated"", ""outdated"", ""deleted""]",representation.discrete.categorical,high,representation.text.word,0.1250,no,representation.discrete.categorical,Status values; blind correct. FineType 'word' is less precise.,status,sherlock
sherlock,,,"["""", """", """", """", """", """", """", """", """", ""Mineral Water Bowl""]",representation.text.plain_text,low,representation.boolean.initials,0.9000,no,representation.text.plain_text,Mostly empty with one product name; FineType 'boolean.initials' is wrong for this sparse data.,notes,sherlock
sherlock,,,"[""85"", ""85"", ""85"", ""85"", ""85"", ""85"", ""85"", ""85"", ""85"", ""85"", ""85"", ""85"", ""85"", ""85"", ""85"", ""85"", ""85"", ""85"", ""85"", ""85""]",representation.numeric.integer_number,medium,representation.identifier.numeric_code,1.0000,no,representation.numeric.integer_number,All values are '85'; FineType numeric_code is plausible but integer_number is more accurate for a uniform numeric rank.,rank,sherlock
sherlock,,,"[""Standard Postage (USPS First Class Package\u00ae)"", ""Express Postage (USPS Priority Mail Flat Rate Envelope\u00ae)""]",representation.text.plain_text,medium,representation.text.paragraph,0.5000,no,representation.text.plain_text,"Delivery service descriptions; both agree on text type, blind plain_text is appropriate.",service,sherlock
sherlock,,,"[""2002/03"", ""2003/04""]",datetime.period.fiscal_year,high,finance.payment.credit_card_expiration_date,1.0000,no,datetime.period.fiscal_year,Values like '2002/03' are academic/fiscal year periods; blind correct. FineType credit_card_expiration is wrong.,year,sherlock
sherlock,,,"[""\"" \"" (double quotation marks)"", ""* (asterisk)"", ""+ (plus sign)"", ""- (minus sign)"", ""~ (tilde)""]",representation.text.plain_text,medium,representation.file.excel_format,0.1000,no,representation.text.plain_text,Symbol descriptions in text form; blind correct. FineType excel_format is wrong.,symbol,sherlock
sherlock,,,"[""IM"", ""SDSM"", ""AMM"", ""JMST"", ""GCM"", ""MOST"", ""AJAX"", ""RMM"", ""CONN"", ""DAC""]",representation.discrete.categorical,medium,representation.text.entity_name,0.5000,no,representation.discrete.categorical,Short abbreviation codes for clubs/teams; blind correct. FineType entity_name is less appropriate.,club,sherlock
sherlock,,,"[""06:03"", ""07:24"", ""07:05"", ""08:13"", ""07:18"", ""07:10"", ""05:53"", ""10:35"", ""07:33"", """"]",datetime.time.hm_24h,high,datetime.time.hm_24h,0.9000,yes,datetime.time.hm_24h,,duration,sherlock
sherlock,,,"[""Hardware See the Application Server Requirements..."", ""An internally deployed Cisco Unified MeetingPlace Web Server..."", ""Hardware Cisco Media Convergence Server (MCS)..."", ""If your deployment requires a HMS..."", ""Cisco Unified MeetingPlace PhoneView..."", ""See the Video Requirements.""]",representation.text.paragraph,high,representation.text.paragraph,0.5000,yes,representation.text.paragraph,,requirement,sherlock
sherlock,,,"[""DNS zone transfers"", ""TFTP daemon (tftpd)"", ""link-commonly used by intruders"", ""SUN RPC"", ""NFS"", ""BSD UNIX r commands (rsh, rlogin, and so forth)"", ""line printer daemon (lpd)"", ""UNIX-to-UNIX copy program daemon (uucpd)"", ""Open Windows"", ""X Windows""]",representation.text.plain_text,medium,representation.text.entity_name,0.4000,no,representation.text.plain_text,Network service descriptions; blind correct. FineType entity_name is less specific.,service,sherlock
sherlock,,,"[""1945"", ""1964"", ""1969"", ""1974"", ""1976"", ""1980"", ""1983"", ""1986"", ""1989"", ""1992"", ""1995"", ""1998"", ""2001""]",datetime.component.year,high,datetime.component.year,1.0000,yes,datetime.component.year,,year,sherlock
sherlock,,,"[""1st \u2013 5th Grade"", ""1st \u2013 5th Grade"", ""Kindergarten AM"", ""Kindergarten AM"", ""Kindergarten PM"", ""Kindergarten PM""]",representation.discrete.categorical,medium,representation.text.entity_name,0.6670,no,representation.discrete.categorical,Grade level categories; blind correct. FineType entity_name is wrong.,grades,sherlock
sherlock,,,"[""FPAY"", ""AS""]",representation.discrete.categorical,medium,geography.location.country_code,0.5000,no,representation.discrete.categorical,Short payment/code abbreviations; blind correct. FineType country_code is wrong.,code,sherlock
sherlock,,,"[""None"", ""None"", ""None"", ""None"", ""None"", ""None"", ""None"", ""None"", ""None"", ""None"", ""None"", ""None"", ""None"", ""None"", ""None"", ""None"", ""None"", ""None"", ""None"", ""None""]",representation.text.plain_text,medium,geography.address.street_suffix,1.0000,no,representation.discrete.categorical,All 'None' values; FineType street_suffix is wrong. These are null/placeholder values.,manufacturer,sherlock
sherlock,,,"[""AS"", ""AS"", ""CC"", ""FPAY"", ""AS"", ""FPAY"", ""FPAY""]",representation.discrete.categorical,medium,geography.location.country_code,0.4290,no,representation.discrete.categorical,"Short codes (AS, CC, FPAY); blind correct. FineType country_code is wrong.",code,sherlock
sherlock,,,"[""White-headed Duck Oxyura leucocephala"", ""Lesser Kestrel Falco naumanni"", ""Sterna nilotica"", ""Whiskered Tern Chlidonias hybrida""]",representation.text.entity_name,high,representation.text.entity_name,1.0000,yes,representation.text.entity_name,,species,sherlock
sherlock,,,"[""Sun."", ""Sun."", ""Sun."", ""Sun."", ""Wed."", ""Thurs."", ""Sat."", ""Fri."", ""Sat."", ""Mon."", ""Mon."", ""Wed."", ""Fri."", ""Sun.""]",datetime.component.day_of_week,high,representation.text.entity_name,0.0360,no,datetime.component.day_of_week,Abbreviated day names with periods; blind correct. FineType entity_name is wrong.,day,sherlock
sherlock,,,"[""South Darfur State"", ""South Darfur State"", ""South Darfur State"", ""South Darfur State"", ""South Darfur State"", ""South Darfur State"", ""South Darfur State"", ""South Darfur State"", ""South Darfur State"", ""South Darfur State"", ""South Darfur State"", ""South Darfur State"", ""South Darfur State"", ""South Darfur State"", ""South Darfur State"", ""South Darfur State"", ""South Darfur State"", ""South Darfur State"", ""South Darfur State"", ""South Darfur State""]",geography.location.region,high,representation.discrete.categorical,1.0000,no,representation.discrete.categorical,FineType confidence 1.00; deferring to FineType.,region,sherlock
sherlock,,,"[""8.1"", ""7.2"", ""7.2"", ""8.1"", ""8.0"", ""7.6"", ""8.4"", ""7.7""]",representation.numeric.decimal_number,high,representation.numeric.decimal_number,1.0000,yes,representation.numeric.decimal_number,,service,sherlock
sherlock,,,"[""9"", ""5"", ""4"", ""3"", ""6"", ""5"", ""4"", ""4"", ""5"", ""9"", ""0"", ""8"", ""1"", ""7"", ""2"", ""4"", ""1"", ""4"", ""0""]",representation.numeric.integer_number,high,representation.numeric.integer_number,0.8000,yes,representation.numeric.integer_number,,plays,sherlock
sherlock,,,"[""Chef & Owner"", ""Executive Chef Chef de Cuisine"", ""--"", ""--"", ""--"", ""Line Cook Intern""]",representation.text.plain_text,medium,representation.text.entity_name,0.5000,no,representation.text.plain_text,Job title descriptions; blind correct. FineType entity_name is plausible but plain_text better captures job descriptions with symbols.,position,sherlock
sherlock,,,"[""1"", ""2"", ""3"", ""4"", ""5"", ""6"", ""7"", ""8"", ""9"", ""10""]",representation.identifier.increment,high,representation.identifier.numeric_code,0.0500,no,representation.identifier.increment,Sequential 1-10; blind correct. FineType numeric_code is less precise for sequential IDs.,rank,sherlock
sherlock,,,"[""3/6M"", ""6/9M"", ""9/12M""]",representation.discrete.categorical,medium,representation.identifier.alphanumeric_id,1.0000,no,representation.discrete.categorical,Age range codes like '3/6M'; FineType alphanumeric_id is wrong. These are categorical size/age ranges.,age,sherlock
sherlock,,,"[""Dreamyard"", ""Dreamyard"", ""Dreamyard (B1f)"", ""Route 1"", ""Route 1"", ""Route 2""]",representation.text.plain_text,medium,representation.text.entity_name,0.6670,no,representation.text.plain_text,Game area names; blind correct. FineType entity_name is plausible but plain_text better.,area,sherlock
sherlock,,,"[""69 kg"", ""69 kg"", ""69 kg"", ""69 kg""]",identity.person.weight,high,identity.person.weight,1.0000,yes,identity.person.weight,,category,sherlock
sherlock,,,"[""\u00d0?\u00d0\u00bd\u00d0\u00b3\u00d0\u00bb\u00d1\u2013\u00d0\u00b9\u00d1?\u00d1\u0152\u00d0\u00ba\u00d0\u00b0"", ""\u00d0?\u00d0\u00bd\u00d0\u00b3\u00d0\u00bb\u00d1\u2013\u00d0\u00b9\u00d1?\u00d1\u0152\u00d0\u00ba\u00d0\u00b0"", ""\u00d0?\u00d0\u00bd\u00d0\u00b3\u00d0\u00bb\u00d1\u2013\u00d0\u00b9\u00d1?\u00d1\u0152\u00d0\u00ba\u00d0\u00b0, \u00d0\u00a4\u00d1\u20ac\u00d0\u00b0\u00d0\u00bd\u00d1\u2020\u00d1\u0192\u00d0\u00b7\u00d1\u0152\u00d0\u00ba\u00d0\u00b0""]",representation.text.plain_text,low,ERROR,0.0000,no,representation.text.plain_text,FineType had a JSON parse error due to encoding. Values appear to be language names in Ukrainian; plain_text is appropriate.,language,sherlock
sherlock,,,"[""1"", ""2"", ""3"", ""4"", ""5"", ""6"", ""7"", ""8"", ""9"", ""10""]",representation.identifier.increment,high,representation.identifier.numeric_code,0.0500,no,representation.identifier.increment,Sequential 1-10; blind correct. FineType numeric_code is less precise.,rank,sherlock
sherlock,,,"[""Mutation detected in F1 DNA"", ""Available for shipment""]",representation.text.plain_text,medium,representation.text.entity_name,0.5000,no,representation.text.plain_text,Short status/notes sentences; blind correct. FineType entity_name is wrong.,status,sherlock
sherlock,,,"[""Senza Titolo"", ""Senza Titolo"", ""Senza Titolo"", ""Senza Titolo"", ""Senza Titolo"", ""Senza Titolo"", ""Senza Titolo"", ""Senza Titolo"", ""Senza Titolo"", ""Senza Titolo""]",representation.text.plain_text,high,representation.text.entity_name,1.0000,no,representation.text.entity_name,FineType agrees entity_name; both agree.,album,sherlock
sherlock,,,"[""open"", ""open"", ""open"", ""open"", ""open"", ""open""]",representation.discrete.categorical,high,representation.text.word,1.0000,no,representation.discrete.categorical,All 'open' status values; blind correct. FineType 'word' is less precise for a status field.,status,sherlock
sherlock,,,"[""Last 7 Games"", ""Last 15 Games"", ""Last 30 Games""]",representation.discrete.categorical,medium,representation.text.entity_name,1.0000,no,representation.discrete.categorical,Time period categories for stats; blind correct. FineType entity_name is wrong.,duration,sherlock
sherlock,,,"[""Want to Read"", ""Want to Read"", ""Want to Read"", ""Want to Read"", ""Stalled"", ""Want to Read"", ""Dropped"", ""Want to Read"", ""Want to Read"", ""Want to Read"", ""Stalled"", ""Want to Read"", ""Want to Read"", ""Want to Read"", ""Want to Read"", ""Want to Read"", ""Want to Read"", ""Want to Read"", ""Want to Read"", ""Read""]",representation.discrete.categorical,high,representation.text.entity_name,0.8000,no,representation.discrete.categorical,Reading status categories; blind correct. FineType entity_name is wrong.,status,sherlock
sherlock,,,"[""weekly standards based lesson plan template - Full Version by bland2312..."", ""weekly standards based lesson plan template - Fast Download by BowTech..."", ""Table of Contents by sara..."", ""Lesson Plan Template by hope..."", ""PhysicalEducation by dawn...""]",representation.text.paragraph,high,representation.text.paragraph,0.7860,yes,representation.text.paragraph,,description,sherlock
sherlock,,,"[""K - 8"", ""K - 12""]",representation.discrete.categorical,medium,geography.address.postal_code,1.0000,no,representation.discrete.categorical,Grade range categories K-8/K-12; blind correct. FineType postal_code is wrong.,grades,sherlock
sherlock,,,"[""Myanmar"", ""Uzbekistan"", ""Kiribati"", ""Armenia"", ""Armenia"", ""Armenia"", ""Armenia"", ""Sri Lanka"", ""Cambodia"", ""Cambodia"", ""Cambodia"", ""Myanmar"", ""China, People's Republic of"", ""Georgia"", ""China, People's Republic of"", ""China, People's Republic of"", ""China, People's Republic of"", ""China, People's Republic of"", ""Samoa"", ""Samoa""]",geography.location.country,high,geography.location.country,0.4500,yes,geography.location.country,,country,sherlock
sherlock,,,"[""HIGHWAY GARAGE RT 12"", """"]",geography.address.street_name,medium,representation.text.entity_name,0.5000,no,geography.address.street_name,Highway garage address; blind correct. FineType entity_name is too generic.,address,sherlock
sherlock,,,"["""", ""BLND"", ""DEAF"", ""WCHR"", ""WCHS"", ""WCHC"", ""WCMP"", ""WCBD"", ""Blindenhund"", """", """", ""BAG"", ""BAG (BM)"", ""BAG 2 - 5"", ""XBA/XMA"", ""XBB-XBE/MBXME"", ""SKI"", ""WEA"", ""GOLF"", ""BIKE""]",representation.discrete.categorical,medium,representation.text.entity_name,0.5000,no,representation.discrete.categorical,Airline service/assistance codes; blind correct. FineType entity_name is wrong.,service,sherlock
sherlock,,,"[""1986"", ""1987"", ""1988"", ""1989"", ""1990"", ""1991"", ""1992"", ""1993"", ""1994"", ""1995"", ""1996"", ""1997"", ""1998"", ""1999"", ""2000"", ""2001"", ""2002"", ""2003"", ""2004"", ""2005""]",datetime.component.year,high,datetime.component.year,1.0000,yes,datetime.component.year,,year,sherlock
sherlock,,,"[""The Whitstein Brothers"", ""Sonny Osborne"", ""The New Lost City Ramblers"", ""Browns Ferry Four"", ""The Critton Hollow String Band"", ""Various Artists"", ""Flatt & Scruggs"", ""The Highwoods String Band"", ""The New Lost City Ramblers"", ""The Stanley Brothers""]",representation.text.entity_name,high,representation.text.entity_name,0.9000,yes,representation.text.entity_name,,artist,sherlock
sherlock,,,"[""Alabama"", ""Oregon"", ""Florida State"", ""Ohio State"", ""Baylor"", ""Miami (FL)"", ""Clemson"", ""Stanford"", ""LSU"", ""Auburn"", ""Oklahoma"", ""Texas A&M"", ""Oklahoma St."", ""South Carolina"", ""Missouri"", ""Texas Tech"", ""Louisville"", ""Michigan"", ""Michigan St."", ""UCF""]",representation.text.entity_name,high,representation.text.entity_name,0.1250,yes,representation.text.entity_name,,team,sherlock
sherlock,,,"[""Twente"", ""Feyenoord""]",representation.text.entity_name,high,geography.location.country,0.5000,no,representation.text.entity_name,"Sports club names; FineType country is wrong. Twente and Feyenoord are football clubs, not countries. Blind entity_name is correct.",club,sherlock
sherlock,,,"[""3"", ""1"", ""3"", ""2"", ""54"", ""4"", ""30"", ""3"", ""13"", ""21"", ""29"", ""5"", ""36"", ""10"", ""11"", ""38"", ""18"", ""5"", ""21"", ""3""]",representation.numeric.integer_number,high,representation.identifier.numeric_code,0.5500,no,representation.numeric.integer_number,Count/sales numbers; blind correct. FineType numeric_code is less appropriate for varying counts.,sales,sherlock
sherlock,,,"[""Mon"", ""Tues"", ""Wed"", ""Thurs"", ""Fri"", ""Sat"", ""Sun""]",datetime.component.day_of_week,high,representation.text.entity_name,0.0710,no,datetime.component.day_of_week,Abbreviated day names; blind correct. FineType entity_name is wrong.,order,sherlock
sherlock,,,"[""MCGSQSxZ"", ""FLCEl"", ""gMnajMa""]",representation.identifier.alphanumeric_id,medium,geography.location.region,0.3330,no,representation.identifier.alphanumeric_id,Random alphanumeric strings; blind correct. FineType region is wrong.,owner,sherlock
sherlock,,,"[""Mon"", ""Tues"", ""Wed"", ""Thurs"", ""Fri"", ""Sat"", ""Sun""]",datetime.component.day_of_week,high,representation.text.entity_name,0.0710,no,datetime.component.day_of_week,Abbreviated day names; blind correct. FineType entity_name is wrong.,order,sherlock
sherlock,,,"[""Red Bull Racing-Renault"", ""Mercedes"", ""Ferrari"", ""Red Bull Racing-Renault"", ""McLaren-Mercedes"", ""Ferrari"", ""Force India-Mercedes"", ""Force India-Mercedes"", ""Lotus-Renault"", ""Williams-Renault"", ""Sauber-Ferrari"", ""STR-Ferrari"", ""Caterham-Renault"", ""Marussia-Cosworth"", ""HRT-Cosworth"", ""McLaren-Mercedes"", ""STR-Ferrari"", ""Marussia-Cosworth"", ""Mercedes"", ""Caterham-Renault""]",representation.text.entity_name,high,geography.location.region,0.5000,no,geography.location.region,FineType confidence 0.50; deferring to FineType.,team,sherlock
sherlock,,,"[""Getting Even"", ""Getting Even"", ""Getting Even"", ""Getting Even"", ""Getting Even"", ""Getting Even"", ""Getting Even"", ""Getting Even"", ""Getting Even"", ""Getting Even""]",representation.text.plain_text,high,representation.text.entity_name,1.0000,no,representation.text.entity_name,"Album name; FineType entity_name matches, both agree.",album,sherlock
sherlock,,,"["""", ""Professor, University of Leipzig, Germany"", ""Steenbock Professor of Neural and Behavioral Sicences, Department of Neuroscience, University of Wisconsin""]",representation.text.plain_text,medium,geography.address.full_address,0.3330,no,representation.text.plain_text,Academic affiliations; blind correct. FineType full_address is wrong.,affiliation,sherlock
sherlock,,,"[""11-13, Foxes Bridge Road"", ""43, Foxes Bridge Road"", ""23-25, Foxes Bridge Road"", ""19-21, Foxes Bridge Road"", ""45, Foxes Bridge Road"", ""41, Foxes Bridge Road"", ""27-29, Foxes Bridge Road"", ""18, Foxes Bridge Road"", ""49, Foxes Bridge Road"", ""43, Foxes Bridge Road""]",geography.address.full_address,high,representation.text.entity_name,1.0000,no,geography.address.full_address,"UK street addresses with house numbers; FineType entity_name is wrong, blind correct.",address,sherlock
sherlock,,,"[""1766"", ""1779"", ""1766"", ""1806"", ""1805"", ""1805"", ""1805"", ""1805"", ""1832"", ""1867"", ""1867"", ""1871"", ""1909"", ""1920"", ""1939"", ""1962"", ""1956"", ""1952"", ""1959"", ""1970""]",datetime.component.year,high,geography.address.postal_code,0.9000,no,datetime.component.year,Historical years 1766-1970; blind correct. FineType postal_code is wrong.,year,sherlock
sherlock,,,"[""Coming Home (Remixes) - EP"", ""Coming Home (Remixes) - EP"", ""Coming Home (Remixes) - EP"", ""Coming Home (Remixes) - EP"", ""Coming Home (Remixes) - EP"", ""Los Feeling - EP"", ""Los Feeling - EP"", ""V"", ""V"", ""V"", ""V"", ""V"", ""Wreckage"", ""Wreckage"", ""Wreckage"", ""Black In USA"", ""Super 8"", ""Super 8"", ""Super 8"", ""Super 8""]",representation.text.entity_name,high,representation.text.entity_name,0.3000,yes,representation.text.entity_name,,album,sherlock
sherlock,,,"[""Mon"", ""Tues"", ""Wed"", ""Thurs"", ""Fri"", ""Sat"", ""Sun""]",datetime.component.day_of_week,high,representation.text.entity_name,0.0710,no,datetime.component.day_of_week,Abbreviated day names; blind correct. FineType entity_name is wrong.,order,sherlock
sherlock,,,"[""Brazil"", ""United States"", ""Paraguay"", ""Ukraine"", """"]",geography.location.country,high,geography.location.country,0.6000,yes,geography.location.country,,origin,sherlock
sherlock,,,"[""unattached"", """", """"]",representation.discrete.categorical,low,representation.boolean.initials,0.6670,no,representation.discrete.categorical,Status value 'unattached' + empties; blind correct. FineType boolean.initials is wrong.,team Name,sherlock
sherlock,,,"[""isbn"", ""isbn 0385751060"", ""isbn 0618452958"", ""isbn 1741757746"", ""isbn 0753827409"", ""isbn 1841959146"", ""isbn"", ""isbn 1921372125"", ""isbn 1439138311"", ""isbn 0224094157"", ""isbn"", ""isbn""]",identity.commerce.isbn,medium,representation.discrete.categorical,0.3330,no,representation.text.plain_text,Values are 'isbn' prefix with numbers mixed; FineType discrete.categorical is more appropriate than isbn since values include bare 'isbn' without numbers.,isbn,sherlock
sherlock,,,"[""Chicago Fire"", ""Houston Dynamo"", ""Vancouver Whitecaps FC"", ""Charleston Battery""]",representation.text.entity_name,high,representation.text.entity_name,0.5000,yes,representation.text.entity_name,,team,sherlock
sherlock,,,"[""Adobe PDF"", ""HTML""]",representation.discrete.categorical,medium,representation.text.entity_name,0.5000,no,representation.discrete.categorical,File format names Adobe PDF/HTML; blind correct. FineType entity_name is wrong.,format,sherlock
sherlock,,,"[""4"", ""5"", ""6"", ""6""]",representation.numeric.integer_number,medium,representation.numeric.integer_number,1.0000,yes,representation.numeric.integer_number,,age,sherlock
sherlock,,,"[""Das Beste aus 40 Jahren ZDF Hitparade: Blue System"", ""Das Beste aus 40 Jahren ZDF Hitparade: Blue System"", ""Greatest Hits"", ""60 Hits - 60 Jahre Deutschland"", ""Das Beste aus 40 Jahren ZDF Hitparade: Blue System"", ""Das Beste aus 40 Jahren ZDF Hitparade: Blue System"", ""Das Beste aus 40 Jahren ZDF Hitparade: Blue System"", ""Das Beste aus 40 Jahren ZDF Hitparade: Blue System"", ""Das Beste aus 40 Jahren ZDF Hitparade: Blue System"", ""Das Beste aus 40 Jahren ZDF Hitparade: Blue System""]",representation.text.entity_name,high,geography.address.full_address,0.9000,no,representation.text.entity_name,Album titles; FineType full_address is wrong. Blind and better answer is entity_name.,album,sherlock
sherlock,,,"[""2"", ""4""]",representation.numeric.integer_number,medium,representation.boolean.initials,1.0000,no,representation.numeric.integer_number,"Small integers 2,4; blind correct. FineType boolean.initials is wrong.",age,sherlock
sherlock,,,"[""234"", ""50"", ""51"", ""109"", ""59"", ""11"", ""8""]",representation.numeric.integer_number,high,representation.identifier.numeric_code,0.8570,no,representation.identifier.numeric_code,FineType confidence 0.86; deferring to FineType.,rank,sherlock
sherlock,,,"[""3-5 working days, M-F only."", ""Next working day on all orders placed before 1pm, M-F only."", ""Saturday only on orders placed before Friday 1pm""]",representation.text.plain_text,medium,geography.address.full_address,0.3330,no,representation.text.plain_text,Delivery timeframe descriptions; blind correct. FineType full_address is wrong.,duration,sherlock
sherlock,,,"[""address (ikev2 keyring)"", ""crypto ikev2 keyring"", ""description (ikev2 keyring)"", ""identity (ikev2 keyring)"", ""peer"", ""pre-shared-key (ikev2 keyring)""]",representation.text.plain_text,medium,container.array.whitespace_separated,0.6670,no,representation.text.plain_text,CLI command descriptions; blind correct. FineType whitespace_separated is wrong.,command,sherlock
sherlock,,,"[""Spanish"", ""English"", ""Italian"", ""French"", ""Hindi"", ""Portuguese"", ""Arabic"", ""Chinese"", ""Japanese"", ""Korean""]",representation.discrete.categorical,high,geography.location.country,0.4000,no,representation.discrete.categorical,Language names; blind correct. FineType country is wrong.,language,sherlock
sherlock,,,"[""Napravnik Rosie"", ""Trujillo Elvis"", ""Maragh Rajiv"", ""Lanerie Corey J."", ""Velazquez John R."", ""Lezcano Jose""]",identity.person.full_name,high,geography.location.region,0.3330,no,identity.person.full_name,Person names in last-first format; blind correct. FineType region is wrong.,jockey,sherlock
sherlock,,,"[""0"", ""1049""]",representation.numeric.integer_number,medium,datetime.component.year,0.5000,no,representation.numeric.integer_number,Numeric values 0 and 1049; blind correct. FineType year is too specific.,rank,sherlock
sherlock,,,"[""LOST"", ""OREG"", ""LOST"", ""TOC"", ""SDSM"", ""O*H*"", ""GOLD"", ""MICH"", ""PNA"", ""MICH""]",representation.discrete.categorical,medium,geography.transportation.icao_code,0.5000,no,representation.discrete.categorical,Short club/team codes; blind correct. FineType icao_code is wrong.,club,sherlock
sherlock,,,"[""Capital Senior Living Corp"", ""Five Star Quality Care Inc"", ""Civitas Solutions Inc"", ""National Healthcare Corp"", ""Adcare Health Systems Inc""]",representation.text.entity_name,high,representation.text.entity_name,0.8000,yes,representation.text.entity_name,,company,sherlock
sherlock,,,"["""", ""American, California, French""]",representation.discrete.categorical,medium,representation.boolean.initials,0.5000,no,representation.discrete.categorical,Cuisine category list; blind correct. FineType boolean.initials is wrong.,category,sherlock
