source,source_file,column_name,sample_values,blind_label,blind_confidence,finetype_label,finetype_confidence,agreement,final_label,reasoning,ground_truth_label,ground_truth_source
sherlock,,,"[""Commission on Security and Cooperation in Europe"", ""Department of State"", ""Egyptian American Rule of Law Association (EARLA)"", ""Hudson Institute\u2019s Center for Religious Freedom"", ""Atlantic Council""]",representation.text.entity_name,high,representation.text.entity_name,0.6,yes,representation.text.entity_name,,affiliation,sherlock
sherlock,,,"[""WheyFit Isolate Creamy Vanilla"", ""WheyFit Isolate Dutch Chocolate"", ""WheyFit Isolate Strawberry Swirl"", ""WheyFit Isolate Natural Vanilla""]",representation.text.plain_text,high,representation.text.entity_name,0.7778,no,representation.text.entity_name,Product variant names; entity_name is appropriate.,product,sherlock
sherlock,,,"[""done"", ""done"", ""done"", ""done"", ""done"", ""done"", ""done"", ""bug #125778 and bug #126273 left""]",representation.discrete.categorical,medium,representation.discrete.ordinal,0.875,no,representation.discrete.categorical,"Task status values (done, bug #xxx left); FineType's ordinal is wrong; categorical is correct.",status,sherlock
sherlock,,,"[""2000"", ""2001"", ""2002"", ""2003"", ""2004"", ""2005"", ""2006"", ""2007"", ""2008"", ""2009""]",datetime.component.year,high,datetime.component.year,1.0,yes,datetime.component.year,,year,sherlock
sherlock,,,"[""1"", ""2"", ""3"", ""4"", ""5"", ""6"", ""7""]",representation.identifier.increment,medium,representation.numeric.integer_number,0.8571,no,representation.identifier.increment,Sequential integers 1-7; increment is more specific than FineType's integer_number.,rank,sherlock
sherlock,,,"[""HUMIRA"", ""HUMIRA"", ""HUMIRA"", ""HUMIRA"", ""HUMIRA""]",representation.text.word,high,technology.internet.http_method,1.0,no,representation.text.word,HUMIRA is a pharmaceutical drug brand name; FineType's http_method is wrong.,product,sherlock
sherlock,,,"[""CANCELED"", ""W 65-0"", ""W(3OT) 36-30"", ""L 21-42"", ""W 10-9"", ""L 27-30"", ""L 13-42"", ""W 38-20""]",representation.discrete.categorical,medium,representation.identifier.alphanumeric_id,0.8462,no,representation.discrete.categorical,"Sports game results like 'W 65-0', 'L 21-42', 'CANCELED'; categorical is correct over FineType's alphanumeric_id.",result,sherlock
sherlock,,,"[""Kovarus - Wells Fargo Racing Team"", ""Kovarus - Wells Fargo Racing Team"", ""Contra Costa Cycling Club"", ""Contra Costa Cycling Club""]",representation.text.entity_name,high,representation.text.entity_name,0.5556,yes,representation.text.entity_name,,team Name,sherlock
sherlock,,,"[""13,988'"", ""13,983'"", ""13,980'"", ""13,972'"", ""13,971'"", ""13,951'"", ""13,950'"", ""13,943'""]",representation.numeric.integer_number,medium,geography.location.country,0.8,no,representation.numeric.integer_number,"Elevation values in feet like '13,988'' are numeric; blind integer_number is more correct than FineType's entity_name.",elevation,sherlock
sherlock,,,"[""I Sturgeon"", ""Callan Murray (3)"", ""K Zechner"", ""Callan Murray (3)"", ""Ryan Munger (4)"", ""M Yeni"", ""Marthinus Mienie""]",identity.person.full_name,medium,geography.location.region,0.5,no,identity.person.full_name,Jockey/rider names with optional score in parens; FineType's icao_code is wrong.,jockey,sherlock
sherlock,,,"[""15"", ""79""]",representation.numeric.integer_number,low,representation.identifier.numeric_code,1.0,no,representation.numeric.integer_number,Values are small integers; FineType's entity_name is wrong.,region,sherlock
sherlock,,,"[""won"", ""won"", ""lost"", ""won"", ""won"", ""lost"", ""won"", ""lost"", ""won"", ""lost""]",representation.discrete.categorical,high,representation.discrete.ordinal,0.55,no,representation.discrete.categorical,"Game result labels (won, lost, draw); FineType's ordinal is wrong; categorical is correct.",result,sherlock
sherlock,,,"[""Laxmi Narain Mandir"", ""Laxmibai Nagar"", ""Lekhit Nagar"", ""Lodi Cplony Market"", ""Lodi House Hostel""]",geography.location.city,medium,representation.text.entity_name,0.4444,no,geography.location.city,Indian place/location names; blind city is more specific than FineType's entity_name.,area,sherlock
sherlock,,,"[""AS"", ""FPAY"", ""FPAY"", ""FPAY""]",representation.discrete.categorical,high,geography.transportation.icao_code,0.75,no,representation.discrete.categorical,Patent status codes AS/FPAY; FineType's icao_code is wrong.,code,sherlock
sherlock,,,"[""Offices of physicians"", ""General medical and surgical hospitals"", ""Outpatient care centers"", ""Colleges and universities"", ""Psychiatric and substance abuse hospitals""]",representation.text.plain_text,high,representation.text.entity_name,0.5,no,representation.text.plain_text,Industry sector descriptions; plain_text is more appropriate than entity_name.,industry,sherlock
