source,source_file,column_name,sample_values,blind_label,blind_confidence,finetype_label,finetype_confidence,agreement,final_label,reasoning,ground_truth_label,ground_truth_source
sherlock,,,"[""Marty Rance"", ""Gray"", ""Red Berry"", ""Thaddius"", ""Rodney"", ""Miriam Rance""]",identity.person.full_name,medium,representation.text.entity_name,0.5,no,representation.text.entity_name,"Values include single names like 'Gray', 'Thaddius', 'Rodney' which are not clearly full names; entity_name is more appropriate for this mixed set.",credit,sherlock
sherlock,,,"[""Connecticut"", ""Delaware"", ""Maryland"", ""New Jersey"", ""New York"", ""North Carolina"", ""Pennsylvania"", ""Virginia""]",geography.location.region,high,geography.location.region,0.625,yes,geography.location.region,,state,sherlock
sherlock,,,"[""Microcastle"", ""Madonna"", ""In Light"", ""The Moment EP"", ""Causers Of This"", ""Armchair Apocrypha"", ""Oohs & Aahs"", ""WALK THE MOON"", ""James Blake"", ""Ode to Sunshine"", ""1977"", ""Broken Side of Time"", ""Menos El Oso"", ""You Me And The Mountain - EP"", ""Citizen"", ""LP"", ""Sleep Paralysist - Single"", ""Life of Leisure - EP"", ""Animals"", ""Astro Coast""]",representation.text.entity_name,medium,representation.text.entity_name,0.3,yes,representation.text.entity_name,,album,sherlock
sherlock,,,"[""Seattle Seahawks (11)"", ""New England Patriots (1)"", ""Green Bay Packers"", ""Dallas Cowboys"", ""Denver Broncos"", ""Pittsburgh Steelers"", ""Detroit Lions"", ""Indianapolis Colts"", ""Cincinnati Bengals"", ""Baltimore Ravens"", ""Arizona Cardinals"", ""Philadelphia Eagles"", ""Carolina Panthers"", ""Kansas City Chiefs"", ""Houston Texans"", ""San Diego Chargers"", ""Buffalo Bills"", ""San Francisco 49ers"", ""Miami Dolphins"", ""Minnesota Vikings""]",representation.text.entity_name,medium,representation.text.entity_name,0.6,yes,representation.text.entity_name,,team,sherlock
sherlock,,,"[""Win"", ""Win"", ""Loss""]",representation.discrete.categorical,high,identity.person.last_name,0.333,no,representation.discrete.categorical,"Win/Loss are categorical outcome values, not last names; FineType's last_name is incorrect here.",result,sherlock
sherlock,,,"[""2000 Oct"", ""2001 Oct"", ""1994 Oct"", ""1994 Oct"", ""1995 Apr"", ""1995 Aug"", ""1995 Oct"", ""1996 Apr"", ""1996 Oct"", ""1997 Apr"", ""1997 Oct"", ""1998 Apr"", ""1998 Oct"", ""1999 Apr"", ""1999 Oct"", ""2000 Apr"", ""2000 Oct"", ""2001 Apr"", ""2001 Oct"", ""2002 Apr""]",datetime.date.month_year_abbrev,high,representation.identifier.alphanumeric_id,0.55,no,datetime.date.month_year_abbrev,Values like '2000 Oct' clearly follow year+month-abbreviation pattern; FineType misclassified as alphanumeric_id.,year,sherlock
sherlock,,,"[""Horror"", ""Slasher"", ""Vampire"", ""Horror"", ""Exploitation"", ""Vampire"", ""Vampire"", ""Vampire"", ""Ero/Horror"", ""Horror"", ""Found Footage"", ""Ero/Horror"", ""Ero/Horror"", ""Thriller"", ""Erotica"", ""Ero/Horror"", ""Horror"", ""Cult/Sci-Fi"", ""Com/Horror"", ""Vigilante""]",representation.discrete.categorical,high,identity.person.last_name,0.4,no,representation.discrete.categorical,"Values are film genre labels (Horror, Vampire, Thriller etc.); FineType's last_name is incorrect.",genre,sherlock
sherlock,,,"[""4-1"", ""4-2"", ""4-3"", ""4-4""]",representation.text.plain_text,medium,identity.medical.loinc,1.0,no,representation.text.plain_text,"Values like '4-1','4-2','4-3' are score or section codes, not LOINC medical codes; FineType is incorrect.",day,sherlock
sherlock,,,"[""F M Berry"", ""G Benoist"", ""G Benoist"", ""F M Berry"", ""F M Berry"", ""F M Berry"", ""S Foley (3)""]",identity.person.full_name,medium,representation.text.entity_name,0.714,no,identity.person.full_name,"Values are abbreviated person names (e.g. 'F M Berry', 'S Foley (3)'); full_name is more appropriate than entity_name.",jockey,sherlock
sherlock,,,"[""Atlus"", ""Curve Digital"", ""Devolver Digital"", ""Koei Tecmo"", ""Koei Tecmo"", ""Koei Tecmo"", ""Loot Entertainment"", ""Warner Bros"", ""10tons"", ""Honeyslug"", ""Frogmind Games"", ""Young Horses"", ""Idea Factory"", ""Idea Factory"", ""Fair Play Labs"", ""Disney Interactiv..."", ""OPQAM"", ""Spiky Fish Games"", ""Yacht Club Games"", ""NIS America""]",representation.text.entity_name,medium,representation.text.entity_name,0.125,yes,representation.text.entity_name,,publisher,sherlock
sherlock,,,"[""820.6"", ""216.3"", ""17,607.1"", ""86.4"", ""3,692.9"", ""8,169.9"", ""9,253.2""]",finance.currency.amount_comma,medium,finance.currency.amount,0.143,no,finance.currency.amount_comma,"Values use comma as thousands separator (e.g. '17,607.1', '3,692.9'); amount_comma is more precise than amount.",state,sherlock
sherlock,,,"[""Hydrobates castro"", ""Eurasian Sparrowhawk Accipiter nisus"", ""Plain Swift Apus unicolor"", ""Berthelot's Pipit Anthus berthelotii"", ""Island Canary Serinus canaria""]",representation.text.entity_name,medium,representation.text.entity_name,0.8,yes,representation.text.entity_name,,species,sherlock
sherlock,,,"[""Montclair, NJ"", ""North Adams, MA"", ""Brooklyn, NY"", ""Lancaster, PA"", ""Lake Forest, CA"", ""New York, NY"", ""New York, NY"", ""New York, NY"", ""Los Angeles, CA"", ""Los Angeles, CA"", ""New York, NY"", ""San Luis Obispo, CA"", ""San Francisco, CA"", ""Dearborn, MI"", ""New York, NY"", ""San Antonio, TX"", ""Los Angeles, CA"", ""Detroit, MI"", ""New York, NY"", ""San Francisco, CA""]",geography.address.full_address,high,representation.text.entity_name,1.0,no,geography.address.full_address,"Values follow 'City, ST' format (e.g. 'Montclair, NJ', 'New York, NY') which is a structured location address; full_address is more appropriate.",location,sherlock
sherlock,,,"[""1500 agents"", ""8000 agents"", ""8000 agents"", ""1500 agents"", ""200 agents""]",representation.text.plain_text,medium,container.array.whitespace_separated,1.0,no,representation.text.plain_text,"Values like '1500 agents' are descriptive text strings, not whitespace-separated arrays; FineType misclassified.",capacity,sherlock
sherlock,,,"[""The Noodle Ninja"", ""Glenorchy Holiday Park"", ""Traffic Design Group Ltd"", ""Babycity"", ""Paradise Safaris - Guided 4WD Trips"", ""Hair Extension Boutique""]",representation.text.entity_name,medium,representation.text.entity_name,0.5,yes,representation.text.entity_name,,company,sherlock
sherlock,,,"[""Commission on Security and Cooperation in Europe"", ""Birlik Party"", """", ""Erk Party"", ""Carnegie Endowment for International Peace""]",representation.text.entity_name,medium,representation.text.entity_name,0.4,yes,representation.text.entity_name,,affiliation,sherlock
sherlock,,,"[""None"", ""None"", ""None"", ""None"", ""None"", ""None"", ""None"", ""None"", ""None"", ""en"", ""None"", ""en"", ""None"", ""None"", ""en"", ""en"", ""en"", ""en"", ""en"", ""en""]",technology.code.locale_code,medium,geography.address.street_suffix,0.6,no,technology.code.locale_code,"Values include 'en' (language code) and 'None'; locale_code is correct, street_suffix is clearly wrong.",language,sherlock
sherlock,,,"[""MA"", ""OR"", ""IA"", ""NH"", ""FL"", ""LA"", ""FL"", ""VA"", ""IA"", ""OH"", ""MA"", ""AZ"", ""VA"", ""NY"", ""WV"", ""TX"", ""WI"", ""KS"", ""KY"", ""CA""]",geography.location.region,high,geography.location.country_code,0.85,no,geography.location.region,"Values are US state abbreviations (MA, OR, FL etc.) which are sub-national regions, not country codes; region is more accurate.",state,sherlock
sherlock,,,"[""69 kg"", ""69 kg""]",representation.scientific.measurement_unit,medium,identity.person.weight,1.0,no,identity.person.weight,FineType correctly identified '69 kg' as person weight; accepting finetype's label.,category,sherlock
sherlock,,,"[""Year of fee payment: 4"", ""Owner name: SAP SE, GERMANY Free format text: CHANGE OF NAME;ASSIGNOR:SAP AG;REEL/FRAME:033625/0334 Effective date: 20140707""]",representation.text.plain_text,high,container.array.whitespace_separated,0.5,no,representation.text.plain_text,"Values are long free-form text strings (patent/legal descriptions), not whitespace-separated arrays; FineType misclassified.",description,sherlock
sherlock,,,"[""Electricity/Gas"", ""Electricity/Gas"", ""Fire"", ""Garbage"", ""Garbage"", ""Internet Service Providers"", ""Phone Local/Long Distance"", ""Police"", ""TV/Cable/Satellite"", ""Water""]",representation.discrete.categorical,high,representation.text.entity_name,0.1,no,representation.discrete.categorical,Blind classification preferred; FineType's representation.text.entity_name does not fit the data pattern.,service,sherlock
sherlock,,,"[""Advertising, Public Relations, and Related Services"", ""Specialized Design Services"", ""Newspaper, Periodical, Book, and Directory Publishers"", ""Motion Picture and Video Industries"", ""Independent Artists, Writers, and Performers""]",representation.text.entity_name,medium,identity.person.full_name,0.4,no,representation.text.entity_name,"Values are industry sector names (e.g. 'Advertising, Public Relations...'), not person names; entity_name is correct.",industry,sherlock
sherlock,,,"[""VANGUARD NA\u2026"", ""GULFMARK OF\u2026"", ""ENBRIDGE EN\u2026"", ""ORION ENGIN\u2026"", ""SHIP FINANC\u2026""]",representation.text.entity_name,medium,geography.location.city,0.1,no,representation.text.entity_name,"Values are truncated company names (e.g. 'VANGUARD NA...'), not cities; entity_name is correct.",company,sherlock
sherlock,,,"[""Elite Casein Smooth Vanilla"", ""Elite Casein Rich Chocolate"", ""Elite Casein Cinnamon Bun"", ""Elite Casein Chocolate Peanut Butter""]",representation.text.entity_name,medium,representation.text.entity_name,0.75,yes,representation.text.entity_name,,product,sherlock
sherlock,,,"[""Pittsburgh, United States"", ""Cincinnati, United States"", ""Columbus, United States"", ""Atlantic City, United States"", ""Ibiza, Spain""]",geography.address.full_address,high,representation.text.entity_name,0.6,no,geography.address.full_address,"Values follow 'City, Country' format; full_address is more appropriate than entity_name.",location,sherlock
sherlock,,,"[""Open"", ""Closed"", ""Closed""]",representation.discrete.categorical,high,identity.person.last_name,0.667,no,representation.discrete.categorical,"Open/Closed are status categorical values, not last names; FineType is incorrect.",status,sherlock
sherlock,,,"[""Lino Lakes"", ""Flower Mound"", ""North Oaks"", ""Golden Valley"", ""Saint Cloud""]",geography.location.city,high,representation.text.entity_name,0.1,no,geography.location.city,"Values are US city names (Lino Lakes, Flower Mound, Saint Cloud); city is more appropriate than entity_name.",city,sherlock
sherlock,,,"[""Alabama"", ""Oregon"", ""Florida State"", ""Ohio State"", ""Baylor"", ""Clemson"", ""Stanford"", ""Auburn"", ""LSU"", ""Oklahoma"", ""Oklahoma St."", ""Texas A&M"", ""South Carolina"", ""Missouri"", ""Miami (FL)"", ""Michigan St."", ""UCF"", ""Louisville"", ""UCLA"", ""Wisconsin""]",representation.text.entity_name,medium,representation.text.entity_name,0.1,yes,representation.text.entity_name,,team,sherlock
sherlock,,,"[""Tuck & Patti"", ""Tuck & Patti"", ""Tuck & Patti"", ""Tuck & Patti"", ""Tuck & Patti"", ""Tuck & Patti"", ""Tuck & Patti"", ""Tuck & Patti"", ""Tuck & Patti"", ""Tuck & Patti"", ""Tuck & Patti"", ""Tuck & Patti"", ""Tuck & Patti"", ""Tuck & Patti""]",representation.text.entity_name,high,representation.text.entity_name,1.0,yes,representation.text.entity_name,,artist,sherlock
sherlock,,,"[""System / admin update -"", ""System / admin update -"", ""System / admin update -"", ""System / admin update -"", ""System / admin update -"", """", """", ""System / admin update -"", ""System / admin update -""]",representation.text.plain_text,high,representation.text.entity_name,0.778,no,representation.text.plain_text,Blind classification preferred; FineType's representation.text.entity_name does not fit the data pattern.,notes,sherlock
sherlock,,,"[""Abel Molina"", ""Damian Martinez"", ""Francisco Calderon"", ""Gilbert Ortiz"", ""Gilbert Ortiz"", ""Gilbert Ortiz"", ""Alfonso Lujan"", ""Gilbert Ortiz""]",identity.person.full_name,high,representation.text.entity_name,0.625,no,identity.person.full_name,"Values are clearly full person names (Abel Molina, Francisco Calderon, Gilbert Ortiz); full_name is more appropriate than entity_name.",jockey,sherlock
sherlock,,,"[""Sunday"", ""Monday"", ""Tuesday"", ""Wednesday"", ""Thursday"", ""Friday"", ""Saturday"", ""Sunday"", ""Thursday"", ""Friday"", ""Saturday"", ""Sunday"", ""Monday"", ""Tuesday"", ""Tuesday"", ""Wednesday"", ""Thursday"", ""Friday"", ""Saturday"", ""Sunday""]",datetime.component.day_of_week,high,datetime.component.day_of_week,0.85,yes,datetime.component.day_of_week,,day,sherlock
sherlock,,,"[""McCoy, Michelle A.; Levett-Jones, Tracy; Pitt, Victoria"", ""Sinclair, P. M.; Bowen, L.; Donkin, B."", ""Bonney, Andrew; Albert, George; Hudson, J. Nicky; Knight-Billington, Patricia"", ""Yucra, Eduardo A.; Yuz, Juan I.; Goodwin, Graham C."", ""Calabria, Biana; Clifford, Anton; Shakeshaft, Anthony; Allan, Julaine; Bliss, Donna; Doran, Christopher"", ""Byrnes, Joshua; Shakeshaft, Anthony; Petrie, Dennis; Doran, Chistopher"", ""Gunaratnam, Praveena; Massey, Peter; Eastwood, Keith; Durrhein, David; Graves, Stephen; Coote, Diana; Fisher, Louise"", ""Aguilera, Ricardo P.; Quevedo, Daniel E.; V\u00e1zquez , Sergio; Franquelo, Leopoldo"", ""Aboul-Fadl, Tarek; Al-Hamad, Suliman S.; Lee, Kevin; Li, Nan; Gary, Bernard D.; Keeton, Adam B.; Piazza, Gary A.; Abdel-Hamid, Mohammed K."", ""Fradgley, Elizabeth A.; Paul, Christine L.; Bryant, Jamie; Roos, Ian A.; Henskens, Frans A.; Paul, David J."", ""Ruppert, Michael G.; Fairbairn, Matthew W.; Moheimani, S. O. Reza"", ""Fowler, Anthony G.; Moheimani, S. O. Reza; Behrens, Sam"", ""Shah, Milinkumar T.; Utikar, Ranjeet P.; Tade, Moses O.; Evans, Geoffrey M.; Pareek, Vishnu K."", ""Solowski, Wojciech Tomasz; Sloan, Scott William"", ""Cuzick, Jack; Sestak, Ivana; Mershon, John; Mitlak, Bruce H.; Powles, Trevor; Veronesi, Umberto; Vogel, Victor; Wickerham, D. Lawrence; Bonanni, Bernardo; Costantino, Joseph P.; Cummings, Steve; DeCensi, Andrea; Dowsett, Mitch; Forbes, John F.; Ford, Leslie; LaCroix, Andrea Z."", ""Afentakis, Maria; Dowsett, Mitch; Sestak, Ivana; Salter, Janine; Howell, Tony; Buzdar, Aman; Forbes, John; Cuzick, Jack"", ""Goldhirsch, A.; Winer, E. P.; Bonnefoi, Herv\u00e9 et al."", ""Rosenberg, Helen F.; Dyer, Kimberly D.; Foster, Paul S."", ""Marelli, Dami\u00e1n; You, Keyou; Fu, Minyue"", ""Han, Chunyan; Zhang, Huanshui; Fu, Minyue""]",representation.text.plain_text,high,technology.internet.user_agent,1.0,no,representation.text.plain_text,"Values are academic author citation lists (Last, First; Last, First format), not HTTP user-agent strings; FineType is incorrect.",creator,sherlock
sherlock,,,"[""Mare"", ""Gelding"", ""Gelding"", ""Gelding"", ""Mare"", ""Gelding"", ""Mare"", ""Gelding"", ""Mare"", ""Colt"", ""Filly"", ""Gelding"", ""Mare"", ""Gelding"", ""Mare"", ""Mare"", ""Mare"", ""Mare"", ""Gelding"", ""Mare""]",representation.discrete.categorical,high,geography.location.country,0.4,no,representation.discrete.categorical,"Values are horse sex/type categories (Mare, Gelding, Colt, Filly); categorical is correct, country is wrong.",gender,sherlock
sherlock,,,"[""ref"", ""eq_ref""]",representation.discrete.categorical,medium,representation.discrete.categorical,0.5,yes,representation.discrete.categorical,,type,sherlock
sherlock,,,"[""PDF"", ""Hardcopy (shipping and handling)""]",representation.discrete.categorical,medium,representation.text.entity_name,0.5,no,representation.discrete.categorical,"Values are document format types (PDF, Hardcopy); categorical is more appropriate than entity_name.",format,sherlock
sherlock,,,"[""Manchester City "", ""Chelsea "", ""Tottenham "", ""Liverpool "", ""Aston Villa "", ""Sunderland "", ""Manchester United "", ""Birmingham City "", ""Stoke City "", ""West Bromwich Albion "", ""Wolves "", ""Bolton "", ""Newcastle "", ""Everton "", ""Fulham "", ""West Ham "", ""Blackpool "", ""Wigan  "", ""Arsenal "", ""Blackburn Rovers ""]",representation.text.entity_name,high,representation.text.entity_name,0.35,yes,representation.text.entity_name,,team,sherlock
sherlock,,,"[""1"", ""2"", ""3"", ""4"", ""5"", ""6"", ""7"", ""8"", ""9"", ""10""]",representation.identifier.increment,high,representation.identifier.numeric_code,0.05,no,representation.identifier.increment,Values are sequential integers 1-10; increment is more appropriate than numeric_code for ordered sequence.,rank,sherlock
sherlock,,,"[""AUSTRALIA"", ""BELGIUM"", ""BRAZIL"", ""CANADA"", ""CHINA"", ""COLOMBIA"", ""DENMARK"", ""GERMANY"", ""INDIA"", ""ITALY"", ""JAPAN"", ""KOREA"", ""MALAYSIA"", ""NETHERLANDS"", ""PERU"", ""POLAND"", ""SPAIN"", ""SRI LANKA"", ""SWEDEN"", ""USA""]",geography.location.country,high,representation.scientific.protein_sequence,0.5,no,geography.location.country,"Values are clearly country names in uppercase (AUSTRALIA, BELGIUM, BRAZIL etc.); FineType's protein_sequence classification is incorrect.",country,sherlock
sherlock,,,"[""Qatar"", ""Kuwait"", ""Netherlands Antilles"", ""United Arab Emirates"", ""Bahrain"", ""Trinidad and Tobago"", ""Luxembourg"", ""Aruba"", ""Falkland Islands (Malvinas)"", ""United States"", ""Australia"", ""Canada"", ""Saudi Arabia"", ""Oman"", ""Brunei Darussalam"", ""Nauru"", ""Faeroe Islands"", ""Montserrat"", ""Estonia"", ""Singapore""]",geography.location.country,high,geography.location.country,0.3,yes,geography.location.country,,country,sherlock
sherlock,,,"[""Electronic Arts"", ""Electronic Arts"", ""Electronic Arts Victor""]",representation.text.entity_name,high,representation.text.entity_name,1.0,yes,representation.text.entity_name,,publisher,sherlock
sherlock,,,"[""JGroups"", ""JGroups""]",representation.text.entity_name,medium,identity.person.last_name,1.0,no,representation.text.entity_name,Blind classification preferred; FineType's identity.person.last_name does not fit the data pattern.,component,sherlock
sherlock,,,"[""9780520225602"", ""9780880013512"", ""9780486433912"", ""9780393320275"", ""9780691029658"", ""9780140448061"", ""9780679733782"", ""9781568364377""]",identity.commerce.isbn,high,identity.commerce.ean,0.375,no,identity.commerce.isbn,Values are 13-digit ISBN codes (starting with 978); isbn is more specific and correct than ean.,isbn,sherlock
sherlock,,,"[""Route 5"", ""Route 5"", ""Route 16"", ""Route 16""]",representation.text.plain_text,medium,representation.text.entity_name,1.0,no,representation.text.plain_text,"Values are route designations (Route 5, Route 16); plain_text is appropriate as these don't fit a specific taxonomy type.",area,sherlock
sherlock,,,"[""Jonathan Firey"", ""Brentwood Ensemble"", ""Michael Thomas"", ""Jadon Lavik & Fernando Ortega"", ""Dick Tunney"", ""Star Song Ensemble"", ""Maranatha Ensemble"", ""Curb Artists"", ""Chris Rice"", ""Dino Kartsonakis"", ""Greg Buchanan"", ""Dennis Dearing & Shalaine Martin"", ""Vital Ensemble"", ""MercyMe"", ""Michael W Smith & Gary Chapman"", ""Linda Mckechnie & Don Marsh Orchestra"", ""Amade' String Orchestra"", ""Sandi Patty"", ""Kurt Kaiser"", ""Point To Point Orchestra""]",identity.person.full_name,medium,representation.text.entity_name,0.65,no,representation.text.entity_name,"Values include both individual names and ensemble names (Brentwood Ensemble, Star Song Ensemble, Point To Point Orchestra); entity_name is more appropriate than full_name.",artist,sherlock
sherlock,,,"[""5:22"", ""5:08"", ""5:30"", ""4:14"", ""4:37"", ""4:18""]",datetime.time.hm_24h,medium,representation.numeric.integer_number,0.5,no,datetime.time.hm_24h,"Values like '5:22', '4:14' are time/duration in M:SS or H:MM format; hm_24h is more appropriate than integer_number.",duration,sherlock
sherlock,,,"["""", ""R"", """", ""R"", """", ""R"", ""R"", """", ""R"", """", ""R"", """", ""R"", """", ""L"", """", ""L"", """", ""L"", """"]",representation.discrete.categorical,medium,representation.discrete.categorical,0.8,yes,representation.discrete.categorical,,class,sherlock
sherlock,,,"[""NIAG"", ""NIAG""]",representation.identifier.alphanumeric_id,low,geography.transportation.icao_code,1.0,no,representation.identifier.alphanumeric_id,NIAG is a short code but not clearly an ICAO airport code; alphanumeric_id is safer given only 2 identical values.,club,sherlock
sherlock,,,"[""Ulmaceae"", ""Ulmaceae"", ""Ulmaceae"", ""Ulmaceae"", ""Ulmaceae"", ""Ulmaceae"", ""Ulmaceae"", ""Ulmaceae"", ""Ulmaceae"", ""Ulmaceae"", ""Ulmaceae"", ""Ulmaceae"", ""Ulmaceae"", ""Ulmaceae"", ""Ulmaceae"", ""Ulmaceae"", ""Ulmaceae"", ""Ulmaceae"", ""Ulmaceae"", ""Ulmaceae""]",representation.text.entity_name,high,geography.location.country,1.0,no,representation.text.entity_name,"Values are a botanical family name (Ulmaceae); entity_name is correct, country is wrong.",family,sherlock
sherlock,,,"[""Commission on Security and Cooperation in Europe"", ""Commission on Security and Cooperation in Europe"", ""Commission on Security and Cooperation in Europe"", ""U.S. House of Represenatives"", ""U.S. Department of State""]",representation.text.entity_name,medium,representation.discrete.categorical,0.6,no,representation.text.entity_name,"Values are organization names (Commission on Security..., U.S. Department of State); entity_name is correct, categorical is wrong.",affiliation,sherlock
sherlock,,,"[""Penny Black (JDW)"", ""The Porterhouse (Temple Bar)"", ""Zum Nussbaum"", ""Fat Cat (Kelham Island)"", ""Kelham Island Tavern"", ""Hillsborough Hotel (Wood Street)"", ""Gardeners Rest (Sheffield)"", ""Devonshire Cat"", ""Three Legged Mare (York)"", ""Briardene"", ""Potter (Free)"", ""Crown"", ""Crescent"", ""Kings Arms"", ""New Oxford"", ""Vat and Fiddle (Castle Rock)"", ""Olde Trip To Jerusalem (Greene King)"", ""Roebuck Inn (JDW)"", ""Lion Inn"", ""Fox & Crown (Alcazar)""]",representation.text.entity_name,high,representation.text.entity_name,0.55,yes,representation.text.entity_name,,name,sherlock
sherlock,,,"[""Argentina"", ""Brazil"", ""Canada"", ""China"", ""India"", ""Mexico"", ""United States""]",geography.location.country,high,geography.location.country,0.857,yes,geography.location.country,,country,sherlock
sherlock,,,"[""ANCHORAGE"", ""ANCHORAGE"", ""JUNEAU"", ""ANCHORAGE"", ""JEFFERSON"", ""JEFFERSON"", ""JEFFERSON"", ""JEFFERSON"", ""MONTGOMERY"", ""JEFFERSON"", ""JEFFERSON"", ""JEFFERSON"", ""BENTON"", ""UNION"", ""SEBASTIAN"", ""SEBASTIAN"", ""PULASKI"", ""PULASKI"", ""SEBASTIAN"", ""MARICOPA""]",geography.location.city,medium,geography.location.country,0.4,no,geography.location.city,"Values appear to be US county/borough names (JEFFERSON, MONTGOMERY, ANCHORAGE, MARICOPA); city is a closer fit than country.",county,sherlock
sherlock,,,"[""Commission on Security and Cooperation in Europe"", ""Commission on Security and Cooperation in Europe"", ""Commission on Security and Cooperation in Europe"", ""Population, Refugees and Migration, U.S. Department of State"", ""UNHCR Washington Regional Office"", ""Coalition for a Democratic Syria"", ""Refugees International"", """", ""Syrian American Medical Society"", """"]",representation.text.entity_name,medium,representation.text.entity_name,0.3,yes,representation.text.entity_name,,affiliation,sherlock
sherlock,,,"[""198"", ""213"", ""209"", ""209"", ""201"", ""198"", ""234""]",representation.numeric.integer_number,high,representation.identifier.numeric_code,1.0,no,representation.numeric.integer_number,"Values are plain integers (198, 213, 209, 234); integer_number is more appropriate than numeric_code.",weight,sherlock
sherlock,,,"[""Mr W Easterby (7)"", ""Nick Slatter (7)"", ""Mr S P Bowen (7)"", ""Mr H Derham (3)"", ""Jake Greenall (3)"", ""James Best (3)"", ""Mr B Gibbs (7)"", ""Joshua Moore"", ""Alan Johns (10)"", ""Giles Hawkins (3)"", ""Mr Joshua Newman (7)"", ""Jack Sherwood (7)"", ""Mr Charlie Deutsch (7)""]",identity.person.full_name,medium,representation.text.entity_name,0.923,no,identity.person.full_name,"Values are jockey names with weight allowances (e.g. 'Mr W Easterby (7)', 'Jake Greenall (3)'); full_name is more appropriate.",jockey,sherlock
sherlock,,,"[""UMass Lowell vs Dartmouth"", ""Dartmouth vs Connecticut"", ""Dartmouth vs Vanderbilt"", ""New Hampshire vs Dartmouth"", ""Holy Cross vs Dartmouth"", ""Dartmouth vs Memphis"", ""Northeastern vs Dartmouth"", ""Colgate vs Dartmouth"", ""Vermont vs Dartmouth"", ""Sacred Heart vs Dartmouth"", ""Dartmouth vs Northeastern"", ""Bryant vs Dartmouth"", ""Sacred Heart vs Dartmouth"", ""UMass Lowell vs Dartmouth"", ""Hofstra vs Dartmouth"", ""Princeton vs Dartmouth"", ""Dartmouth vs Brown"", ""Dartmouth vs Maine"", ""Princeton vs Dartmouth"", ""Princeton vs Dartmouth""]",representation.text.plain_text,high,representation.text.entity_name,0.45,no,representation.text.plain_text,Values are sports matchup descriptions ('UMass Lowell vs Dartmouth'); plain_text is appropriate as these don't fit a specific type.,description,sherlock
sherlock,,,"[""31.6"", ""32.4""]",representation.numeric.decimal_number,high,representation.numeric.decimal_number,1.0,yes,representation.numeric.decimal_number,,weight,sherlock
sherlock,,,"[""May 10, 1966"", ""September 29, 1963"", ""March 31, 1965"", ""January 3, 1960"", ""June 2, 1965"", ""October 31, 1963"", ""October 10, 1956"", ""May 12, 1957"", ""December 1, 1962"", ""January 27, 1955"", ""April 29, 1960"", ""January 29, 1959"", ""November 29, 1959"", ""March 5, 1956"", ""May 10, 1965"", ""November 18, 1951"", ""March 5, 1966"", ""March 18, 1960"", ""October 4, 1964"", ""March 9, 1964""]",datetime.date.long_full_month,high,datetime.date.long_full_month,1.0,yes,datetime.date.long_full_month,,birth Date,sherlock
