source,source_file,column_name,sample_values,blind_label,blind_confidence,finetype_label,finetype_confidence,agreement,final_label,reasoning,ground_truth_label,ground_truth_source
sherlock,,,"[""stop persistence"", ""start persistence"", ""wait until queues are drained"", ""to set checkpoint_param, flush_param, and tap_param. This changes how or when persistence occurs.""]",representation.text.plain_text,high,container.array.whitespace_separated,0.5,no,representation.text.plain_text,Values are natural language command descriptions; FineType's whitespace-separated array classification is wrong.,description,sherlock
sherlock,,,"[""Men"", ""Women""]",identity.person.gender,medium,identity.person.last_name,0.5,no,identity.person.gender,Men and Women are gender category labels; gender is correct.,gender,sherlock
sherlock,,,"[""5"", ""5"", ""5"", ""5"", ""5"", ""5"", ""5"", ""5"", ""5"", ""5""]",representation.numeric.integer_number,high,representation.boolean.initials,1.0,no,representation.numeric.integer_number,"All values are the digit 5 (or 7), clearly numeric integers, not boolean initials.",duration,sherlock
sherlock,,,"[""Catholic"", ""Mainline Protestant"", ""Evangelical Protestant"", ""Other"", ""Orthodox"", ""None""]",representation.discrete.categorical,high,geography.location.region,0.3333,no,representation.discrete.categorical,,religion,sherlock
sherlock,,,"[""9-12"", ""9-12"", ""9-12"", ""K-8"", ""9-12"", ""K-8"", ""K-8"", ""K-8""]",representation.text.plain_text,medium,representation.discrete.categorical,0.5,no,representation.discrete.categorical,,grades,sherlock
sherlock,,,"["""", ""A. Single-Family Residences"", ""B. Multi-Family Residences"", ""C. Vacant Lots"", ""D. Rural Real(Taxable)"", ""F1. Commercial Real"", ""F2. Industrial Real"", ""G. Oil, Gas, Minerals"", ""J. Utilities"", ""L1. Commercial Personal""]",representation.discrete.categorical,medium,geography.location.region,0.1389,no,representation.discrete.categorical,"Property type labels (A. Single-Family Residences, etc.) are categorical values, not geographic regions.",category,sherlock
sherlock,,,"[""Rock Tunnel (B1f)"", ""Rock Tunnel (B2f)"", ""Victory Road (1f)"", ""Victory Road (2f)"", ""Victory Road (3f)""]",representation.text.plain_text,medium,representation.text.entity_name,1.0,no,representation.text.entity_name,"Game area names (Rock Tunnel, Victory Road) are proper noun entity names; entity_name is appropriate.",area,sherlock
sherlock,,,"[""Residence"", ""Socialize"", ""Family Values""]",representation.text.plain_text,medium,geography.location.region,0.3333,no,representation.discrete.categorical,"Values are lifestyle/purpose category labels, not geographic regions.",religion,sherlock
sherlock,,,"[""MS"", ""FL"", ""SC"", ""TX"", ""PA"", ""NJ"", ""LA"", ""MD"", ""TX"", ""TX""]",geography.location.region,high,geography.location.country_code,1.0,no,geography.location.region,"Two-letter US state codes (MS, FL, SC, TX) are state/region identifiers, not country codes.",state,sherlock
sherlock,,,"[""strikeout"", ""third base to first base"", ""ground ball single, center field"", ""out, right field"", ""pitcher to first base"", ""strikeout"", ""out, shortstop"", ""left-center field single, left field"", ""single, center field""]",representation.text.plain_text,high,container.array.whitespace_separated,0.5556,no,representation.text.plain_text,Values are natural language baseball play descriptions; FineType's whitespace array classification is wrong.,result,sherlock
sherlock,,,"[""Manchester, Greater Manchester, M24 Full Address"", ""Wolverhampton, West Midlands, WV3 Full Address"", ""Ilfracombe, Devon, EX34 Full Address"", ""South Molton, Devon, EX36 Full Address"", ""Preston, Lancashire, PR1 Full Address""]",geography.address.full_address,high,geography.address.full_address,0.7,yes,geography.address.full_address,,address,sherlock
sherlock,,,"["""", ""47,739"", ""47"", ""37.1"", ""2.7"", ""41,511"", ""20,630""]",representation.numeric.decimal_number,low,representation.numeric.decimal_number_comma,0.4286,no,representation.numeric.decimal_number_comma,"Values include comma-formatted numbers (47,739; 41,511) mixed with plain decimals; decimal_number_comma better captures the dominant format.",county,sherlock
sherlock,,,"[""Frank Piemme"", ""Willard J Lamb"", ""Jurgen B Schmidt"", ""Fred Goldner"", ""Baker L Shannon""]",identity.person.full_name,high,representation.text.entity_name,1.0,no,identity.person.full_name,"Frank Piemme, Willard J Lamb, etc. are clearly personal names; full_name is more specific than entity_name.",name,sherlock
sherlock,,,"[""    Less Than One Year "", ""    1 "", ""    2 "", ""    3 "", ""    4 "", ""    5 "", ""    6 "", ""    7 "", ""    8 "", ""    9 ""]",representation.text.plain_text,medium,representation.file.file_size,0.95,no,representation.text.plain_text,"Values are year/age labels with text ('Less Than One Year', '1', '2') padded with spaces; plain_text is correct.",age,sherlock
sherlock,,,"[""Jerusalem (Israel)"", ""Al Jizah (Egypt)""]",geography.location.city,medium,representation.text.entity_name,1.0,no,geography.location.city,"Values are city names with country qualifiers in parentheses (Jerusalem (Israel), Al Jizah (Egypt)); city is more appropriate.",location,sherlock
sherlock,,,"[""Curtis Price, Jr. & The P.K. Trio"", ""Pastor Daryl Coley"", ""Dorothy Collins"", ""Pastor Kirk Whalum"", ""Rod McGaha"", ""Scott Mateer"", ""Travis Bridges"", ""Wayne Barrett"", ""Eric Warren"", ""Donny Hathaway""]",identity.person.full_name,medium,geography.location.region,0.125,no,identity.person.full_name,"Values are mostly personal names of musicians (Curtis Price Jr., Dorothy Collins, Donny Hathaway); full_name is more specific.",artist,sherlock
sherlock,,,"[""M8 nut"", ""M8 washer"", ""M8\u00d730 mudguard / fender washer"", ""M4\u00d720 bolt"", ""M4 nut"", ""M4 washer"", ""M3\u00d710 bolt"", ""M3\u00d725 bolt"", ""M3\u00d740 bolt"", ""M3 washer""]",representation.text.plain_text,high,representation.text.entity_name,0.7,no,representation.text.plain_text,"Values are hardware component descriptions (M8 nut, M8 washer, M4×20 bolt); plain_text is more appropriate for descriptive part names.",description,sherlock
sherlock,,,"[""8"", ""5"", ""3"", ""7"", ""3"", ""3"", ""4"", ""5"", ""8"", ""3""]",representation.numeric.integer_number,high,representation.identifier.numeric_code,0.025,no,representation.numeric.integer_number,Values are small count integers (0-12); FineType's region classification is clearly wrong.,plays,sherlock
sherlock,,,"[""IMPV"", ""EPAM"", ""APOG"", ""SAVE"", ""ACHC""]",representation.identifier.alphanumeric_id,high,geography.transportation.icao_code,1.0,no,representation.identifier.alphanumeric_id,"IMPV, EPAM, APOG, SAVE, ACHC are stock ticker symbols; alphanumeric_id is correct.",symbol,sherlock
sherlock,,,"[""3504"", ""3693"", ""3436"", ""3433"", ""3449"", ""4341"", ""4354"", ""4312"", ""4425"", ""3850""]",representation.numeric.integer_number,high,representation.identifier.numeric_code,1.0,no,representation.numeric.integer_number,"Values are 4-digit numbers in the 3000-4400 range, likely measurements or scores, not identifier codes.",weight,sherlock
sherlock,,,"[""--"", ""1998 - 2001""]",representation.text.plain_text,low,representation.boolean.terms,0.5,no,representation.text.plain_text,Values are year range strings or null indicators; plain_text is correct.,duration,sherlock
sherlock,,,"[""06 - 08"", ""07 - 08"", ""07 - 08"", ""07 - 08""]",representation.text.plain_text,low,geography.address.postal_code,1.0,no,representation.text.plain_text,"Values are year range shorthand strings (06-08, 07-08); FineType's postal_code classification is wrong.",grades,sherlock
