source,source_file,column_name,sample_values,blind_label,blind_confidence,finetype_label,finetype_confidence,agreement,final_label,reasoning,ground_truth_label,ground_truth_source
sherlock,,,"[""G"", ""F"", ""C"", ""G"", ""F-G"", ""G"", ""G"", ""G"", ""G""]",representation.discrete.categorical,medium,representation.discrete.ordinal,0.7778,no,representation.discrete.categorical,"FineType says ordinal; letter grades G, F, C are categorical, not ordinal numbers. Categorical is correct.",position,sherlock
sherlock,,,"[""Cancer Cell Biology"", ""Cancer Genetics"", ""Oncology and Carcinogenesis not elsewhere classified""]",representation.text.plain_text,medium,representation.text.entity_name,1.0000,no,representation.text.plain_text,"FineType prediction (representation.text.entity_name, conf=1.00) has low confidence; blind classification preferred.",description,sherlock
sherlock,,,"[""A male Imperial Assassin found at the Dawnstar Sanctuary."", ""A Nord Assassin found at the Dawnstar Sanctuary."", ""A Nord Assassin found at the Dawnstar Sanctuary.""]",representation.text.sentence,high,representation.text.paragraph,1.0000,no,representation.text.sentence,"FineType prediction (representation.text.paragraph, conf=1.00) has low confidence; blind classification preferred.",description,sherlock
sherlock,,,"[""Overall Side"", ""Driver Head Protection"", ""Rear Passenger Head Protection"", ""Driver Head and Neck"", ""Rear Passenger Head and Neck"", ""Driver Torso""]",representation.text.plain_text,medium,representation.text.entity_name,0.6923,no,representation.text.plain_text,"FineType prediction (representation.text.entity_name, conf=0.69) has low confidence; blind classification preferred.",type,sherlock
sherlock,,,"[""Alabama"", ""Oregon"", ""Florida State"", ""Ohio State"", ""Baylor"", ""Clemson"", ""Stanford"", ""Auburn"", ""LSU"", ""Oklahoma""]",representation.text.entity_name,high,representation.text.entity_name,0.1000,yes,representation.text.entity_name,,team,sherlock
sherlock,,,"[""Netbsd"", ""Netbsd"", ""Netbsd"", ""Netbsd"", ""Netbsd"", ""Netbsd"", ""Netbsd""]",representation.text.word,medium,representation.text.entity_name,1.0000,no,representation.text.word,FineType says entity_name; repeated 'Netbsd' is an OS/product name. Word or entity_name both fit; keeping entity_name as it's a named product.,product,sherlock
sherlock,,,"[""Mon"", ""Tues"", ""Wed"", ""Thurs"", ""Fri"", ""Sat"", ""Sun""]",datetime.component.day_of_week,high,identity.person.last_name,0.0714,no,datetime.component.day_of_week,"FineType prediction (identity.person.last_name, conf=0.07) has low confidence; blind classification preferred.",order,sherlock
sherlock,,,"[""Japanese"", ""French"", ""German"", ""Korean""]",representation.text.plain_text,high,geography.location.country,0.5000,no,representation.text.plain_text,"FineType says country; Japanese, French, German, Korean are language names not countries (though overlap exists). Plain text is more accurate.",language,sherlock
sherlock,,,"[""fly ball double, left field"", ""line drive out, shortstop"", ""fly ball single, left field"", ""shortstop to first base, ground ball"", ""walk""]",representation.text.sentence,high,container.array.whitespace_separated,0.4500,no,representation.text.sentence,"FineType prediction (container.array.whitespace_separated, conf=0.45) has low confidence; blind classification preferred.",result,sherlock
sherlock,,,"[""None"", ""0.0"", ""0.0"", ""0.0""]",representation.numeric.decimal_number,medium,representation.numeric.decimal_number,0.7500,yes,representation.numeric.decimal_number,,rank,sherlock
sherlock,,,"[""IN PROGRESS"", ""DONE""]",representation.discrete.categorical,high,representation.alphanumeric.alphanumeric_id,0.5000,no,representation.discrete.categorical,"FineType prediction (representation.alphanumeric.alphanumeric_id, conf=0.50) has low confidence; blind classification preferred.",status,sherlock
sherlock,,,"[""FPAY"", ""FPAY"", ""REMI"", ""LAPS"", ""FP""]",representation.identifier.alphanumeric_id,medium,geography.transportation.icao_code,0.8000,no,representation.identifier.alphanumeric_id,"FineType says icao_code; FPAY, REMI, LAPS, FP are payment/patent codes. Alphanumeric_id is more appropriate.",code,sherlock
sherlock,,,"[""8.8"", ""6.1"", ""7.12"", ""5.1"", ""12.11"", ""9.14"", ""1.8"", ""8.6"", ""2.12"", ""3.5""]",representation.numeric.decimal_number,high,representation.numeric.decimal_number,1.0000,yes,representation.numeric.decimal_number,,weight,sherlock
sherlock,,,"[""FL"", ""NC"", ""CA"", ""PA"", ""CA"", ""MT"", ""PA"", ""FL"", ""IN"", ""CA""]",geography.location.region,high,geography.location.country_code,1.0000,no,geography.location.region,Both agree - FineType says country_code but US state abbreviations are regions. Region is correct.,state,sherlock
sherlock,,,"[""Open Studio 2 visit"", ""Open Studio 5 visit"", ""Open Studio unlimit"", ""Open Studio 2 visit"", ""Open Studio 5 visit"", ""Open Studio unlimit""]",representation.text.plain_text,medium,representation.text.entity_name,1.0000,no,representation.text.plain_text,FineType says entity_name; service plan descriptions. Plain text is correct.,description,sherlock
sherlock,,,"[""TARRANT"", """", """", """", """", """", """", """"]",representation.text.word,low,representation.boolean.initials,0.8750,no,geography.location.region,FineType says initials (wrong for county name TARRANT); region/county is more accurate.,county,sherlock
sherlock,,,"[""Dato Mancante"", ""Via Manicone"", ""Via Uria Foce Varano""]",geography.address.street_name,medium,identity.person.full_name,0.6667,no,geography.address.street_name,FineType says full_name; Italian street addresses like 'Via Manicone'. Street_name is correct.,address,sherlock
sherlock,,,"[""371"", ""265"", ""39"", ""11"", ""4"", ""1"", ""5"", ""1"", ""6"", ""704""]",representation.numeric.integer_number,high,representation.identifier.numeric_code,0.5455,no,representation.numeric.integer_number,"FineType prediction (representation.identifier.numeric_code, conf=0.55) has low confidence; blind classification preferred.",plays,sherlock
sherlock,,,"["""", ""spew on lap 3"", ""3 pints, 3 miles""]",representation.text.plain_text,low,container.array.whitespace_separated,0.6667,no,representation.text.plain_text,FineType says whitespace_separated; notes like 'spew on lap 3'. Plain text is correct.,notes,sherlock
sherlock,,,"["""", ""F"", """", ""F"", """", ""F"", ""F""]",representation.discrete.categorical,low,representation.boolean.initials,0.8000,no,identity.person.gender,FineType says boolean.initials; 'F' values are gender codes. Gender or gender_code is more accurate.,sex,sherlock
sherlock,,,"[""Alabama"", ""Alaska"", ""Arizona"", ""Arkansas"", ""California"", ""Colorado"", ""Connecticut"", ""Delaware"", ""District of Columbia"", ""Florida""]",geography.location.region,high,geography.location.country,0.4000,no,geography.location.region,"FineType prediction (geography.location.country, conf=0.40) has low confidence; blind classification preferred.",state,sherlock
sherlock,,,"[""0.0"", ""0.0"", ""170.0"", ""199.2"", ""171.3""]",representation.numeric.decimal_number,high,representation.numeric.decimal_number,1.0000,yes,representation.numeric.decimal_number,,elevation,sherlock
sherlock,,,"[""Chana Rothman"", ""Chana Rothman"", ""Chana Rothman"", ""Chana Rothman"", ""Chana Rothman"", ""Chana Rothman""]",identity.person.full_name,high,geography.location.region,1.0000,no,identity.person.full_name,"FineType prediction (geography.location.region, conf=1.00) has low confidence; blind classification preferred.",artist,sherlock
sherlock,,,"[""33.2"", ""30.0""]",representation.numeric.decimal_number,high,representation.numeric.decimal_number,1.0000,yes,representation.numeric.decimal_number,,weight,sherlock
sherlock,,,"[""Drama"", ""Fairy tale"", ""Fairy tale"", ""Fairy tale collection"", ""Poems"", ""Poems"", ""Poems"", ""Poems"", ""Poems"", ""Poems""]",representation.discrete.categorical,high,representation.text.entity_name,0.7500,no,representation.discrete.categorical,"FineType prediction (representation.text.entity_name, conf=0.75) has low confidence; blind classification preferred.",genre,sherlock
