source,source_file,column_name,sample_values,blind_label,blind_confidence,finetype_label,finetype_confidence,agreement,final_label,reasoning,ground_truth_label,ground_truth_source
sherlock,,,"[""4214 RINGGOLD RD"", """", """"]",geography.address.street_name,low,representation.boolean.initials,0.6667,no,geography.address.street_name,"FineType saw initials pattern from very sparse data (3 values, 2 empty); the one real value is clearly a street address.",address,sherlock
sherlock,,,"[""College Station, Texas"", ""Stillwater, Okla."", ""Columbia, Mo."", ""Ames, Iowa"", ""Lubbock, Texas"", ""Lawrence, Kan."", ""Waco, Texas"", ""Topeka, Kan."", ""Spicewood, Texas"", ""Columbia, Mo.""]",geography.location.city,high,representation.text.entity_name,0.75,no,geography.location.city,"Values are city, state pairs like 'College Station, Texas'; blind city label is more precise than entity_name.",city,sherlock
sherlock,,,"["""", ""M"", """", ""M"", """", ""M"", ""M"", """", ""M"", """"]",identity.person.gender_code,medium,identity.person.gender,0.8,no,identity.person.gender_code,"Values are single letter 'M' which is a gender code, not the full word gender label FineType chose.",sex,sherlock
sherlock,,,"[""n/a"", ""n/a"", ""n/a"", ""n/a""]",representation.text.plain_text,low,representation.discrete.ordinal,1.0,no,representation.discrete.categorical,All values are 'n/a' - FineType's ordinal is wrong; blind plain_text is also a stretch; categorical is best for a repeated sentinel value.,rank,sherlock
sherlock,,,"[""Susan Christie"", ""Meic Stevens"", ""Kerdd Dant"", ""Voice of the Seven Woods"", ""Zia"", ""Y Nhw"", ""S. P. Balasubrahmanyam, Chitra & Ilaiyaraaja""]",identity.person.full_name,medium,representation.discrete.categorical,0.5,no,representation.text.entity_name,Mix of artist names and band names; FineType's categorical is wrong; blind full_name too specific for band names; entity_name is best.,artist,sherlock
sherlock,,,"["""", ""30:00"", ""25:00"", ""29:15"", ""1:18:05"", ""41:11"", ""1:49:14"", ""56:15"", ""59:54"", ""1:43:06""]",datetime.time.hms_24h,medium,datetime.time.hm_24h,0.6,no,datetime.time.hm_24h,Values are duration-style times; FineType's hm_24h matches the majority format; blind hms_24h differs only by seconds component which is present in some values.,duration,sherlock
sherlock,,,"[""1"", ""2""]",representation.identifier.increment,low,representation.boolean.binary,0.5,no,representation.identifier.increment,"Values are [1, 2] - too few to confirm binary boolean; increment is safer for sequential integers starting at 1.",rank,sherlock
sherlock,,,"[""Vertino, Ryan"", ""Smith, Bryan"", ""Points, Unaccounted"", ""Oneil, Jeremy"", ""Narchus, Nick"", ""Haak, Eric"", ""Guagenti, Nick"", ""Dudziak, Mark"", ""Bienias, Mike"", ""Guagenti, Nate""]",identity.person.full_name,high,identity.person.full_name,1.0,yes,identity.person.full_name,,name,sherlock
sherlock,,,"[""La source"", ""Amies ennemies (Radio edit) - Single"", ""Changer les choses"", ""Changer les choses"", ""Changer les choses""]",representation.text.plain_text,medium,representation.text.entity_name,0.8,no,representation.text.entity_name,Song and album titles are best represented as entity_name; blind plain_text is too generic.,album,sherlock
sherlock,,,"[""AS"", ""AS"", ""FPAY"", ""REMI"", ""LAPS"", ""FP""]",representation.discrete.categorical,medium,geography.location.country_code,0.5,no,representation.discrete.categorical,"Values like AS, FPAY, REMI, LAPS are patent/status codes not country codes; blind categorical is correct.",code,sherlock
sherlock,,,"[""TO DO"", ""IN PROGRESS"", ""DONE"", ""DONE"", ""DONE"", ""IN PROGRESS"", ""TO DO"", ""TO DO"", ""DONE"", ""TO DO""]",representation.discrete.categorical,high,representation.numeric.integer_number,0.5,no,representation.discrete.categorical,TO DO/IN PROGRESS/DONE are task status values; FineType's integer_number classification is wrong.,status,sherlock
sherlock,,,"[""50.0"", ""0.0"", ""25.0"", ""880.0"", ""130.0"", ""253.0"", ""50.0"", ""0.0"", ""105.0"", ""138.0""]",representation.numeric.decimal_number,high,representation.numeric.decimal_number,1.0,yes,representation.numeric.decimal_number,,state,sherlock
sherlock,,,"[""ftp client passive"", ""ftp client password"", ""ftp client source-interface"", ""ftp client username""]",representation.text.plain_text,medium,container.array.whitespace_separated,1.0,no,representation.text.plain_text,Values are CLI command path fragments like 'ftp client passive'; FineType's whitespace_separated treats them as arrays which is technically true but semantically wrong.,command,sherlock
sherlock,,,"[""Attitude - EP"", ""Waves - EP"", ""Attitude - EP"", ""Mixtape: Summertime Too"", ""Hours EP"", ""Hours EP"", ""Hours EP"", ""Mixtape: New York"", ""Waves - EP"", ""Waves - EP""]",representation.text.plain_text,medium,geography.location.country,0.3,no,representation.text.plain_text,Values are music album/EP names; FineType's country classification is incorrect.,album,sherlock
sherlock,,,"[""Florida State"", ""Texas A&M"", ""Texas A&M""]",representation.text.entity_name,medium,representation.text.entity_name,0.6667,yes,representation.text.entity_name,,team,sherlock
sherlock,,,"[""SPOKANE"", ""SPOKANE"", ""SPOKANE"", ""SPOKANE"", """", """", """", """"]",geography.location.city,high,geography.location.country,0.5,no,geography.location.city,SPOKANE is a US city; FineType's country classification is wrong.,city,sherlock
sherlock,,,"[""1.0"", ""1.0"", ""1.0"", ""1.0"", ""1.0"", ""1.0"", ""1.0"", ""1.0"", ""1.0"", ""1.0""]",representation.numeric.decimal_number,medium,representation.numeric.decimal_number,1.0,yes,representation.numeric.decimal_number,,depth,sherlock
sherlock,,,"[""3, Queens Terrace"", ""3, Queens Terrace"", ""Fairways, 17, Queens Terrace"", ""3, Queens Terrace"", ""Canolflan Teifi Arcade, 13, Queens Terrace"", ""Queens Terrace""]",geography.address.full_address,high,representation.text.entity_name,0.8333,no,geography.address.full_address,"Values are UK street addresses like '3, Queens Terrace'; blind full_address is correct over FineType's entity_name.",address,sherlock
sherlock,,,"[""Nonfiction, Adult - Non-Floating"", ""Nonfiction, Adult - Non-Floating"", ""Nonfiction, Adult"", ""Nonfiction, Children's - Non-Floating""]",representation.discrete.categorical,high,representation.text.entity_name,0.5556,no,representation.discrete.categorical,"Library collection categories like 'Nonfiction, Adult - Non-Floating' are categorical classifications; FineType's entity_name is less precise.",collection,sherlock
sherlock,,,"[""Technician Level"", ""Technician Level"", ""Technician Level"", ""Technician Level"", ""Technician Level""]",representation.discrete.categorical,high,representation.text.entity_name,1.0,no,representation.discrete.categorical,All values are 'Technician Level' - a categorical classification level; FineType's entity_name is wrong.,category,sherlock
sherlock,,,"[""FB"", ""FB"", ""FB"", ""MO""]",representation.discrete.categorical,medium,geography.location.country_code,1.0,no,representation.discrete.categorical,FB and MO appear to be domain-specific codes; FineType's country_code misclassifies them.,class,sherlock
sherlock,,,"[""PGT INC"", ""CALAVO GROW\u2026"", ""ZOE'S KITCH\u2026"", ""ORION ENGIN\u2026"", ""DOT HILL SY\u2026""]",representation.text.entity_name,medium,representation.text.entity_name,0.1,yes,representation.text.entity_name,,company,sherlock
sherlock,,,"[""Indian Peafowl Pavo cristatus"", ""Lesser Adjutant Leptoptilos javanicus"", ""Red-naped Ibis Pseudibis papillosa"", ""White-rumped Vulture Gyps bengalensis"", ""Slender-billed Vulture Gyps tenuirostris""]",representation.text.plain_text,high,representation.text.entity_name,0.75,no,representation.text.entity_name,Species names with common and scientific names; entity_name is appropriate.,species,sherlock
sherlock,,,"[""#1"", ""#2"", ""#3"", ""#4"", ""#5"", ""#6"", ""#7"", ""#8"", ""#9"", ""#10""]",representation.identifier.increment,medium,representation.scientific.smiles,1.0,no,representation.identifier.increment,"Values are ranked positions #1, #2 etc.; FineType's smiles classification is completely wrong.",rank,sherlock
sherlock,,,"[""Christine Arand, Eleanor Sandresky, Karen Kamensek, Nelson Padgett, Philip Cutlip & Philip Glass""]",representation.text.plain_text,medium,geography.address.full_address,1.0,no,representation.text.plain_text,Values are comma-separated lists of artist names; FineType's full_address is wrong.,artist,sherlock
sherlock,,,"[""Free Press, The"", ""Harry N. Abrams, Inc., Publishers"", ""Shire Publications LTD"", ""University of Oklahoma Press"", ""American University in Cairo Press, The"", ""Inner Tradition""]",representation.text.entity_name,medium,representation.text.entity_name,0.3333,yes,representation.text.entity_name,,publisher,sherlock
sherlock,,,"[""Virginia Tech 8, Maryland 5"", ""Virginia Tech 4, Maryland 0"", ""Maryland 9, Virginia Tech 7"", ""Maryland 3, Virginia Tech 1"", ""North Carolina 8, Maryland 1""]",representation.text.plain_text,high,geography.address.full_address,0.55,no,representation.text.plain_text,"Values are sports game scores like 'Virginia Tech 8, Maryland 5'; FineType's full_address is wrong.",result,sherlock
sherlock,,,"["""", ""F"", """", ""F"", """", ""F"", """", ""F"", """", ""F""]",identity.person.gender_code,medium,representation.boolean.initials,0.8,no,identity.person.gender_code,Values are single letter 'F' for female sex; gender_code is more specific than FineType's boolean.initials.,sex,sherlock
sherlock,,,"[""International Republican Institute"", ""Carnegie Endowment for International Peace"", ""George Washington University"", ""International Foundation for Electoral Systems"", ""Freedom House""]",representation.text.entity_name,high,representation.text.entity_name,1.0,yes,representation.text.entity_name,,affiliation,sherlock
sherlock,,,"[""Monday"", ""Tuesday"", ""Wednesday"", ""Thursday"", ""Friday"", ""Saturday"", ""Sunday""]",datetime.component.day_of_week,high,datetime.component.day_of_week,0.8571,yes,datetime.component.day_of_week,,day,sherlock
sherlock,,,"[""ALL"", ""eq_ref"", ""eq_ref""]",representation.discrete.categorical,medium,representation.discrete.categorical,0.6667,yes,representation.discrete.categorical,,type,sherlock
sherlock,,,"[""1"", ""1"", ""0"", ""1"", ""0"", ""0"", ""1"", ""0"", ""1"", ""1""]",representation.boolean.binary,high,representation.boolean.binary,1.0,yes,representation.boolean.binary,,plays,sherlock
sherlock,,,"[""Corn Futures"", ""Mini-Corn Futures"", ""Chicago SRW Wheat Futures"", ""KC HRW Wheat Futures"", ""Soybean Futures""]",representation.text.plain_text,medium,representation.text.entity_name,0.5833,no,representation.text.entity_name,Commodity futures names are entity names; entity_name is appropriate.,product,sherlock
sherlock,,,"[""snmp mib expression owner"", ""object (expression)""]",representation.text.plain_text,medium,datetime.component.month_name,0.5,no,representation.text.plain_text,Values are SNMP configuration descriptions; FineType's month_name classification is incorrect.,command,sherlock
sherlock,,,"["""", ""L"", ""L""]",representation.discrete.categorical,low,representation.scientific.measurement_unit,0.6667,no,representation.discrete.categorical,Values are single letter codes (L); FineType's measurement_unit is wrong.,class,sherlock
sherlock,,,"[""South-East"", ""Sunshine and Fraser Coast"", ""Sunshine and Fraser Coast"", ""South-East"", ""Sunshine and Fraser Coast""]",geography.location.region,high,representation.discrete.categorical,0.625,no,geography.location.region,Values are Australian regional area names like 'South-East' and 'Sunshine and Fraser Coast'; blind region is correct over FineType's categorical.,region,sherlock
sherlock,,,"[""isbn 0767902335"", ""isbn 1573241172"", ""isbn 0938077872"", ""isbn 091005567X"", ""isbn"", ""isbn 1844836231""]",identity.commerce.isbn,high,representation.identifier.alphanumeric_id,0.05,no,identity.commerce.isbn,Values are ISBN numbers with 'isbn' prefix; blind isbn is correct; FineType's alphanumeric_id misses the semantic type.,isbn,sherlock
sherlock,,,"[""PRESCHOOL-11"", ""1-8"", ""2-5"", ""None""]",representation.discrete.categorical,medium,identity.medical.loinc,0.5,no,representation.discrete.categorical,"Values are age/grade ranges like 'PRESCHOOL-11', '1-8'; FineType's loinc classification is wrong.",grades,sherlock
sherlock,,,"[""Good Reviews"", ""Excellent Reviews"", ""Webmasters Only""]",representation.discrete.categorical,high,representation.text.entity_name,0.6667,no,representation.discrete.categorical,Review quality category labels; FineType's entity_name is less precise than categorical.,category,sherlock
sherlock,,,"[""12"", ""13""]",representation.numeric.integer_number,low,representation.identifier.numeric_code,1.0,no,representation.numeric.integer_number,Values 12 and 13 are integer numbers; FineType's numeric_code is also plausible but integer_number is more general.,rank,sherlock
sherlock,,,"["""", ""BLND"", ""DEAF"", ""WCHR"", ""WCHS"", ""WCHC"", ""WCMP"", ""WCBD"", ""Blindenhund"", """"]",representation.discrete.categorical,medium,representation.text.entity_name,0.5,no,representation.discrete.categorical,"Values are airline special service request codes (BLND, DEAF, WCHR etc.); categorical is correct over FineType's entity_name.",service,sherlock
sherlock,,,"[""745.0"", ""0.0""]",representation.numeric.decimal_number,low,representation.numeric.decimal_number,1.0,yes,representation.numeric.decimal_number,,elevation,sherlock
sherlock,,,"[""I Dreamed a Dream"", ""I Dreamed a Dream"", ""The Gift"", ""I Dreamed a Dream"", ""I Dreamed a Dream"", ""The Gift""]",representation.text.plain_text,medium,representation.text.entity_name,1.0,no,representation.text.entity_name,Album/song title names; entity_name is appropriate.,album,sherlock
sherlock,,,"[""Guided By Voices"", ""Guided By Voices"", ""Guided By Voices"", ""Guided By Voices"", ""Guided By Voices""]",representation.text.entity_name,high,representation.text.entity_name,1.0,yes,representation.text.entity_name,,artist,sherlock
sherlock,,,"[""AS"", ""AS"", ""AS"", ""AS"", ""AS"", ""FPAY""]",representation.discrete.categorical,high,geography.location.country_code,0.8333,no,representation.discrete.categorical,Values AS/FPAY are patent status codes; FineType's country_code is wrong.,code,sherlock
sherlock,,,"[""Both"", ""Female"", ""Not Specified"", ""Not Specified""]",identity.person.gender,medium,geography.location.country,0.5,no,identity.person.gender,"Values describe gender (Both, Female, Not Specified); FineType's country classification is completely wrong.",sex,sherlock
sherlock,,,"[""166.0"", ""13.0"", ""None""]",representation.numeric.decimal_number,low,representation.numeric.decimal_number,0.6667,yes,representation.numeric.decimal_number,,area,sherlock
sherlock,,,"[""\""Sterling CX p/b Sendmail"", """", ""Sterling Sports Group"", ""Sterling Cross p/b Sendmail Inc"", ""Sterling Sports Group""]",representation.text.entity_name,medium,representation.text.entity_name,0.5714,yes,representation.text.entity_name,,team Name,sherlock
sherlock,,,"[""John Hamilton"", ""Martin Rubalcava"", ""Danny Lavergne"", ""David Alvarez"", ""Lucas Constantin"", ""Jarrod Deschamp"", ""Alfonso Lujan"", ""Bobby Dow"", ""Saul Jr Ramirez"", ""Josh Dearmon""]",identity.person.full_name,high,identity.person.full_name,0.5,yes,identity.person.full_name,,jockey,sherlock
sherlock,,,"[""AddToPlayList(media;[playlist];[mask];[recursive])"", ""AddToPlayListFromDB(type;statement)"", ""AddToSlideshow(media;[mask];[recursive])"", ""ClearPlayList([playlist])"", ""ClearSlideshow""]",representation.text.plain_text,medium,representation.text.entity_name,0.1389,no,representation.text.plain_text,Values are API function call signatures with parameters; plain_text is more appropriate than entity_name.,command,sherlock
sherlock,,,"[""Commission on Security and Cooperation in Europe"", ""Embassy of Mongolia"", ""Open Society Forum"", ""Legal and Human Rights Programs"", ""The Heritage Foundation""]",representation.text.entity_name,high,representation.text.entity_name,0.4,yes,representation.text.entity_name,,affiliation,sherlock
sherlock,,,"[""Action - Buddy Comedy"", ""Comedy - Arrested Development"", ""Comedy - High School"", ""Comedy - R-Rated Youth"", ""TV Adaptation (Live Action)""]",representation.discrete.categorical,high,geography.location.region,0.4,no,representation.discrete.categorical,Genre/category labels like 'Action - Buddy Comedy'; FineType's region classification is wrong.,genre,sherlock
sherlock,,,"[""Fr"", ""So"", ""Trans"", ""Jr"", ""Sr"", """"]",representation.discrete.categorical,high,identity.person.last_name,0.0833,no,representation.discrete.categorical,"Academic year/class abbreviations (Fr=Freshman, So=Sophomore etc.); FineType's last_name is wrong.",class,sherlock
sherlock,,,"[""UCS 5108 Blade Svr AC Chassis/0 PSU/8 fans/0 fabric extender-1"", ""UCS B200 M3 Blade Server w/o CPU, mem, HDD, mLOM/mezz"", ""2.40 GHz E5-2665/115W 8C/20MB Cache/DDR3 1600MHz""]",representation.text.sentence,medium,geography.address.full_address,0.6,no,representation.text.sentence,Values are hardware product description strings; FineType's full_address is wrong.,description,sherlock
sherlock,,,"[""Peru"", ""Peru""]",geography.location.country,high,representation.text.entity_name,1.0,no,geography.location.country,"Value is 'Peru', a country name; blind country is correct over FineType's entity_name.",nationality,sherlock
sherlock,,,"[""India"", ""India"", ""India"", ""India"", ""India""]",geography.location.country,high,geography.location.country,1.0,yes,geography.location.country,,country,sherlock
sherlock,,,"[""K-5"", ""K-5"", ""9-12"", ""6-8"", ""6-11"", ""K-5"", ""K-5"", ""K-12"", ""K-5"", ""9-12""]",representation.discrete.categorical,high,representation.discrete.categorical,0.5,yes,representation.discrete.categorical,,grades,sherlock
sherlock,,,"[""Directory"", ""text/plain"", ""text/plain"", ""text/plain"", ""text/plain"", ""text/plain"", ""text/plain""]",representation.file.mime_type,medium,representation.file.mime_type,0.8571,yes,representation.file.mime_type,,type,sherlock
sherlock,,,"[""Charles CALEY, vict."", ""Mrs. Elizabeth CALEY"", ""John Travis KEMP, grocer"", ""William WATSON""]",identity.person.full_name,medium,identity.person.full_name,0.75,yes,identity.person.full_name,,person,sherlock
sherlock,,,"[""LYn"", ""LYn""]",representation.text.word,low,representation.text.entity_name,1.0,no,representation.text.entity_name,LYn appears to be an artist/stage name; entity_name is more specific than word.,artist,sherlock
sherlock,,,"[""Mon"", ""Tues"", ""Wed"", ""Thurs"", ""Fri"", ""Sat"", ""Sun""]",datetime.component.day_of_week,high,representation.text.entity_name,0.0714,no,datetime.component.day_of_week,Abbreviated day names; blind day_of_week is correct over FineType's categorical.,order,sherlock
sherlock,,,"[""Final"", ""Final"", ""Final/17"", ""Final"", ""Final""]",representation.discrete.categorical,medium,representation.discrete.categorical,0.8,yes,representation.discrete.categorical,Values like 'Final' and 'Final/17' are game result status codes; FineType's boolean.initials is wrong.,status,sherlock
sherlock,,,"[""3"", ""5""]",representation.numeric.integer_number,low,representation.boolean.initials,1.0,no,representation.numeric.integer_number,Values are small integers 3 and 5; FineType's country_code is wrong.,age,sherlock
sherlock,,,"["""", ""Vic"", ""New South Wales"", ""SA"", ""KY"", ""MN"", ""MI"", ""PA"", ""ON"", ""ON""]",geography.location.region,medium,geography.location.country_code,0.6,no,geography.location.region,,state,sherlock
sherlock,,,"[""Flushing"", ""Flushing"", ""Flushing"", ""Flushing"", ""Flushing""]",geography.location.city,high,geography.location.region,1.0,no,geography.location.city,Flushing is a city/neighborhood name; blind city is correct over FineType's region.,location,sherlock
sherlock,,,"[""play in a game"", ""start a game"", ""play a complete game"", ""score a goal"", ""record an assist""]",representation.text.sentence,high,container.array.whitespace_separated,0.6667,no,representation.text.sentence,Values are short activity description sentences; FineType's whitespace_separated is wrong.,category,sherlock
sherlock,,,"[""301 W Grand Avenue, Carterville, IL"", ""1249 Sanpat Lane, Carterville, IL"", ""1101 Harmoney Lane, Carterville, IL"", ""1195 E Walnut, Carterville, IL""]",geography.address.full_address,high,geography.address.full_address,0.9,yes,geography.address.full_address,,address,sherlock
sherlock,,,"[""Owner name: INTERNATIONAL BUSINESS MACHINES CORPORATION, NEW Y Free format text: ASSIGNMENT OF ASSIGNORS INTEREST;ASSIGNORS:LIU, ZHEN;WYNTER, LAURA;ZHANG, LI;REEL/FRAME:016218/0150"", ""Year of fee payment: 4""]",representation.text.paragraph,high,representation.text.paragraph,0.6667,yes,representation.text.paragraph,,description,sherlock
sherlock,,,"[""Renaissance"", ""Renaissance"", ""Renaissance"", ""Renaissance"", ""Renaissance""]",representation.text.word,medium,geography.location.country,1.0,no,representation.text.word,Value is 'Renaissance' - a historical period/movement name; FineType's country classification is wrong.,artist,sherlock
sherlock,,,"[""Alabama"", ""Florida State"", ""Ohio State"", ""Baylor"", ""Oregon"", ""Clemson"", ""Auburn"", ""Oklahoma St."", ""Missouri"", ""Stanford""]",representation.text.entity_name,medium,representation.text.entity_name,0.125,yes,representation.text.entity_name,,team,sherlock
sherlock,,,"[""Brazil"", ""Venezuela"", ""Mexico"", ""Argentina"", ""Colombia"", ""Chile""]",geography.location.country,high,geography.location.region,0.5,no,geography.location.country,Values are Latin American country names; blind country is correct over FineType's region.,country,sherlock
sherlock,,,"[""SG"", ""4-5"", ""3-4"", ""C"", ""PF"", ""PF"", ""SF"", ""PG"", ""4-5"", ""SG""]",representation.discrete.categorical,high,geography.location.country_code,0.5,no,representation.discrete.categorical,"Basketball position codes (SG=Shooting Guard, PF=Power Forward etc.); FineType's country_code is wrong.",position,sherlock
sherlock,,,"["""", ""M"", """", ""M"", """", ""M"", """", ""M"", """", ""M""]",identity.person.gender_code,high,identity.person.gender,0.8,no,identity.person.gender_code,Single letter 'M' is a gender code; gender_code is more specific than FineType's gender.,sex,sherlock
sherlock,,,"[""30.6"", ""35.9""]",representation.numeric.decimal_number,medium,representation.numeric.decimal_number,1.0,yes,representation.numeric.decimal_number,,weight,sherlock
sherlock,,,"[""KG - 05"", ""PK - 05"", ""PK - 05"", ""PK - 05"", ""PK - 06"", ""PK - 05""]",representation.discrete.categorical,medium,representation.identifier.alphanumeric_id,0.8333,no,representation.discrete.categorical,Grade level codes like 'KG - 05' and 'PK - 05'; categorical is more appropriate than alphanumeric_id.,grades,sherlock
sherlock,,,"[""OH"", ""IA"", ""IN"", ""AL"", ""MA"", """"]",geography.location.region,high,geography.location.country_code,0.6667,no,geography.location.region,US state abbreviations; blind region is correct over FineType's country_code.,state,sherlock
sherlock,,,"[""Deshawn Parker"", ""Oswald Pereira"", ""Jeremias Flores"", ""Luis Rivera"", ""Luis Rivera"", ""Jareth Loveberry"", ""Ricardo Feliciano"", ""Kendrick Carmouche"", ""J Jones""]",identity.person.full_name,high,identity.person.full_name,0.55,yes,identity.person.full_name,,jockey,sherlock
sherlock,,,"[""Rejseskildring"", ""Digte"", ""Digte"", ""Eventyr"", ""Eventyr"", ""Eventyr"", ""Rejseskildring"", ""Digte""]",representation.discrete.categorical,high,geography.location.region,0.3571,no,representation.discrete.categorical,"Danish literary genre terms (Rejseskildring=travelogue, Digte=poems, Eventyr=fairy tales); categorical is correct over FineType's region.",genre,sherlock
sherlock,,,"[""Route 17"", ""Route 18"", ""Route 23""]",representation.text.plain_text,medium,representation.text.entity_name,1.0,no,representation.text.entity_name,Route names like 'Route 17'; entity_name is appropriate.,area,sherlock
sherlock,,,"[""9-12"", ""K-8"", ""K-5"", ""K-6"", ""K-5"", ""K-5"", ""K-8"", ""6-12"", ""K-5""]",representation.discrete.categorical,high,representation.discrete.categorical,0.7778,yes,representation.discrete.categorical,,grades,sherlock
sherlock,,,"[""Fuzhou JX"", ""Huzhou ZJ"", ""Pingxiang JX"", ""Yining XJ"", ""Zaozhuang SD"", ""Sanming FJ"", ""Xiaogan HB"", ""Changchun JL""]",geography.location.city,medium,representation.text.entity_name,0.6667,no,geography.location.city,Values are Chinese city names with province abbreviations like 'Fuzhou JX'; blind city is correct.,city,sherlock
sherlock,,,"[""Male"", ""Male"", ""Male"", ""Male"", ""Male""]",identity.person.gender,high,identity.person.gender,1.0,yes,identity.person.gender,,gender,sherlock
sherlock,,,"[""Professional"", ""Amateur""]",representation.discrete.categorical,high,representation.text.entity_name,0.5,no,representation.discrete.categorical,Professional/Amateur are categorical classification labels; FineType's entity_name is wrong.,classification,sherlock
sherlock,,,"[""This motion PASSED the Senate 90 voted YES 8 voted NO 2 voted present/not voting"", ""PASSED by voice vote"", ""This amendment DID NOT PASS the Senate 38 voted YES 61 voted NO 1 voted present/not voting""]",representation.text.sentence,high,representation.text.entity_name,0.6,no,representation.text.sentence,Values are legislative vote result descriptions; FineType's ordinal is wrong.,result,sherlock
sherlock,,,"[""Monday"", ""Tuesday"", ""Wednesday"", ""Thursday"", ""Friday"", ""Saturday"", ""Sunday""]",datetime.component.day_of_week,high,datetime.component.day_of_week,0.8571,yes,datetime.component.day_of_week,,day,sherlock
