source,source_file,column_name,sample_values,blind_label,blind_confidence,finetype_label,finetype_confidence,agreement,final_label,reasoning,ground_truth_label,ground_truth_source
sherlock,,,"[""Hindu"", ""NA""]",representation.discrete.categorical,low,geography.location.country_code,0.5,no,representation.discrete.categorical,Religion categories; FineType country_code is wrong. Blind categorical is correct.,religion,sherlock
sherlock,,,"[""1"", ""2"", ""3"", ""4"", ""5"", ""6"", ""7"", ""8"", ""9"", ""10"", ""11"", ""12"", ""13"", ""14"", ""15"", ""16"", ""17"", ""18"", ""19"", ""20""]",representation.identifier.increment,high,representation.identifier.numeric_code,0.55,no,representation.discrete.ordinal,Sequential 1-20 integers; FineType ordinal is correct. Blind increment is also valid. Using FineType ordinal.,rank,sherlock
sherlock,,,"[""Rete sociale dei progetti"", ""Rete sociale dei progetti"", ""Rete sociale dei progetti"", ""Canali di comunicazione"", ""Rete sociale dei progetti"", ""Gestione del progetto"", ""Gestione del progetto""]",representation.text.plain_text,high,representation.discrete.categorical,0.571,no,representation.text.entity_name,Italian project management categories; FineType entity_name is correct. Blind plain_text is too generic.,component,sherlock
sherlock,,,"[""BOYD GAMING\u2026"", ""GOPRO CL A"", ""AMAG PHARMA\u2026"", ""A O SMITH C\u2026"", ""INTERACTIVE\u2026""]",representation.text.entity_name,medium,representation.numeric.integer_number,0.8,no,representation.text.entity_name,Truncated company names; both agree.,company,sherlock
sherlock,,,"[""6"", ""5""]",representation.numeric.integer_number,low,representation.boolean.initials,1.0,no,representation.numeric.integer_number,"Small integers 6,5; FineType numeric_code is plausible but blind integer_number is more generic.",age,sherlock
sherlock,,,"[""Kemco"", ""Kemco"", ""Kotobuki Systems""]",representation.text.entity_name,high,identity.person.last_name,0.667,no,representation.text.entity_name,Blind prediction (representation.text.entity_name) preferred; FineType confidence (0.67) is low.,publisher,sherlock
sherlock,,,"[""8 Lath Kitchen Shelf Rack"", ""8 Lath Kitchen Shelf Rack"", ""8 Lath Kitchen Shelf Rack"", ""8 Lath Kitchen Shelf Rack Customer also bought: Edwardian Coat Hook White Porcelain Pandora T Bar Handle"", ""8 Lath Kitchen Shelf Rack Customer also bought: Raven Cabinet Knob"", ""8 Lath Kitchen Shelf Rack Customer also bought: Cast Iron Towel Rail Traditional Kitchen Maid\u00ae Pulley Clothes Airer"", ""8 Lath Kitchen Shelf Rack"", ""8 Lath Kitchen Shelf Rack"", ""8 Lath Kitchen Shelf Rack"", ""8 Lath Kitchen Shelf Rack Customer also bought: Herb and Flower Dryer""]",representation.text.sentence,medium,representation.text.entity_name,0.7,no,representation.text.sentence,Product descriptions with long text; FineType entity_name is less precise than sentence for the longer values.,product,sherlock
sherlock,,,"[""isbn 0752882937"", ""isbn 0340924799"", ""isbn 0670018864"", ""isbn 075382745X""]",identity.commerce.isbn,high,representation.discrete.categorical,1.0,no,identity.commerce.isbn,ISBN with prefix 'isbn'; FineType entity_name is wrong. Blind isbn is correct.,isbn,sherlock
sherlock,,,"[""YouTube"", ""YouTube"", ""Blip.tv"", ""Blip.tv"", ""iTunes""]",representation.text.entity_name,medium,representation.text.entity_name,0.4,yes,representation.text.entity_name,,service,sherlock
sherlock,,,"[""28.3"", ""25.3""]",representation.numeric.decimal_number,high,representation.numeric.decimal_number,1.0,yes,representation.numeric.decimal_number,,weight,sherlock
sherlock,,,"[""East Carolina 10, OLD DOMINION 4"", ""OLD DOMINION 6, Temple 2"", ""Temple 5, OLD DOMINION 4"", ""OLD DOMINION 5, Temple 4""]",representation.text.plain_text,medium,representation.text.entity_name,0.75,no,representation.text.plain_text,"Sports scores in format 'Team1 10, Team2 4'; FineType entity_name is wrong. Blind plain_text is correct.",result,sherlock
sherlock,,,"[""33.4"", ""25.4""]",representation.numeric.decimal_number,high,representation.numeric.decimal_number,1.0,yes,representation.numeric.decimal_number,,weight,sherlock
sherlock,,,"[""Melksham, Wiltshire, SN12 Full Address"", ""Hounslow, Middlesex, TW4 Full Address"", ""Grantham, Lincolnshire, NG31 Full Address"", ""Worksop, Nottinghamshire, S80 Full Address"", ""Bangor, County Down, BT20 Full Address"", ""Waterlooville, Hampshire, PO8 Full Address"", ""Wolverhampton, West Midlands, WV4 Full Address"", ""Bristol, Avon, BS34 Full Address"", ""Portsmouth, Hampshire, PO3 Full Address"", ""Nottingham, Nottinghamshire, NG6 Full Address""]",geography.address.full_address,high,geography.address.full_address,0.6,yes,geography.address.full_address,,address,sherlock
sherlock,,,"["""", ""GCMD Valids"", """", """", """", ""DEM Info"", ""Varner, Jesse"", ""Kelly Carignan"", """", ""GCMD User Support Office"", """", """"]",representation.text.plain_text,low,representation.text.entity_name,0.083,no,representation.text.plain_text,Mixed names and organization names; FineType entity_name is plausible but data is too heterogeneous. Blind plain_text is safer.,component,sherlock
sherlock,,,"[""Pre-school"", ""Primary - Government"", ""Primary - Catholic"", ""Primary - Other Non Government"", ""Secondary - Government"", ""Secondary - Catholic"", ""Secondary - Other Non Government"", ""Technical or further education institution"", ""University or tertiary institution"", ""Other"", ""Not Stated"", ""Total""]",representation.discrete.categorical,high,representation.text.entity_name,0.5,no,representation.discrete.categorical,Education level categories; FineType entity_name is wrong. Blind categorical is correct.,education,sherlock
sherlock,,,"[""Frankie Laine"", ""Gail Davies"", ""Billy Jack Wills & His Western Swing Band"", ""Gretchen Wilson"", ""Bill Small"", ""Jack Hunt"", ""Walker & Sullivan"", ""Vernon Dalhart"", ""Jesse Rodgers"", ""Elton Britt""]",representation.text.plain_text,high,representation.text.entity_name,0.4,no,identity.person.full_name,Musical artist names (mostly persons); FineType entity_name is plausible but blind full_name is more specific.,artist,sherlock
sherlock,,,"[""J M Maguire"", ""J M Maguire"", ""J M Maguire"", ""J M Maguire"", ""J M Maguire"", ""Henry Brooke"", ""J M Maguire""]",identity.person.full_name,medium,representation.discrete.categorical,0.857,no,identity.person.full_name,Jockey names (abbreviated); FineType entity_name is wrong. Blind full_name is correct.,jockey,sherlock
sherlock,,,"[""W 6-1"", ""W 6-2"", ""L 8-1"", ""W 4-3"", ""L 5-3"", ""W 8-0"", ""L 8-1"", ""L 3-0"", ""L 4-1"", ""L 9-4"", ""L 6-1"", ""L 7-4"", ""L 7-4"", ""L 2-1"", ""L 5-4"", ""W 9-1"", ""L 11-2"", ""L 9-2"", ""L 4-1"", ""L 11-10""]",identity.person.full_name,high,representation.identifier.alphanumeric_id,0.95,no,representation.text.plain_text,Game scores like 'W 6-1'; FineType alphanumeric_id is wrong. Blind plain_text is correct.,result,sherlock
sherlock,,,"[""Monday"", ""Tuesday"", ""Wednesday"", ""Thursday"", ""Friday"", ""Saturday"", ""Monday"", ""Thursday"", ""Friday"", ""Monday"", ""Tuesday"", ""Wednesday"", ""Thursday"", ""Friday"", ""Saturday"", ""Monday"", ""Tuesday"", ""Wednesday"", ""Thursday"", ""Monday""]",representation.text.plain_text,high,datetime.component.day_of_week,0.9,no,datetime.component.day_of_week,"FineType prediction (datetime.component.day_of_week, conf=0.90) preferred over blind (representation.text.plain_text) due to higher confidence.",day,sherlock
sherlock,,,"[""Win"", ""Win"", ""Win"", ""Win"", ""Win"", ""Win"", ""Loss""]",datetime.component.day_of_week,high,identity.person.last_name,0.071,no,representation.discrete.categorical,Win/Loss values; FineType last_name is wrong. Blind categorical is correct.,result,sherlock
sherlock,,,"["""", ""Play Centers, Sports & Fitness""]",representation.discrete.categorical,high,representation.boolean.initials,0.5,no,representation.text.plain_text,Category name with empty values; FineType boolean.initials is wrong. Blind plain_text is correct.,category,sherlock
sherlock,,,"[""1:36"", ""1:15"", ""3:40"", ""2:24"", ""3:19"", ""6:28""]",representation.text.plain_text,low,representation.numeric.integer_number,0.833,no,datetime.time.hm_24h,Duration/time in h:mm format; FineType integer_number is wrong. Blind hm_24h is correct.,duration,sherlock
sherlock,,,"[""RS-Fr"", ""Fr"", """"]",datetime.time.hm_24h,medium,geography.address.street_suffix,0.333,no,representation.text.word,Academic year class abbreviations; FineType street_suffix is wrong. Blind word is correct.,class,sherlock
sherlock,,,"[""Art Teacher Education"", ""Biology Teacher Education"", ""Counselor Education/School Counseling and Guidance Services"", ""Drama and Dance Teacher Education"", ""Education, Other"", ""Education/Teaching of Individuals with Multiple Disabilities"", ""Education/Teaching of the Gifted and Talented"", ""Elementary Education and Teaching"", ""English/Language Arts Teacher Education"", ""Mathematics Teacher Education""]",representation.text.word,low,representation.text.entity_name,0.933,no,representation.text.entity_name,Education program names; FineType entity_name is correct. Blind plain_text is too generic.,education,sherlock
sherlock,,,"[""AS"", ""FPAY"", ""AS"", ""REMI"", ""LAPS"", ""FP""]",representation.text.plain_text,high,geography.location.country_code,0.5,no,representation.text.word,Short status/payment codes; FineType country_code is wrong. Blind word is correct.,code,sherlock
sherlock,,,"[""Xylem Industrial Solutions for North America"", ""Abanaki Corp."", ""AXEON Water Technologies"", ""Bentley Systems / Haestad Solutions"", ""Blue-White Industries"", ""Burkert Fluid Control Systems"", ""DN Tanks"", ""Eckel Industries, Inc., Acoustic Division"", ""Gray Matter Systems"", ""Hach Co.""]",representation.text.word,medium,representation.text.entity_name,0.5,no,representation.text.entity_name,Company names; FineType entity_name is correct. Blind entity_name agrees.,company,sherlock
sherlock,,,"[""5A"", ""5A"", ""4A"", ""5A"", ""5A"", ""5A"", ""5A"", ""4A"", ""5A"", ""5A"", ""5A"", ""5A"", ""5A"", ""4A"", ""5A"", ""5A"", ""4A"", ""5A"", ""4A"", ""5A""]",representation.text.entity_name,high,representation.discrete.ordinal,1.0,no,representation.discrete.categorical,Classification codes like 5A/4A; FineType alphanumeric_id is wrong. Blind categorical is correct.,class,sherlock
sherlock,,,"[""Major League"", ""Major League"", ""Major League"", ""Major League"", ""Major League"", ""Major League"", ""Major League"", ""Major League"", ""Major League"", ""Major League"", ""Major League"", ""Major League"", ""Major League"", ""Major League"", ""Major League"", ""Major League"", ""Major League""]",representation.discrete.categorical,high,representation.text.entity_name,1.0,no,representation.discrete.categorical,Single repeated value 'Major League'; FineType entity_name is wrong. Blind categorical is correct.,artist,sherlock
sherlock,,,"[""JEFFERSON CITY"", """", ""DANDRIDGE"", """", """", """", """"]",representation.discrete.categorical,high,representation.boolean.initials,0.714,no,geography.location.city,City names with many empty values; FineType region is wrong. Blind city is correct.,city,sherlock
sherlock,,,"[""Australian"", ""British"", ""British"", """", """", """", """", ""British"", """", ""French"", ""British"", """", """"]",geography.location.city,medium,geography.location.region,0.308,no,representation.discrete.categorical,Nationality adjectives; FineType boolean.initials is wrong. Blind categorical is correct.,nationality,sherlock
sherlock,,,"["""", ""F"", """", ""F"", """", ""F"", """", ""F"", """", ""F"", """", ""F"", """", ""F"", """", ""F"", """", ""F"", """", ""F""]",representation.discrete.categorical,high,representation.boolean.initials,0.8,no,representation.boolean.initials,Single letter 'F' with blanks; FineType boolean.initials is correct. Blind categorical is also valid.,sex,sherlock
sherlock,,,"[""UK Standard 48hr"", ""UK Next Day"", ""UK Next Day Pre 12"", ""Collect+ 72hr"", ""Click & Collect""]",representation.discrete.categorical,low,representation.text.entity_name,1.0,no,representation.text.entity_name,UK shipping service names; FineType entity_name is correct. Blind plain_text is too generic.,service,sherlock
sherlock,,,"[""25 Years"", ""25 Years"", ""20 Years"", ""20 Years"", ""20 Years"", ""20 Years""]",representation.text.plain_text,medium,representation.text.entity_name,1.0,no,representation.text.entity_name,Duration strings like '25 Years'; FineType entity_name is wrong. Blind plain_text is more accurate.,service,sherlock
sherlock,,,"[""Keighley, West Yorkshire, BD20 Full Address"", ""Cheltenham, Gloucestershire, GL52 Full Address"", ""Ebbw Vale, Gwent, NP23 Full Address"", ""York, North Yorkshire, YO23 Full Address"", ""Purley, Surrey, CR8 Full Address"", ""Worcester, Hereford And Worcester, WR4 Full Address"", ""Huddersfield, West Yorkshire, HD4 Full Address"", ""Beckenham, Kent, BR3 Full Address"", ""Trowbridge, Wiltshire, BA14 Full Address"", ""Bedford, Bedfordshire, MK42 Full Address""]",representation.text.plain_text,medium,geography.address.full_address,0.75,no,geography.address.full_address,"FineType prediction (geography.address.full_address, conf=0.75) preferred over blind (representation.text.plain_text) due to higher confidence.",address,sherlock
sherlock,,,"[""WAGNER"", ""WAGNER"", ""QU"", ""QU"", ""QU"", ""QU"", ""QU"", ""QU"", ""QU"", ""WAGNER"", ""QU"", ""WAGNER"", ""WAGNER"", ""QU"", ""QU"", ""QU"", ""QU"", ""QU""]",geography.address.full_address,high,geography.location.country_code,0.722,no,representation.text.word,Short codes WAGNER/QU; FineType country_code is wrong. Blind word is correct.,team,sherlock
