source,source_file,column_name,sample_values,blind_label,blind_confidence,finetype_label,finetype_confidence,agreement,final_label,reasoning,ground_truth_label,ground_truth_source
sherlock,,,"[""SF"", ""SG"", ""SF"", ""4-5"", ""SF"", ""2-3"", ""4-5"", ""3-4"", ""C"", ""PG""]",representation.discrete.categorical,high,geography.location.country_code,0.5,no,representation.discrete.categorical,Values are sports positions (SF/SG/C/PG) and grade ranges; blind categorical is correct. Finetype country_code is wrong.,position,sherlock
sherlock,,,"[""Public"", ""Public"", ""Public"", ""Public""]",representation.discrete.categorical,high,geography.location.country,1.0,no,representation.discrete.categorical,All values are 'Public'; blind categorical is correct. Finetype country is wrong.,type,sherlock
sherlock,,,"[""Department of State"", ""Department of State"", ""Department of Defense"", ""Johns Hopkins University SAIS"", ""Jacob Blaustein Institute for the Advancement of Human Rights""]",representation.text.entity_name,high,representation.text.entity_name,0.5,yes,representation.text.entity_name,Values are organization/department names; both agree on entity_name.,affiliation,sherlock
sherlock,,,"["""", ""AMTRAK PASSENGER STATION EAST ST"", ""Amtrak Maintenance Complex"", ""River Point Road and Railroad ROW"", ""Amtrak Station Hutton & Charles Sts"", ""470 ft SW Broad Street and Railroad ROW"", ""Hamilton Way & ROW"", """"]",geography.address.street_name,medium,representation.text.entity_name,0.375,no,geography.address.street_name,Values are facility/location names and street references; blind street_name is more appropriate. Finetype entity_name is less specific.,address,sherlock
sherlock,,,"[""NH Dept. of Environmental Services, 29 Hazen Dr., Concord, NH"", """", """", ""Department of Environmental Services , Concord, NH"", ""Department of Environmental Services , Concord, NH"", """", ""Department of Environmental Services , Concord, NH"", """", """", """"]",geography.address.full_address,medium,geography.address.full_address,0.364,yes,geography.address.full_address,Values include dept name + address; finetype full_address is correct. Blind full_address agrees.,location,sherlock
sherlock,,,"[""Name"", ""r4"", ""r6-nolib"", ""r6"", ""r7-nolib"", ""r7"", ""r8-nolib"", ""r8"", ""r9-nolib"", ""r9""]",technology.development.version,medium,representation.identifier.alphanumeric_id,0.125,no,representation.text.plain_text,"Values are a mix of 'Name' header and version-like strings like 'r4', 'r6-nolib'; blind version is wrong. These look like benchmark names. plain_text is safer.",name,sherlock
sherlock,,,"[""18\"""", ""24\"""", ""18\"""", ""24\""""]",representation.text.plain_text,medium,representation.numeric.integer_number,0.5,no,representation.text.plain_text,"Values are measurements with inch symbols '18""'; blind plain_text is correct. Finetype integer is wrong.",depth,sherlock
sherlock,,,"["""", ""M"", """", ""M"", """", ""M"", """", ""M"", """", ""M""]",representation.discrete.categorical,high,identity.person.gender,0.8,no,identity.person.gender,Values are 'M' gender codes; finetype gender is correct. Blind categorical is less specific.,sex,sherlock
sherlock,,,"[""Pending Deletion"", ""Checked In"", ""Pending Deletion"", ""Checked In"", ""Checked In"", ""Checked In"", ""Pending Deletion"", ""Checked out""]",representation.discrete.categorical,high,representation.text.entity_name,0.875,no,representation.discrete.categorical,Values are status categories (Pending Deletion/Checked In); blind categorical is correct. Finetype entity_name is wrong.,status,sherlock
sherlock,,,"[""Non-Methane Hydrocarbons"", ""Non-Methane Hydrocarbons"", ""Greenhouse Gases"", ""Greenhouse Gases"", ""Greenhouse Gases"", ""Greenhouse Gases"", ""Greenhouse Gases"", ""Greenhouse Gases"", ""Greenhouse Gases"", ""Non-Methane Hydrocarbons""]",representation.discrete.categorical,high,representation.text.entity_name,1.0,no,representation.discrete.categorical,Values are chemical/gas category names; blind categorical is correct. Finetype entity_name is wrong.,category,sherlock
sherlock,,,"[""1965 - 1967"", ""1960 - 1962"", ""1959 - 1960"", ""1943 - 1946"", ""2011 - 2011""]",representation.text.plain_text,high,identity.person.phone_number,1.0,no,representation.text.plain_text,Values are year range strings '1965 - 1967'; blind plain_text is correct. Finetype phone_number is wrong.,affiliation,sherlock
sherlock,,,"[""2002 "", ""1936"", ""1958"", ""2006"", ""1977"", ""2009"", ""1994"", ""2005"", ""1936"", ""1928""]",datetime.component.year,high,datetime.component.year,0.9,yes,datetime.component.year,,year,sherlock
sherlock,,,"[""DfTc"", ""DVLA"", ""DVSA"", ""Highways England"", ""MCA"", ""VCA"", ""Total DfT""]",representation.text.entity_name,high,representation.text.entity_name,0.429,yes,representation.text.entity_name,Values are organization abbreviations and names; finetype entity_name is correct. Blind entity_name agrees.,organisation,sherlock
sherlock,,,"[""Rest of Season ? Projected stats for the rest of the season as calculated by PECOTA, Baseball Prospectus' proprietary system that projects player performance based on comparisons with historical player-seasons"", ""Cumulative ? Projected end-of-season stats, combining year-to-date stats with PECOTA projected stats for the remainder of the season""]",representation.text.sentence,high,geography.address.full_address,0.5,no,representation.text.sentence,Values are long description sentences; blind sentence is correct. Finetype full_address is wrong.,duration,sherlock
sherlock,,,"[""25.00 50.00"", ""100.00 300.00"", ""25.00 30.00"", ""6.00 15.00"", ""10.00 20.00"", ""25.00 30.00"", ""3.00 5.00"", ""2.00 3.00"", """", ""45.42 75.71""]",representation.text.plain_text,high,identity.person.phone_number,0.75,no,representation.text.plain_text,Values are price range pairs '25.00 50.00'; blind plain_text is correct. Finetype phone_number is wrong.,range,sherlock
sherlock,,,"[""User profiles in the database"", ""Meetings in the database""]",representation.text.sentence,medium,geography.location.region,1.0,no,representation.text.sentence,Values are database description sentences; blind sentence is correct. Finetype region is wrong.,component,sherlock
sherlock,,,"[""TV/Movies/Music"", ""Lawyers/Law Firms"", ""Electronics Mfg & Equip"", ""Misc Unions"", ""Education"", ""Public Sector Unions"", ""Non-Profit Institutions"", ""Real Estate"", ""Securities & Investment"", ""Lobbyists""]",representation.discrete.categorical,high,representation.text.entity_name,0.588,no,representation.discrete.categorical,Values are industry category names; blind categorical is correct. Finetype entity_name is less specific.,industry,sherlock
sherlock,,,"[""Madison"", ""Haywood"", ""Davidson"", ""Shelby"", ""Wilson"", ""Campbell"", ""Madison"", ""Hamilton"", ""Gibson"", ""Dyer""]",geography.location.region,high,identity.person.last_name,0.3,no,geography.location.region,Values are US county names; blind region is correct. Finetype last_name is wrong.,county,sherlock
sherlock,,,"[""Category 3 Men 10-14"", ""Category 3 Men 10-14"", ""Junior Men"", """"]",representation.discrete.categorical,medium,representation.text.entity_name,0.5,no,representation.discrete.categorical,Values are sports category names; blind categorical is correct. Finetype entity_name is less specific.,category,sherlock
sherlock,,,"[""Missing"", ""Other""]",representation.discrete.categorical,medium,identity.person.last_name,0.5,no,representation.discrete.categorical,Values are 'Missing'/'Other' - categorical placeholders; blind categorical is correct. Finetype last_name is wrong.,category,sherlock
sherlock,,,"[""Pre-school"", ""Primary - Government"", ""Primary - Catholic"", ""Primary - Other Non Government"", ""Secondary - Government"", ""Secondary - Catholic"", ""Secondary - Other Non Government"", ""Technical or further education institution"", ""University or tertiary institution"", ""Other""]",representation.discrete.categorical,high,representation.text.entity_name,0.125,no,representation.discrete.categorical,Values are education institution type categories; blind categorical is correct. Finetype entity_name is wrong.,education,sherlock
sherlock,,,"[""Never Told You This Before... - EP"", ""Never Told You This Before... - EP"", ""Never Told You This Before... - EP"", ""Never Told You This Before... - EP""]",representation.text.entity_name,high,representation.text.entity_name,1.0,yes,representation.text.entity_name,Values are album titles; both blind and finetype say entity_name. Agreement.,album,sherlock
sherlock,,,"[""DONE"", ""DONE"", ""DONE"", ""DONE"", ""DONE"", ""DONE"", ""DONE"", ""DONE"", ""DONE"", ""IN PROGRESS""]",representation.discrete.categorical,high,geography.transportation.icao_code,0.8,no,representation.discrete.categorical,Values are task status codes DONE/IN PROGRESS/TO DO; blind categorical is correct. Finetype icao_code is wrong.,status,sherlock
sherlock,,,"[""Lakeview Branch"", ""Dimond Branch""]",geography.location.city,medium,geography.location.region,0.5,no,geography.location.city,"Values are library branch names (Lakeview Branch, Dimond Branch); blind city is more appropriate. Finetype region is less specific.",location,sherlock
sherlock,,,"[""Health Professionals"", ""Real Estate"", ""Lawyers/Law Firms"", ""Retired"", ""Lobbyists"", ""Defense Aerospace"", ""Electric Utilities"", ""Insurance"", ""Leadership PACs"", ""General Contractors""]",representation.discrete.categorical,high,representation.text.entity_name,0.5,no,representation.discrete.categorical,Values are industry category names; blind categorical is correct. Finetype entity_name is less specific.,industry,sherlock
sherlock,,,"[""Akash Aucharuz (3)"", ""M Yeni"", ""Aupa Chalala"", ""S Brown"", ""Jarryd Penny (9)"", ""S Brown"", ""Akash Aucharuz (9)"", ""Akash Aucharuz (9)"", ""Akash Aucharuz (9)"", ""Akash Aucharuz (9)""]",identity.person.full_name,medium,representation.text.entity_name,0.5,no,identity.person.full_name,Values are person names with optional jersey numbers; blind full_name is correct. Finetype entity_name is less specific.,jockey,sherlock
sherlock,,,"[""J Schmidt"", ""S Keever"", ""B Landeros"", ""C Worst"", ""I Carnero"", ""E McNeil"", ""J Romero"", ""C Kimes""]",identity.person.full_name,medium,identity.person.last_name,0.625,no,identity.person.full_name,"Values are abbreviated person names (J Schmidt, S Keever); blind full_name is correct. Finetype last_name is less specific.",jockey,sherlock
sherlock,,,"[""IN PROGRESS"", ""IN PROGRESS"", ""IN PROGRESS"", ""IN PROGRESS""]",representation.discrete.categorical,high,technology.internet.http_method,1.0,no,representation.discrete.categorical,All values are 'IN PROGRESS'; blind categorical is correct. Finetype http_method is wrong.,status,sherlock
sherlock,,,"[""Firefox"", ""Mozilla Suite"", ""Navigator""]",representation.text.entity_name,high,geography.location.region,0.667,no,representation.text.entity_name,Values are browser product names; blind entity_name is correct. Finetype region is wrong.,product,sherlock
sherlock,,,"[""1"", ""2"", ""3"", ""4"", ""5"", ""6"", ""7"", ""8"", ""9"", ""10""]",representation.numeric.integer_number,high,representation.identifier.numeric_code,0.55,no,representation.numeric.integer_number,Values are sequential integers 1-20; blind integer is correct. Finetype numeric_code is less appropriate for ranks.,rank,sherlock
sherlock,,,"[""Susan Griffin [Atlassian]"", ""Susan Griffin [Atlassian]"", ""Susan Griffin [Atlassian]"", ""Susan Griffin [Atlassian]"", ""Susan Griffin [Atlassian]"", ""Susan Griffin [Atlassian]"", ""Andrew Lui [Atlassian Technical Writer]"", ""Andrew Lui [Atlassian Technical Writer]"", ""Rosie Jameson [Atlassian]"", ""Rosie Jameson [Atlassian]""]",identity.person.full_name,medium,geography.address.full_address,0.9,no,identity.person.full_name,Values are names with organization tags; blind full_name is correct. Finetype full_address is wrong.,creator,sherlock
sherlock,,,"[""116.0"", ""0.0""]",representation.numeric.decimal_number,high,representation.numeric.decimal_number,1.0,yes,representation.numeric.decimal_number,,elevation,sherlock
