source,source_file,column_name,sample_values,blind_label,blind_confidence,finetype_label,finetype_confidence,agreement,final_label,reasoning,ground_truth_label,ground_truth_source
sherlock,,,"[""Final"", ""Final"", ""Final"", ""Final"", ""Final"", ""Final"", ""Final"", ""Final"", ""Final"", ""Final""]",representation.discrete.categorical,high,representation.discrete.categorical,0.9,yes,representation.discrete.categorical,,status,sherlock
sherlock,,,"[""Agricultural Teacher Education"", ""Art Teacher Education"", ""Biology Teacher Education"", ""Business Teacher Education"", ""Counselor Education/School Counseling and Guidance Services"", ""Curriculum and Instruction"", ""Early Childhood Education and Teaching"", ""Education, Other"", ""Educational Leadership and Administration, General"", ""Educational/Instructional Technology""]",representation.text.plain_text,medium,representation.text.entity_name,0.833,no,representation.text.plain_text,"Values are education degree names; finetype says entity_name but these are descriptive category labels, not named entities. plain_text is more appropriate.",education,sherlock
sherlock,,,"[""HAAPSALU Baltic Sea"", ""TANANGER North Sea"", ""Kattegat"", ""SKAGEN Skagerrak"", ""Baltic Sea"", ""Kattegat"", ""Inland, Russia"", ""Okhotsk Sea"", ""Bothnia Gulf"", ""EGERSUND North Sea""]",geography.location.region,medium,representation.text.entity_name,0.4,no,geography.location.region,"Values describe sea regions/areas (Baltic Sea, North Sea, etc.); blind label region is correct. Finetype entity_name is wrong.",area,sherlock
sherlock,,,"[""Environmental Assessment and Measures, Environment and Social Impact Assessments"", ""Environmental and Social Monitoring Reports, Environmental Monitoring Reports"", ""Completion Reports, TA Completion Reports"", ""Environmental Assessment and Measures, Environmental Management Plans"", ""Environmental Assessment and Measures, Environmental Management Plans"", ""Environmental and Social Monitoring Reports, Environmental Monitoring Reports"", ""Environmental and Social Monitoring Reports, Environmental Monitoring Reports"", ""Completion Reports, Project/Program Completion Reports"", ""Resettlement Planning Documents, Resettlement Frameworks"", ""Environmental Assessment and Measures, Environmental Assessment and Review Framework""]",representation.text.plain_text,high,representation.text.entity_name,0.55,no,representation.text.plain_text,"Values are document type classification strings; finetype entity_name is wrong. These are category path labels, plain_text is more appropriate.",type,sherlock
sherlock,,,"[""2"", ""2"", ""5"", ""2"", ""1"", ""4"", ""6"", ""1"", ""4"", ""1""]",representation.numeric.integer_number,high,representation.numeric.integer_number,0.8,yes,representation.numeric.integer_number,,region,sherlock
sherlock,,,"[""Kokomo"", ""Kokomo"", ""Anderson"", ""Anderson"", ""Markleville"", ""Alexandria"", ""Anderson"", ""Anderson"", ""Anderson"", ""Anderson""]",geography.location.city,high,identity.person.last_name,0.643,no,geography.location.city,"Values are city names (Kokomo, Anderson, Markleville); blind label city is correct. Finetype last_name is wrong.",owner,sherlock
sherlock,,,"[""Reads the contig sequences from an ACE assembly file. Uses Bio.Sequencing.Ace internally"", ""The alignment format of the Clustal X and Clustal W tools. See also the Bio.Clustalw module."", ""The EMBL flat file format. Uses Bio.GenBank internally."", ""Resulting sequences have a generic alphabet."", ""The GenBank or GenPept flat file format. Uses Bio.GenBank internally."", ""This refers to the IntelliGenetics file format, apparently the same as the MASE alignment format."", ""An alignment format, also known as PAUP format. Uses Bio.Nexus internally."", ""Output from PHRED, used by PHRAP and CONSED for input. Uses Bio.Sequencing.Phd internally."", ""An alignment format. Truncates names at 10 characters."", ""An alignment format, also known as PFAM format.""]",representation.text.sentence,high,representation.text.paragraph,0.667,no,representation.text.sentence,Values are technical documentation sentences; blind label sentence is correct. Finetype paragraph is reasonable but sentences are shorter.,notes,sherlock
sherlock,,,"[""TESSCO TECH\u2026"", ""ITT EDUCATI\u2026"", ""GUESS? INC"", ""TECH DATA C\u2026"", ""SANMINA COR\u2026""]",representation.text.entity_name,medium,representation.text.entity_name,0.1,yes,representation.text.entity_name,,company,sherlock
sherlock,,,"[""Zug (Switzerland - Zug)"", ""Marburg (Germany - Hesse)""]",geography.location.city,medium,geography.location.region,1.0,no,geography.location.city,Values are 'City (Country - Region)' format - location names; blind city is more appropriate. Finetype region is also reasonable.,location,sherlock
sherlock,,,"[""Inducted"", ""Honoree"", ""Inducted"", ""Nominee"", ""Nominee""]",representation.discrete.categorical,high,geography.location.country,0.4,no,representation.discrete.categorical,Values are award status categories (Inducted/Honoree/Nominee); blind categorical is correct. Finetype country is clearly wrong.,result,sherlock
sherlock,,,"[""Alabama"", ""Alaska"", ""Arizona"", ""Arkansas"", ""California"", ""Colorado"", ""Connecticut"", ""Delaware"", ""District of Columbia"", ""Florida""]",geography.location.region,high,geography.location.country,0.4,no,geography.location.region,Values are US state names; blind region is correct. Finetype country is wrong - states are not countries.,state,sherlock
sherlock,,,"[""N/A"", ""Brazil"", ""United States"", ""France"", """"]",geography.location.country,medium,geography.location.country,0.6,yes,geography.location.country,,origin,sherlock
sherlock,,,"[""Danny Nikolic"", ""Hugh Bowman (late alt)"", ""Darren Beadman"", ""Damien Oliver (late alt)"", ""Steven Arnold"", ""Brad Rawiller"", ""Craig Newitt"", ""Brenton Avdulla"", ""Dwayne Dunn"", ""Dean Yendall""]",identity.person.full_name,high,representation.text.entity_name,0.455,no,identity.person.full_name,Values are jockey names; blind full_name is correct. Finetype entity_name is wrong for person names.,jockey,sherlock
sherlock,,,"[""GIS Dataset"", ""GIS Dataset"", ""Data Package"", ""Data Package""]",representation.discrete.categorical,medium,representation.text.entity_name,0.5,no,representation.discrete.categorical,"Values are data type categories (GIS Dataset, Data Package); blind categorical is correct. Finetype entity_name is not ideal.",type,sherlock
sherlock,,,"[""A model of Forward Sequence"", ""A model of Forward Sequence"", ""f(e1,e2) is a valid expression for each pair of elements e1 of seq1 and e2 of seq2. boost::result_of::type is the return type of f when called with elements of type E1 and E2""]",representation.text.sentence,high,geography.location.region,0.667,no,representation.text.sentence,Values are technical requirement sentences; blind sentence is correct. Finetype region is clearly wrong.,requirement,sherlock
sherlock,,,"[""50"", ""51"", ""50"", ""54"", ""50"", ""52"", ""50"", ""52"", ""52"", ""53""]",representation.numeric.integer_number,high,representation.identifier.numeric_code,1.0,no,representation.numeric.integer_number,Values are integers 50-54; blind integer is correct. Finetype numeric_code is wrong - these are not codes.,age,sherlock
sherlock,,,"[""Tab Benoit"", ""Tab Benoit"", ""Tab Benoit"", ""Tab Benoit"", ""Tab Benoit"", ""Tab Benoit"", ""Tab Benoit"", ""Tab Benoit"", ""Tab Benoit"", ""Tab Benoit""]",identity.person.full_name,high,representation.text.entity_name,1.0,no,identity.person.full_name,Tab Benoit is a person's name (artist); blind full_name is correct. Finetype entity_name is less specific.,artist,sherlock
sherlock,,,"[""North America"", ""Europe"", ""Japan""]",geography.location.continent,high,geography.location.continent,0.667,yes,geography.location.continent,,region,sherlock
sherlock,,,"[""Iowa - Allamakee"", ""Iowa - Black Hawk"", ""Iowa - Bremer"", ""Iowa - Buchanan"", ""Iowa - Butler"", ""Iowa - Chickasaw"", ""Iowa - Clayton"", ""Iowa - Delaware"", ""Iowa - Fayette"", ""Iowa - Floyd""]",geography.location.region,high,geography.location.country,0.647,no,geography.location.region,Values are 'Iowa - County' formatted county names; blind region is correct. Finetype country is wrong.,county,sherlock
sherlock,,,"["""", ""Art Museums & Centers, History Museums & Sites""]",representation.text.plain_text,medium,representation.text.entity_name,0.5,no,representation.text.plain_text,Values are museum category descriptions; blind plain_text is correct. Finetype entity_name is not ideal.,category,sherlock
sherlock,,,"[""D-Asimov"", ""Annie"", ""R\u00f3is\u00edn Murphy"", ""Luomo"", ""Ralph Myerz"", ""The Magician"", ""Kasper Bjorke"", ""Groove Deluxe"", ""Cage & Aviary"", ""Cyclist""]",identity.person.full_name,medium,representation.text.entity_name,0.3,no,identity.person.full_name,Values are artist/musician names; blind full_name is more specific. Finetype entity_name is less specific.,artist,sherlock
sherlock,,,"[""Lazio"", ""Tottenham Hotspur"", ""Panathinaikos"", ""NK Maribor""]",representation.text.entity_name,medium,geography.location.region,0.125,no,representation.text.entity_name,"Values are sports team names (Lazio, Tottenham Hotspur); both agree on entity_name type. Finetype says region which is wrong.",team,sherlock
sherlock,,,"["""", """", """", """", """", ""NonSex"", """", """", """", """"]",representation.discrete.categorical,medium,geography.location.region,0.05,no,representation.discrete.categorical,Values are mostly empty with occasional 'NonSex' and 'Clip' - categorical values; blind categorical is correct. Finetype region is wrong.,notes,sherlock
sherlock,,,"[""None"", ""None"", ""None"", ""None"", ""None"", ""None"", ""None""]",representation.discrete.categorical,medium,geography.address.street_suffix,1.0,no,representation.discrete.categorical,All values are 'None' - a categorical placeholder; blind categorical is correct. Finetype street_suffix is wrong.,classification,sherlock
sherlock,,,"["""", ""5,500"", ""10,000"", ""10,000"", ""15,000"", ""40,000"", """", """", ""5,000,000"", ""600,000""]",finance.currency.amount_comma,high,representation.numeric.decimal_number_comma,0.7,no,finance.currency.amount_comma,"Values are comma-formatted numbers like '5,500'; blind amount_comma is correct. Finetype decimal_number_comma is also reasonable but amount_comma is more specific for currency-like values.",species,sherlock
sherlock,,,"[""AS"", ""FPAY"", ""REMI"", ""SULP"", ""FPAY""]",representation.discrete.categorical,medium,geography.transportation.icao_code,0.8,no,representation.discrete.categorical,Values are short codes AS/FPAY/REMI/SULP; blind categorical is correct. Finetype icao_code is wrong.,code,sherlock
sherlock,,,"[""3880"", ""3893"", ""4451"", ""3153"", ""2778"", ""3575"", ""3230"", ""3252"", ""3462"", ""3814""]",representation.numeric.integer_number,medium,representation.identifier.numeric_code,1.0,no,representation.numeric.integer_number,Values are 4-digit numbers (weights); blind integer is correct. Finetype numeric_code is wrong.,weight,sherlock
sherlock,,,"[""United States"", ""Singapore"", ""Australia"", ""Hong Kong"", ""United Kingdom"", ""China"", ""Japan"", ""Malaysia"", ""South Korea"", ""Canada""]",geography.location.country,high,geography.location.country,0.636,yes,geography.location.country,,country,sherlock
sherlock,,,"[""Nominated"", ""Nominated"", ""Won"", ""Won"", ""Won"", ""Won"", ""Won"", ""Won"", ""Won"", ""Won""]",representation.discrete.categorical,high,identity.person.last_name,0.692,no,representation.discrete.categorical,Values are award results (Nominated/Won); blind categorical is correct. Finetype last_name is wrong.,result,sherlock
sherlock,,,"[""20"", ""23"", ""24"", ""19"", ""24"", ""23"", ""24"", ""24"", ""21"", ""24""]",representation.numeric.integer_number,high,representation.identifier.numeric_code,1.0,no,representation.numeric.integer_number,Values are ages 19-24; blind integer is correct. Finetype numeric_code is wrong.,age,sherlock
sherlock,,,"["""", ""G"", """", ""R"", """", ""R"", """", ""G"", """", ""L""]",representation.discrete.categorical,high,representation.discrete.categorical,0.8,yes,representation.discrete.categorical,,class,sherlock
sherlock,,,"[""South Africa"", ""Italy"", ""Spain"", ""Russia"", ""United Kingdom"", ""Poland"", ""India"", ""Argentina"", ""Brazil"", ""Ukraine""]",geography.location.country,high,geography.location.country,0.667,yes,geography.location.country,Values are country names; both agree.,country,sherlock
sherlock,,,"[""Men"", ""Women"", ""% Women""]",representation.discrete.categorical,high,identity.person.last_name,0.333,no,representation.discrete.categorical,Values are gender/percent categories; blind categorical is correct. Finetype last_name is wrong.,year,sherlock
sherlock,,,"[""BOOTH v. STATE OF INDIANA, 237 U.S. 391 (1915)"", ""CARMICHAEL v. SOUTHERN COAL & COKE CO., 301 U.S. 495 (1937)"", ""KLEIN v. BOARD OF TAX SUP'RS OF JEFFERSON COUNTY, KY., 282 U.S. 19 (1930)"", ""LOUISVILLE GAS & ELECTRIC CO. v. COLEMAN, 277 U.S. 32 (1928)"", ""GASQUET v. LAPEYRE, 242 U.S. 367 (1917)"", ""MILLER v. STRAHL, 239 U.S. 426 (1915)"", ""LOWER VEIN COAL CO. v. INDUSTRIAL BD. OF INDIANA, 255 U.S. 144 (1921)""]",representation.text.plain_text,high,geography.address.full_address,0.429,no,representation.text.plain_text,Values are legal case citations; blind plain_text is correct. Finetype full_address is wrong.,description,sherlock
sherlock,,,"[""78 kb"", ""57 kb""]",representation.file.file_size,high,representation.text.entity_name,1.0,no,representation.file.file_size,Values are file sizes '78 kb'; blind file_size is correct. Finetype entity_name is wrong.,file Size,sherlock
sherlock,,,"[""So."", ""Jr."", ""Jr."", ""Jr."", ""Fr."", ""Fr."", ""Jr."", ""Fr."", ""So."", ""So.""]",representation.discrete.categorical,high,geography.address.street_suffix,0.65,no,representation.discrete.categorical,Values are academic year abbreviations So./Jr./Sr./Fr.; blind categorical is correct. Finetype street_suffix is wrong.,class,sherlock
sherlock,,,"[""4530 ft"", ""5200 ft""]",representation.text.plain_text,medium,geography.address.postal_code,1.0,no,representation.text.plain_text,Values are elevation measurements with units '4530 ft'; blind plain_text is reasonable. Finetype postal_code is wrong.,elevation,sherlock
sherlock,,,"[""FR32520"", ""FR32488"", ""FR27979"", ""ZKPY""]",representation.identifier.alphanumeric_id,medium,finance.securities.sedol,0.5,no,representation.identifier.alphanumeric_id,Values are alphanumeric codes FR32520; blind alphanumeric_id is correct. Finetype sedol is wrong.,code,sherlock
sherlock,,,"[""750 ml"", ""1000 ml"", ""350 ml"", ""500 ml""]",representation.text.plain_text,medium,representation.file.excel_format,0.5,no,representation.text.plain_text,Values are volume measurements '750 ml'; blind plain_text is correct. Finetype excel_format is wrong.,capacity,sherlock
sherlock,,,"[""REMI"", ""REIN"", ""SULP"", ""FPAY"", ""FP"", ""PRDP"", ""AS"", ""AS"", ""AS"", ""AS""]",representation.discrete.categorical,high,representation.identifier.alphanumeric_id,0.5625,no,representation.discrete.categorical,Values are short patent event codes REMI/SULP/FPAY; blind categorical is correct. Finetype returned invalid label.,code,sherlock
sherlock,,,"[""3-4"", ""3-4"", ""3-4"", ""1-2"", ""PG"", ""4-5"", ""PG"", ""C"", ""PF"", ""1-2""]",representation.discrete.categorical,medium,representation.discrete.ordinal,0.033,no,representation.discrete.categorical,Values are basketball positions and grade ranges (PG/C/PF/1-2/3-4); blind categorical is correct. Finetype ordinal is less accurate.,position,sherlock
sherlock,,,"[""Bielefeld"", ""Bielefeld"", ""Lage (near Bielefeld)"", ""Bielefeld"", ""Paderborn""]",geography.location.city,high,representation.discrete.categorical,0.6,no,geography.location.city,,location,sherlock
sherlock,,,"[""James Banks"", ""D Elsworth"", ""Trevor Whelan"", ""D Elsworth"", ""D Elsworth"", ""E Ahern"", ""Mr P J Cosgrave"", ""R L Moore"", ""L Morris"", ""A Kirby""]",identity.person.full_name,high,geography.location.city,0.45,no,identity.person.full_name,Values are jockey names; blind full_name is correct. Finetype city is wrong.,jockey,sherlock
sherlock,,,"[""NC"", ""NC""]",representation.discrete.categorical,medium,geography.location.country_code,1.0,no,representation.discrete.categorical,Values are 'NC' abbreviation - a categorical code; blind categorical is correct. Finetype country_code is wrong.,state,sherlock
sherlock,,,"[""PDF (160K)"", ""Complete Source PDF (7.5M)""]",representation.file.file_size,medium,representation.numeric.decimal_number,0.5,no,representation.file.file_size,Values are 'PDF (160K)' file size descriptions; blind file_size is correct. Finetype decimal_number is wrong.,format,sherlock
sherlock,,,"[""Digital Subscription"", ""Digital Issue"", ""Back Issue Print (Issues 7-19)"", ""Print on Demand (Issues 20+)""]",representation.discrete.categorical,medium,representation.text.entity_name,1.0,no,representation.discrete.categorical,Values are product subscription types; blind categorical is correct. Finetype entity_name is less specific.,product,sherlock
sherlock,,,"[""1"", ""2"", ""3""]",representation.numeric.integer_number,high,representation.numeric.integer_number,0.8,yes,representation.numeric.integer_number,,rank,sherlock
sherlock,,,"[""Gilford NH"", ""Thackerville OK"", ""Cincinnati OH"", ""Noblesville IN"", ""Maryland Heights MO"", ""Albuquerque NM"", ""West Valley City UT"", ""Mansfield MA"", ""Bristow VA"", ""Virginia Beach VA""]",geography.location.city,high,representation.text.entity_name,0.5,no,geography.location.city,Values are 'City ST' format (US city + state abbrev); blind city is correct. Finetype entity_name is wrong.,city,sherlock
sherlock,,,"[""ALAMEDA"", ""CONTRA COSTA"", ""FRESNO"", ""KERN"", ""LOS ANGELES"", ""NAPA"", ""ORANGE"", ""PLACER"", ""RIVERSIDE"", ""SACRAMENTO""]",geography.location.region,high,representation.text.entity_name,0.125,no,geography.location.region,Values are California county names in uppercase; blind region is correct. Finetype entity_name is wrong.,county,sherlock
sherlock,,,"[""2015 - Present"", ""2011 - Present"", ""2008 - Present"", ""2008 - Present"", ""2006 - 2006"", ""2006 - 2008"", ""2004 - 2005"", ""2003 - 2004"", ""2000 - 2002"", ""2000 - 2003""]",representation.text.plain_text,high,identity.person.phone_number,0.667,no,representation.text.plain_text,Values are year range strings '2015 - Present'; blind plain_text is correct. Finetype phone_number is wrong.,duration,sherlock
sherlock,,,"[""Age: 24yrs."", """"]",representation.text.plain_text,medium,representation.text.entity_name,0.5,no,representation.text.plain_text,Values are age descriptions 'Age: 24yrs.'; blind plain_text is correct. Finetype entity_name is wrong.,age,sherlock
sherlock,,,"[""4216 S Scatterfield Rd"", ""10697 East US Highway 36"", ""240 N Gates Dr"", ""5151 E 82nd St"", ""1020 Veterans Pkwy, Ste 900"", ""10260 Maysville Road"", ""9749 E Washington St"", ""215 N Burkhardt Rd"", ""7801 S US Hwy 31"", ""3500 State Rd 38E""]",geography.address.street_name,high,representation.text.entity_name,0.65,no,geography.address.street_name,Values are street addresses; blind street_name is more specific. Finetype entity_name is wrong.,address,sherlock
sherlock,,,"[""Swainson hawk"", ""Red-tailed hawk"", ""Ferruginous hawk"", ""American kestrel*"", ""Peregrine falcon"", ""Golden eagle"", ""Great-horned owl"", ""Common barn owl"", ""Long-eared owl"", ""Other species\u2020""]",representation.text.entity_name,high,geography.location.region,0.136,no,representation.text.entity_name,Values are bird species names; both blind and finetype say entity_name. Finetype region is wrong.,species,sherlock
sherlock,,,"[""Bradley"", ""Davidson"", ""Hamilton"", ""Franklin"", ""Franklin"", ""Sumner"", ""Shelby"", ""Davidson"", ""Jefferson"", ""Washington""]",geography.location.region,high,identity.person.last_name,0.35,no,geography.location.region,Values are US county names; blind region is correct. Finetype last_name is wrong.,county,sherlock
sherlock,,,"[""10, Winsover Road"", ""13, Winsover Road"", ""14-16, Winsover Road"", ""Unit 8, 14-16, Winsover Road"", ""Unit 6, 14-16, Winsover Road"", ""Unit 2, 14-16, Winsover Road"", ""Unit 2, 14-16, Winsover Road"", ""Unit 7A, 14-16, Winsover Road"", ""Unit 2, 14-16, Winsover Road"", ""Unit 1, Winsover Centre, 14-16, Winsover Road""]",geography.address.street_name,medium,geography.address.full_address,0.7,no,geography.address.street_name,Values are street address components; finetype full_address is also reasonable but street_name is more specific for partial addresses.,address,sherlock
sherlock,,,"[""New car dealers"", ""Used car dealers"", ""Other motor vehicle dealers"", ""Auto parts, access., and tire stores"", ""Furniture stores"", ""Floor covering stores "", ""Other home furnishings stores "", ""Household appliance stores"", ""Radio, TV, and other elect. stores"", ""Computer and software stores""]",representation.discrete.categorical,high,representation.text.entity_name,0.5,no,representation.discrete.categorical,Values are retail store type categories; blind categorical is correct. Finetype entity_name is less specific.,type,sherlock
sherlock,,,"[""Gerard Von Hoffmann"", ""Timothy M Shead"", ""Peter R Finn"", ""Richard Neville"", ""Jack R Groselle"", ""Randy J Parker"", ""Doug C Malcolm"", ""Jim Helm"", ""Stuart S Waterbury"", ""Neal L Vestal""]",identity.person.full_name,high,representation.text.entity_name,0.8,no,identity.person.full_name,Values are full person names; blind full_name is correct. Finetype entity_name is less specific.,name,sherlock
sherlock,,,"[""Baptist"", ""Baptist"", ""Methodist/Pietist"", ""Methodist/Pietist"", ""Catholicism"", ""----"", ""Methodist/Pietist"", ""Baptist"", ""Pentecostal"", ""Presbyterian-Reformed""]",representation.discrete.categorical,medium,geography.location.region,0.063,no,representation.discrete.categorical,Values are religious denomination names; blind categorical is correct. Finetype region is wrong.,family,sherlock
sherlock,,,"[""2014"", ""1993"", ""2000"", ""2002"", ""2003"", ""2003"", ""2002"", ""1994"", ""1995"", ""1988""]",datetime.component.year,high,datetime.component.year,1.0,yes,datetime.component.year,,year,sherlock
sherlock,,,"[""76.1"", ""75.5"", ""73.0"", ""75.0"", ""76.1"", ""73.0"", ""74.9"", ""74.5"", ""75.0"", ""74.4""]",representation.numeric.decimal_number,high,representation.numeric.decimal_number,1.0,yes,representation.numeric.decimal_number,,depth,sherlock
sherlock,,,"[""None"", ""Carlow"", ""Dublin "", ""Kildare"", ""Kilkenny"", ""Laois"", ""Longford"", ""Louth"", ""Meath"", ""Offaly""]",geography.location.region,high,geography.location.region,0.1,yes,geography.location.region,Values are Irish county names; blind region is correct. Finetype region is also correct - agreement.,county,sherlock
sherlock,,,"[""Seafoam Islands (B1f)"", ""Seafoam Islands (B2f)"", ""Seafoam Islands (B3f)"", ""Seafoam Islands (B4f)""]",geography.location.region,medium,representation.text.entity_name,1.0,no,geography.location.region,Values are game area/location names; finetype entity_name is wrong. Blind region is more appropriate.,area,sherlock
sherlock,,,"[""isbn 0743291638"", ""isbn 0743236017"", ""isbn 0743264460"", ""isbn 0743284887"", ""isbn 068483846X"", ""isbn 0140293469"", ""isbn 1594481938"", ""isbn 1573220876"", ""isbn 1573226882"", ""isbn 0553348477""]",identity.commerce.isbn,high,representation.discrete.categorical,0.025,no,identity.commerce.isbn,Values are 'isbn XXXXXXXXXX' format; blind isbn is correct. Finetype categorical is wrong.,isbn,sherlock
sherlock,,,"[""Freelance"", ""Full Time"", ""Full Time"", ""Full Time"", ""Full Time"", ""Full Time"", ""Full Time"", ""Full Time"", ""Full Time"", ""Full Time""]",representation.discrete.categorical,medium,representation.text.entity_name,0.95,no,representation.discrete.categorical,Values are employment status categories; blind categorical is correct. Finetype entity_name is wrong.,duration,sherlock
sherlock,,,"[""28.5"", ""26.8"", ""29.1"", ""27.7"", ""32.0"", ""33.2""]",representation.numeric.decimal_number,high,representation.numeric.decimal_number,1.0,yes,representation.numeric.decimal_number,,weight,sherlock
sherlock,,,"[""Condo"", ""Condo"", ""Condo"", ""Condo"", ""Condo"", ""Condo"", ""Condo"", ""Condo"", ""Condo"", ""Condo""]",representation.discrete.categorical,high,representation.text.entity_name,0.025,no,representation.discrete.categorical,Values are property type categories (Condo/Home); blind categorical is correct. Finetype entity_name is wrong.,type,sherlock
sherlock,,,"[""Sustainable Compensation"", ""Employee Satisfaction Evaluation"", ""Staff Professional Development in Sustainability"", ""Sustainability in New Employee Orientation"", ""Employee Sustainability Educators Program"", ""Childcare"", ""Employee Wellness Program"", ""Socially Responsible Retirement Plan""]",representation.text.plain_text,medium,representation.text.entity_name,0.875,no,representation.text.plain_text,Values are program initiative names; blind plain_text is correct. Finetype entity_name is less appropriate.,credit,sherlock
sherlock,,,"[""PDF (28K)"", ""Complete Source PDF (6.9M)""]",representation.file.file_size,medium,geography.location.country,0.5,no,representation.file.file_size,Values are 'PDF (28K)' format descriptions; blind file_size is correct. Finetype country is wrong.,format,sherlock
