source,source_file,column_name,sample_values,blind_label,blind_confidence,finetype_label,finetype_confidence,agreement,final_label,reasoning,ground_truth_label,ground_truth_source
sherlock,,,"[""SDSM"", ""WCM"", ""AFAM"", ""1776"", ""SLUG"", ""MARY"", ""O*H*"", ""STAN"", ""METR"", ""1776""]",representation.identifier.alphanumeric_id,medium,representation.text.entity_name,0.6000,no,representation.identifier.alphanumeric_id,Values are club/organization abbreviation codes including '1776' and special chars like 'O*H*'.,club,sherlock
sherlock,,,"[""Sioux City, Iowa"", ""Orange City, Iowa"", ""Mitchell, South Dakota"", ""Mitchell, South Dakota"", ""Crete, Nebraska"", ""Crete, Nebraska"", ""Lincoln, Nebraska"", ""Fremont, Nebraska"", ""Sioux City, Iowa"", ""Sioux City, Iowa""]",geography.location.city,high,representation.text.entity_name,1.0000,no,geography.location.city,"Values are 'City, State' format location strings. FineType entity_name misses the geographic nature.",location,sherlock
sherlock,,,"[""Nottingham"", ""Nottingham"", ""London""]",geography.location.city,high,geography.location.region,0.6700,no,geography.location.city,Values are UK city names. FineType region classification is less specific than city.,city,sherlock
sherlock,,,"[""Rest of Season ? Projected stats for the rest of the season as calculated by PECOTA, Baseball Prospectus' proprietary system that projects player performance based on comparisons with historical player-seasons"", ""Cumulative ? Projected end-of-season stats, combining year-to-date stats with PECOTA projected stats for the remainder of the season""]",representation.text.sentence,high,geography.address.full_address,0.5000,no,representation.text.sentence,Values are long descriptive sentences/explanations. FineType full_address is clearly wrong.,duration,sherlock
sherlock,,,"[""Central"", ""Central"", ""Central"", ""Central"", ""Central"", ""Central"", ""Central"", ""Central"", ""Central"", ""Central""]",representation.discrete.categorical,high,geography.location.region,1.0000,no,representation.discrete.categorical,Values are all 'Central' - a single categorical value. FineType region is wrong.,region,sherlock
sherlock,,,"[""489"", ""738"", ""1192""]",representation.numeric.integer_number,high,representation.identifier.numeric_code,1.0000,no,representation.numeric.integer_number,"Values (489, 738, 1192) are plain integers, not structured numeric codes.",region,sherlock
sherlock,,,"["""", """", """", """", """", """", """", """", """", """", ""Eastern College Athletic Conference Bowl""]",representation.text.plain_text,medium,representation.boolean.initials,0.9100,no,representation.text.plain_text,Column is mostly empty with one value being a conference name. FineType boolean initials is wrong.,notes,sherlock
sherlock,,,"[""Newspaper Archives"", ""Newspaper Archives"", ""Newspaper Archives"", ""Newspaper Archives"", ""Newspaper Archives"", ""Newspaper Archives"", ""Newspaper Archives""]",representation.text.entity_name,high,representation.text.entity_name,1.0000,yes,representation.text.entity_name,,collection,sherlock
sherlock,,,"[""Healthcare"", ""Healthcare"", ""Healthcare"", ""Construction/Contractor"", ""Healthcare"", ""Education"", ""Technology"", ""Food and Beverage"", ""Employment Services"", ""Professional Services""]",representation.discrete.categorical,high,representation.text.entity_name,0.5000,no,representation.discrete.categorical,Values are industry sector category labels. FineType entity_name is less specific.,industry,sherlock
sherlock,,,"[""United States"", ""United States"", ""United States"", ""United States"", ""United States"", ""Norway"", ""United States"", ""United States"", ""United Kingdom"", ""United Kingdom""]",geography.location.country,high,geography.location.country,0.8500,yes,geography.location.country,,country,sherlock
sherlock,,,"[""SINGLETRAC"", ""snipsnip"", ""thrasher"", ""FRAMERATE"", ""buzz"", ""macleod"", ""JUMPANUBIS"", ""JUMPJUGGERNAUT"", ""JUMPDEAD"", ""JUMPOASIS""]",representation.identifier.alphanumeric_id,medium,representation.discrete.categorical,0.5000,no,representation.identifier.alphanumeric_id,Values are game cheat codes/usernames. Blind alphanumeric_id is more appropriate than categorical.,code,sherlock
sherlock,,,"[""Monday"", ""Tuesday"", ""Wednesday"", ""Thursday"", ""Friday"", ""Saturday"", ""Sunday""]",datetime.component.day_of_week,high,datetime.component.day_of_week,0.8600,yes,datetime.component.day_of_week,,day,sherlock
sherlock,,,"[""Service Sector, overall rate"", ""- Nursing/personal care facilities"", ""- Hospitals"", ""- Amusement/ recreation services"", ""Construction, overall rate"", ""Agriculture, overall rate"", ""Private Industry, overall rate""]",representation.text.plain_text,high,representation.text.entity_name,0.4300,no,representation.text.plain_text,Values are industry/sector description strings with mixed formatting. entity_name is too specific.,industry,sherlock
sherlock,,,"[""Slaughter On 10th Ave"", ""1979-1983 Volume 1"", ""Disintegration"", ""Pretty Hate Machine"", ""Famous Ghost Stories!"", ""Rain Dogs"", ""Alien soundtrack"", ""Any Day Now"", ""Disintegration"", ""Disco Undead""]",representation.text.plain_text,high,representation.text.entity_name,0.4000,no,representation.text.plain_text,Values are music album titles. FineType entity_name is close but plain_text better captures album title nature.,album,sherlock
sherlock,,,"[""Army"", ""Army"", ""Army"", ""Army"", ""Army"", ""Army"", ""Army"", ""Army"", ""Army"", ""Army""]",representation.discrete.categorical,high,geography.location.country,0.5000,no,representation.discrete.categorical,"Values are military service branch names (Army, Marines, Navy), a categorical set. FineType country is wrong.",service,sherlock
sherlock,,,"[""Australia"", ""New Zealand"", ""South Africa"", ""Argentina""]",geography.location.country,high,geography.location.country,0.5000,yes,geography.location.country,,team,sherlock
sherlock,,,"[""26.6"", ""28.8""]",representation.numeric.decimal_number,high,representation.numeric.decimal_number,1.0000,yes,representation.numeric.decimal_number,,weight,sherlock
sherlock,,,"[""Book"", ""Book"", ""Book"", ""Reference""]",representation.discrete.categorical,high,representation.text.entity_name,0.7500,no,representation.discrete.categorical,Values are publication format categories. FineType entity_name is less specific.,format,sherlock
sherlock,,,"[""Nonfiction, Children's"", ""Nonfiction, Children's"", ""Nonfiction, Children's"", ""Nonfiction, Children's"", ""Nonfiction, Children's""]",representation.discrete.categorical,high,representation.text.entity_name,1.0000,no,representation.discrete.categorical,Values are all the same collection category label. FineType entity_name is less specific.,collection,sherlock
sherlock,,,"[""male"", ""male"", ""female"", ""male"", ""male"", ""male"", ""male"", ""female"", ""female"", ""male""]",identity.person.gender,high,identity.person.gender,1.0000,yes,identity.person.gender,,gender,sherlock
sherlock,,,"[""Japan"", ""North America"", ""Europe""]",geography.location.continent,high,geography.location.continent,0.6700,yes,geography.location.continent,,region,sherlock
