source,source_file,column_name,sample_values,blind_label,blind_confidence,finetype_label,finetype_confidence,agreement,final_label,reasoning,ground_truth_label,ground_truth_source
sherlock,,,"[""TX"", ""OK"", ""TX"", ""FL"", ""FL"", ""GA"", ""SC"", ""NC"", ""VA"", ""DC""]",geography.location.region,high,geography.location.country_code,0.8500,no,geography.location.region,FineType classified as country_code but TX/OK/FL/GA are US state abbreviations; region is more appropriate than country_code.,state,sherlock
sherlock,,,"[""R Walsh"", ""P Townend"", ""Mr P W Mullins"", ""Mr P W Mullins"", ""Mr P W Mullins""]",identity.person.full_name,high,representation.text.entity_name,0.8000,no,identity.person.full_name,FineType classified as entity_name but 'R Walsh'/'Mr P W Mullins' are person names (abbreviated); full_name is correct.,jockey,sherlock
sherlock,,,"[""PRESCHOOL-K"", ""K-8"", ""PRESCHOOL-1"", ""4-12"", ""PRESCHOOL-1"", ""PRESCHOOL-5"", ""PRESCHOOL-5"", ""K-8"", ""K-8""]",representation.text.plain_text,medium,geography.location.country,0.4444,no,representation.text.plain_text,FineType classified as entity_name but 'PRESCHOOL-K'/'K-8'/'4-12' are school grade range descriptors; plain_text is correct.,grades,sherlock
sherlock,,,"[""EUR / USD"", ""USD / JPY"", ""GBP / USD"", ""USD / CHF"", ""USD / CAD"", ""EUR / JPY"", ""AUD / USD""]",finance.currency.currency_code,medium,representation.text.entity_name,1.0000,no,finance.currency.currency_code,FineType classified as entity_name but 'EUR / USD' are forex currency pair designators; currency_code is correct.,currency,sherlock
sherlock,,,"[""BUS LANE, CANAL STREET"", ""BUS LANE, YORK RD JUNC MARSH LANE"", ""BUS LANE, YORK RD JUNC MARSH LANE"", ""BUS LANE, LOW ROAD JUNC OLD MILL LANE"", ""BUS LANE, LOW ROAD JUNC OLD MILL LANE""]",geography.address.street_name,high,representation.text.entity_name,0.8500,no,geography.address.street_name,FineType returned representation.text.entity_name (conf 0.85); blind classification preferred based on semantic analysis of values.,location,sherlock
sherlock,,,"[""AIM Short Term Investments Tr Liquid Assets Port - Insti Class"", ""Progressive Corp."", ""American Express Co."", ""Analog Devices Inc."", ""TE Connectivity Ltd."", ""AbbVie Inc."", ""Qualcomm Inc."", ""Berkshire Hathaway Inc. Cl A"", ""EMC Corp."", ""Taiwan Semiconductor Manufacturing Co. Ltd.""]",representation.text.entity_name,high,representation.text.entity_name,0.4000,yes,representation.text.entity_name,,company,sherlock
sherlock,,,"[""United States"", ""Brazil"", ""N/A"", ""China"", ""Ukraine"", """"]",geography.location.country,high,geography.location.country,0.6667,yes,geography.location.country,,origin,sherlock
sherlock,,,"[""FR Doc."", ""RIN"", ""Item"", ""Sequence No."", ""Docket No."", ""FAR Case"", ""FAC""]",representation.text.word,medium,identity.person.full_name,0.4286,no,representation.text.word,FineType classified as entity_name but 'FR Doc.'/'RIN'/'Docket No.' are document reference type abbreviations; word is more appropriate.,type,sherlock
sherlock,,,"[""Japanese"", ""English"", ""French"", ""German"", ""Italian"", ""Spanish"", ""Portuguese"", ""Korean"", ""Chinese (Mandarin)""]",representation.text.word,high,geography.location.country,0.5556,no,representation.discrete.categorical,FineType classified as entity_name but Japanese/English/French are language name categories; categorical is more appropriate.,language,sherlock
sherlock,,,"[""Real Estate"", ""Health Professionals"", ""Insurance"", ""Home Builders"", ""Automotive"", ""Special Trade Contractors"", ""Lobbyists"", ""General Contractors"", ""Building Materials & Equipment"", ""Beer, Wine & Liquor""]",representation.discrete.categorical,high,representation.text.entity_name,0.6000,no,representation.discrete.categorical,FineType returned representation.text.entity_name (conf 0.60); blind classification preferred based on semantic analysis of values.,industry,sherlock
sherlock,,,"[""UG -"", ""PK -"", ""PK -"", ""UG -"", ""UG -"", ""PK -"", ""UG -"", ""PK -"", ""- 12"", ""KG - 8""]",representation.text.plain_text,medium,representation.text.entity_name,0.5500,no,representation.text.plain_text,FineType classified as entity_name but 'UG -'/'PK -'/'KG - 8' are school grade range codes; plain_text is correct.,grades,sherlock
sherlock,,,"[""HORIZON GLOBAL CORP"", ""COLUMBUS MCKINNON CORP N Y"", ""XCERRA CORP"", ""RUSH ENTERPRISES INC"", ""FIRST BUSEY CORP"", ""PIER 1 IMPORTS INC"", ""CURTISS WRIGHT CORP"", ""SIGNET JEWELERS LIMITED"", ""EVERTEC INC"", ""KNOWLES CORP""]",representation.text.entity_name,high,representation.text.entity_name,0.5000,yes,representation.text.entity_name,,company,sherlock
sherlock,,,"[""FACT"", ""FACT"", ""FACT"", ""GAJA"", ""CMS"", ""FMM"", ""LCM"", ""SBM"", ""WCM"", ""NEM""]",representation.text.word,medium,geography.transportation.iata_code,0.3000,no,representation.discrete.categorical,FineType classified as entity_name but FACT/GAJA/CMS/FMM appear to be organizational/fund codes; categorical is more appropriate.,club,sherlock
sherlock,,,"["""", ""F"", """", ""F"", """", ""F"", """", ""F"", """", ""F""]",identity.person.gender_code,medium,representation.boolean.initials,0.8000,no,identity.person.gender_code,FineType classified as boolean.initials but 'F' alternating with empty is a gender code field; gender_code is correct.,sex,sherlock
sherlock,,,"[""System in service"", ""Component out of service"", ""System out of service"", ""Telco major alarm"", ""Telco minor alarm"", ""Telco critical alarm""]",representation.text.plain_text,high,container.array.whitespace_separated,0.5000,no,representation.text.plain_text,FineType returned container.array.whitespace_separated (conf 0.50); blind classification preferred based on semantic analysis of values.,component,sherlock
sherlock,,,"[""SURFACE LAYER FORMING METHOD USING ELECTRICAL DISCHARGE MACHINING AND SURFACE LAYER - Using electrical discharge surface treatment..."", ""ELECTRICAL DISCHARGE SURFACE TREATMENT METHOD - There is an electrical discharge surface treatment method...""]",representation.text.paragraph,high,representation.text.paragraph,0.5000,yes,representation.text.paragraph,,description,sherlock
sherlock,,,"[""EUR / USD"", ""USD / JPY"", ""GBP / USD"", ""USD / CHF"", ""USD / CAD"", ""EUR / JPY"", ""AUD / USD""]",finance.currency.currency_code,medium,representation.text.entity_name,1.0000,no,finance.currency.currency_code,FineType classified as entity_name but 'EUR / USD' are forex currency pair designators; currency_code is correct.,currency,sherlock
sherlock,,,"[""4Fe-4S ferredoxin-type 1PROSITE-ProRule annotation Manual validated information which has been generated by the UniProtKB automatic annotation system."", ""4Fe-4S ferredoxin-type 2PROSITE-ProRule annotation Manual validated information which has been generated by the UniProtKB automatic annotation system.""]",representation.text.paragraph,high,representation.text.paragraph,1.0000,yes,representation.text.paragraph,,description,sherlock
sherlock,,,"[""1"", ""2"", ""3"", ""4"", ""5"", ""6"", ""7"", ""8"", ""9"", ""10""]",representation.identifier.increment,high,representation.identifier.numeric_code,0.5500,no,representation.identifier.increment,FineType classified as numeric_code but values are sequential 1-20 (rank index); increment is more specific.,rank,sherlock
sherlock,,,"[""Salt Lake City (U.S.A. - Utah)"", ""Halifax (Canada - Nova Scotia)""]",geography.location.city,medium,geography.location.region,0.5000,no,geography.location.city,FineType classified as region but 'Salt Lake City (U.S.A. - Utah)' and 'Halifax (Canada - Nova Scotia)' are city names with location context; city is correct.,location,sherlock
sherlock,,,"[""180.76"", ""apsobol.com"", ""yandex.ru"", ""googlebot.com"", ""baidu.com"", ""ctinets.com"", ""121"", ""122"", ""tulipconnect.com"", ""203.131""]",technology.internet.hostname,medium,technology.internet.hostname,0.4000,yes,technology.internet.hostname,,organisation,sherlock
sherlock,,,"[""Speed Shot 8.5 Oz Fruit Burst"", ""Speed Shot 8.5 Oz Grape Frost""]",representation.text.entity_name,high,representation.text.entity_name,1.0000,yes,representation.text.entity_name,,product,sherlock
sherlock,,,"[""China"", ""United States"", ""Panama"", """"]",geography.location.country,high,geography.location.country,0.5000,yes,geography.location.country,,origin,sherlock
sherlock,,,"[""Indianola, IA"", ""Beloit, WI"", ""Beloit, WI"", ""Ripon, WI"", ""Galesburg, IL"", ""Lake Forest, IL"", ""Beloit, WI""]",geography.location.city,high,representation.text.entity_name,0.8571,no,geography.location.city,"FineType classified as entity_name but 'Indianola, IA'/'Beloit, WI' are city+state location strings; city is correct.",location,sherlock
