source,source_file,column_name,sample_values,blind_label,blind_confidence,finetype_label,finetype_confidence,agreement,final_label,reasoning,ground_truth_label,ground_truth_source
sherlock,,,"[""Androscoggin"", ""Aroostook"", ""Cumberland"", ""Franklin"", ""Hancock"", ""Kennebec"", ""Knox"", ""Lincoln"", ""Oxford"", ""Penobscot""]",geography.location.region,medium,geography.location.region,0.4375,yes,geography.location.region,,county,sherlock
sherlock,,,"[""4035"", ""3417"", ""3439"", ""3086"", ""3296"", ""3175"", ""3417"", ""3439"", ""3362"", ""2500""]",representation.numeric.integer_number,medium,representation.identifier.numeric_code,0.8500,no,representation.numeric.integer_number,Values are numeric integers (weights/counts); FineType correctly identifies as numeric_code but integer_number is more accurate for contextual counts.,weight,sherlock
sherlock,,,"[""Quest Bar No Artificial Sweeteners Banana Nut Muffin"", ""Quest Bar No Artificial Sweeteners Chocolate Peanut Butter"", ""Quest Bar No Artificial Sweeteners Cinnamon Roll"", ""Quest Bar No Artificial Sweeteners Coconut Cashew"", ""Quest Bar No Artificial Sweeteners Lemon Cream Pie"", ""Quest Bar No Artificial Sweeteners Strawberry Cheesecake""]",representation.text.plain_text,high,geography.address.full_address,0.8333,no,representation.text.plain_text,"Values are product names/descriptions, not street addresses; FineType misclassified due to multi-word text pattern.",product,sherlock
sherlock,,,"["""", ""BLR"", """", ""BLR"", """", ""BLR"", ""BLR"", """", ""BLR"", """"]",representation.text.word,medium,geography.transportation.iata_code,0.5500,no,representation.text.word,Values are a 3-letter airport code (BLR=Bangalore) with many empty strings; iata_code is plausible but not confirmed without context.,country,sherlock
sherlock,,,"[""2012"", ""2012"", ""2013"", ""2014"", ""2013"", ""2010"", ""2011"", ""2012"", ""2004"", ""2011""]",datetime.component.year,high,datetime.component.year,1.0000,yes,datetime.component.year,,year,sherlock
sherlock,,,"[""Guernsey"", ""Northern Ireland"", ""Jersey"", ""London"", ""Scotland"", ""South East England"", ""Wales"", ""South West England"", ""West Midlands"", ""Isle Of Man""]",geography.location.region,high,geography.location.region,0.5000,yes,geography.location.region,,region,sherlock
sherlock,,,"[""000060 Shenzhen Zhongjin Lingnan Nonfemet Co. Ltd. A"", ""600432 Ji Lin Ji En Nickel Industry Co. Ltd. A"", ""603993 China Molybdenum Co. Ltd. A"", ""002716 Chenzhou Jingui Silver Industry Co. Ltd.""]",representation.text.plain_text,medium,geography.address.full_address,0.7500,no,representation.text.entity_name,"Values are company names prefixed with numeric codes; full_address is incorrect, entity_name is better.",company,sherlock
sherlock,,,"[""N"", ""N"", ""N"", ""N"", ""N"", ""N"", ""N"", ""N"", ""N"", ""N""]",representation.boolean.initials,medium,representation.boolean.initials,1.0000,yes,representation.boolean.initials,,region,sherlock
sherlock,,,"[""31.5"", ""26.1""]",representation.numeric.decimal_number,high,representation.numeric.decimal_number,1.0000,yes,representation.numeric.decimal_number,,weight,sherlock
sherlock,,,"[""None"", ""None"", ""None"", ""None""]",representation.text.word,low,geography.address.street_suffix,1.0000,no,representation.text.word,Values are all 'None' string literals; street_suffix is incorrect.,company,sherlock
sherlock,,,"[""16. Notts County"", ""17. Oxford"", ""18. Plymouth"", ""19. Portsmouth"", ""20. Stevenage"", ""21. Wimbledon"", ""22. Wycombe""]",representation.text.plain_text,medium,representation.text.entity_name,0.4286,no,representation.text.plain_text,Values are ranked team names with numeric prefix; entity_name is reasonable but plain_text better captures the mixed format.,team,sherlock
sherlock,,,"[""OREG"", ""TOC"", ""PNA"", ""DCM"", ""CONN"", ""PNA"", ""UNAT"", ""O*H*"", ""SDSM"", ""SPM""]",representation.text.word,low,geography.transportation.iata_code,0.3000,no,representation.text.word,"Values are short opaque codes (OREG, TOC etc.); iata_code is wrong as these don't match airport codes.",club,sherlock
sherlock,,,"[""isbn 0983157227"", ""isbn 0399256776"", ""isbn 1596435690"", ""isbn 0061996181"", ""isbn 0373210329"", ""isbn 0373210612"", ""isbn 1444778536"", ""isbn 039925675X"", ""isbn 0399256768"", ""isbn 0007442912""]",identity.commerce.isbn,high,representation.identifier.alphanumeric_id,0.0526,no,identity.commerce.isbn,"Values clearly have 'isbn' prefix followed by ISBN numbers; blind label identity.commerce.isbn is correct, FineType's alphanumeric_id is wrong.",isbn,sherlock
sherlock,,,"[""Dublin, Ireland"", ""Austria, Armenia, Poland, Romania, Hungary, Lithuania, Russia"", ""Israel"", ""New York, NY"", ""Austin, TX"", ""Montevideo, Uruguay"", ""Santa Barbara, CA""]",geography.location.city,medium,representation.text.entity_name,0.8571,no,geography.location.city,"Values are mixed location strings (city+country, multiple countries); city is best approximation vs entity_name.",location,sherlock
sherlock,,,"[""Anesthesia"", ""Anesthesia"", ""Lab Animal Medicine"", ""Equine Ultrasound"", ""Ophthalmology"", ""Behavior"", ""Behavior"", ""Small Animal Medicine""]",representation.text.plain_text,medium,geography.location.country,0.3750,no,representation.text.plain_text,"Values are medical specialties/service names; country is incorrect, plain_text is better.",service,sherlock
sherlock,,,"[""1984"", ""1987"", ""1990"", ""1993"", ""1996"", ""1999"", ""2002"", ""2005"", ""2008""]",datetime.component.year,high,datetime.component.year,0.8889,yes,datetime.component.year,,year,sherlock
sherlock,,,"[""Miquel Navarro"", ""Eduardo Chillida"", ""Luis Gordillo"", ""Antoni T\u00e0pies"", ""Evru / Zush""]",identity.person.full_name,high,representation.discrete.categorical,0.6000,no,identity.person.full_name,Values are artist names (full names of people); FineType's categorical is incorrect.,artist,sherlock
sherlock,,,"[""FMM"", ""FACT"", ""FACT"", ""WCM"", ""SMMM""]",representation.text.word,low,representation.text.entity_name,0.6000,no,representation.text.word,Values are short organizational codes; entity_name interpretation is plausible but word is safer.,club,sherlock
sherlock,,,"[""4"", ""5"", ""6"", ""6""]",representation.numeric.integer_number,medium,representation.numeric.integer_number,1.0000,yes,representation.numeric.integer_number,,age,sherlock
sherlock,,,"[""Lawyers/Law Firms"", ""Leadership PACs"", ""Real Estate"", ""Public Sector Unions"", ""Building Trade Unions""]",representation.text.plain_text,medium,representation.text.entity_name,0.8000,no,representation.text.entity_name,FineType confident (0.80); deferring to its prediction over blind label.,industry,sherlock
sherlock,,,"[""Oregon"", ""Colorado"", ""Montana"", ""Utah"", ""South Dakota"", ""Massachusetts"", ""North Dakota"", ""California"", ""Washington"", ""Minnesota""]",geography.location.region,high,geography.location.region,0.6000,yes,geography.location.region,,state,sherlock
sherlock,,,"[""WESTMORELAND"", """"]",geography.location.region,low,technology.internet.http_method,0.5000,no,geography.location.region,Single value 'WESTMORELAND' is a county/region name; http_method is clearly wrong.,county,sherlock
sherlock,,,"[""U.S. Commission on Security and Cooperation in Europe"", ""U.S. Commission on Security and Cooperation in Europe"", ""U.S. Department of State"", ""U.S. Department of State"", ""National Endowment for Democracy"", ""Georgetown University""]",representation.text.entity_name,high,representation.text.entity_name,0.6667,yes,representation.text.entity_name,,affiliation,sherlock
sherlock,,,"[""Laurie Dodd"", ""Joy Stover"", ""Alexandra Nieto"", ""Tobey-Anne Saracino"", ""Anicia Criscione"", ""Karin Finn"", ""Karla Rees"", ""Amy Dickerson"", ""Alicia Bechtle"", ""Kimberly Adams""]",identity.person.full_name,high,identity.person.full_name,0.3000,yes,identity.person.full_name,,name,sherlock
sherlock,,,"[""F"", ""F"", ""F"", ""F"", ""F"", ""F"", ""F"", ""F"", ""F""]",identity.person.gender_code,medium,representation.boolean.initials,1.0000,no,identity.person.gender_code,Values are all 'F' - gender code; boolean initials is similar but gender_code is more precise.,sex,sherlock
sherlock,,,"[""LAM"", ""SMMM"", ""TOC"", ""SMMM"", ""SPRD"", ""LBM"", ""TROJ"", ""SMS"", ""PNA"", ""AMAM""]",representation.text.word,low,representation.text.entity_name,0.5000,no,representation.text.word,Short opaque codes; entity_name is plausible but word is safer for unknown codes.,club,sherlock
sherlock,,,"[""Last 7 Games"", ""Last 15 Games"", ""Last 30 Games""]",representation.text.plain_text,medium,representation.text.entity_name,1.0000,no,representation.text.plain_text,Values are time-period descriptions like 'Last 7 Games'; entity_name is incorrect.,duration,sherlock
sherlock,,,"[""2005"", ""2009"", ""2010"", ""2006"", ""2009"", ""2009"", ""2010"", ""2008"", ""2008"", ""2008""]",datetime.component.year,high,datetime.component.year,1.0000,yes,datetime.component.year,,year,sherlock
sherlock,,,"[""32.2"", ""28.0""]",representation.numeric.decimal_number,high,representation.numeric.decimal_number,1.0000,yes,representation.numeric.decimal_number,,weight,sherlock
sherlock,,,"[""CAL-MAINE F\u2026"", ""GTT COMMUNI\u2026"", ""SIMULATIONS\u2026"", ""BOOT BARN H\u2026"", ""CARROLS RES\u2026""]",representation.text.entity_name,medium,geography.location.country,0.1000,no,representation.text.entity_name,"Truncated company names; country is incorrect, entity_name is better.",company,sherlock
sherlock,,,"[""A Semiotic Model"", ""A Semiotic Model"", ""A Semiotic Model"", ""Discourse analysis"", ""Discourse analysis"", ""Discourse analysis"", ""In search of Patterns"", ""In search of Patterns"", ""In search of Patterns"", ""Storytelling and Narrative""]",representation.text.plain_text,medium,representation.text.entity_name,0.3000,no,representation.text.plain_text,Values are academic/book titles; entity_name is plausible but plain_text is better.,person,sherlock
sherlock,,,"["""", ""L"", """", ""L"", """", ""L"", """", ""L"", """", ""L""]",representation.text.word,low,representation.scientific.measurement_unit,0.5000,no,representation.boolean.initials,"Values are single letter 'L' alternating with empty; measurement_unit is wrong, initials/boolean is more fitting.",class,sherlock
sherlock,,,"[""Bug"", ""Free style"", ""Free style"", ""Other"", ""Free style"", ""Free style"", ""Free style"", ""Free style"", ""Free style"", ""Bug""]",representation.discrete.categorical,high,representation.text.entity_name,0.5500,no,representation.discrete.categorical,Low FineType confidence (0.55); blind classification preferred.,type,sherlock
sherlock,,,"[""Last 7 Games"", ""Last 15 Games"", ""Last 30 Games""]",representation.text.plain_text,medium,representation.text.entity_name,1.0000,no,representation.text.plain_text,Time period phrases 'Last X Games'; entity_name is incorrect.,duration,sherlock
sherlock,,,"[""Sydney"", ""Athina""]",geography.location.city,medium,identity.person.last_name,0.5000,no,geography.location.city,Sydney and Athina (Athens) are cities; last_name is incorrect.,city,sherlock
sherlock,,,"[""Securities and Commodity Contracts Intermediation and Brokerage"", ""Other Financial Investment Activities"", ""Pipeline Transportation of Natural Gas"", ""Securities and Commodity Exchanges"", ""Scientific Research and Development Services""]",representation.text.plain_text,medium,representation.text.entity_name,0.8000,no,representation.text.entity_name,FineType confident (0.80); deferring to its prediction over blind label.,industry,sherlock
sherlock,,,"[""AS"", ""CC"", ""FPAY"", ""FPAY"", ""AS"", ""AS"", ""FPAY""]",representation.text.word,low,geography.location.country_code,0.4286,no,representation.text.word,"Short codes (AS, CC, FPAY); country_code is plausible for 2-letter but these aren't ISO country codes.",code,sherlock
sherlock,,,"[""1"", ""2"", ""3"", ""4"", ""5""]",representation.identifier.increment,high,representation.numeric.integer_number,0.8000,no,representation.identifier.increment,Sequential integers 1-5; FineType's integer_number is also valid but increment is more precise.,company,sherlock
sherlock,,,"[""94 kg"", ""94 kg"", ""85 kg"", ""94 kg"", ""85 kg"", ""85 kg"", ""85 kg"", ""85 kg"", ""85 kg""]",identity.person.weight,high,identity.person.weight,1.0000,yes,identity.person.weight,,category,sherlock
sherlock,,,"[""Slateport City"", ""Lilycove City"", ""Mossdeep City"", ""Ever Grande City"", ""Dewford Town"", ""Pacifidlog Town"", ""Route 103"", ""Route 104"", ""Route 105"", ""Route 106""]",representation.text.plain_text,medium,representation.text.entity_name,0.9000,no,representation.text.plain_text,Fictional place names from Pokemon game; entity_name is plausible but plain_text is better for fictional locations.,area,sherlock
sherlock,,,"[""Short Attention Span Theatre"", ""Stand up Stand up"", ""Latino Laugh Festival: The Show"", ""Asia St. Comedy"", ""Funny is Funny""]",representation.text.plain_text,medium,representation.text.entity_name,0.6000,no,representation.text.plain_text,TV show titles; entity_name is plausible but plain_text better captures show title nature.,credit,sherlock
sherlock,,,"[""Medical and Diagnostic Laboratories"", ""Specialty (except Psychiatric and Substance Abuse) Hospitals"", ""Offices of Physicians"", ""Scientific Research and Development Services"", ""Outpatient Care Centers""]",representation.text.plain_text,medium,representation.text.entity_name,0.6000,no,representation.text.plain_text,Medical industry names; entity_name is plausible but plain_text is better.,industry,sherlock
sherlock,,,"[""Add a general KPart adapter to Kasten, than finish port of Okteta KPart to Okteta Kasten"", ""Add global toggle option for the offset display, hex or decimal"", ""Add Kate-like combined dialogs to query for actions on files"", ""add Kate-like search tool"", ""Add Okular like embedded notifications""]",representation.text.sentence,high,representation.text.entity_name,0.3684,no,representation.text.sentence,Low FineType confidence (0.37); blind classification preferred.,description,sherlock
sherlock,,,"["""", ""F"", """", ""F"", """", ""F"", """", ""F"", """", ""F""]",identity.person.gender_code,medium,representation.boolean.initials,0.8000,no,identity.person.gender_code,"Values are 'F' gender codes; boolean initials is too generic, gender_code is more precise.",sex,sherlock
sherlock,,,"[""Auditorium"", ""Auditorium"", ""Cafeteria"", ""Cafeteria"", ""Cafeteria"", ""Cafeteria"", ""Lobby"", ""Lobby"", ""Cafeteria"", ""Auditorium""]",representation.discrete.categorical,high,geography.location.region,0.5000,no,representation.discrete.categorical,Low FineType confidence (0.50); blind classification preferred.,location,sherlock
sherlock,,,"["""", ""Year of fee payment: 4"", ""Year of fee payment: 8""]",representation.text.plain_text,medium,container.array.whitespace_separated,0.6667,no,representation.text.plain_text,Fee payment descriptions; whitespace_separated is incorrect.,description,sherlock
sherlock,,,"[""274.0"", ""0.0""]",representation.numeric.decimal_number,high,representation.numeric.decimal_number,1.0000,yes,representation.numeric.decimal_number,,elevation,sherlock
sherlock,,,"["""", ""M"", """", ""M"", """", ""M"", """", ""M"", """", ""M""]",identity.person.gender_code,medium,identity.person.gender,0.8000,no,identity.person.gender_code,Values are 'M' gender codes; identity.person.gender is close but gender_code is more precise.,sex,sherlock
sherlock,,,"[""2008"", ""1498"", ""1031"", ""581"", ""572"", ""389"", ""83""]",representation.numeric.integer_number,medium,representation.identifier.numeric_code,0.8571,no,representation.numeric.integer_number,Integer values; numeric_code is less precise than integer_number for these counts.,region,sherlock
sherlock,,,"[""Warm smooth distortion pedal"", ""D-5 Fab Chorus"", ""Compressor Pedal"", ""Delay Pedal""]",representation.text.plain_text,medium,geography.location.region,0.1250,no,representation.text.plain_text,Music equipment product names; region is incorrect.,description,sherlock
sherlock,,,"[""Standard International Flat Rate Postage"", ""Express International Flat Rate Postage""]",representation.text.plain_text,medium,representation.text.entity_name,1.0000,no,representation.text.plain_text,Shipping service names; entity_name is plausible but plain_text better describes these.,service,sherlock
sherlock,,,"[""Norwegian Krone:"", ""Philippine Peso:"", ""Polish New Zloty:"", ""Russian Ruble:^"", ""Singapore Dollar:"", ""Swedish Krona:"", ""Swiss Franc:"", ""Taiwan New Dollar:"", ""Thai Baht:"", ""Turkish Lira:""]",finance.currency.currency_code,medium,geography.location.country,0.4167,no,representation.text.entity_name,Currency names with colon suffix; these are currency names not codes. entity_name is closer than country.,currency,sherlock
sherlock,,,"[""FIN"", ""USA"", ""NOR"", ""USA"", ""NOR"", ""USA"", ""CAN"", ""GBR"", ""USA"", ""AUT""]",geography.location.country_code,high,geography.transportation.iata_code,0.5333,no,geography.location.country_code,"3-letter ISO country codes (FIN, USA, NOR); iata_code is wrong, country_code is correct.",nationality,sherlock
sherlock,,,"[""Linux Kernel"", ""Enterprise Linux""]",representation.text.plain_text,medium,representation.text.entity_name,1.0000,no,representation.text.plain_text,Product/software names; entity_name is plausible.,product,sherlock
sherlock,,,"[""M"", ""M"", ""M"", ""M"", ""M"", ""M"", ""M"", ""M"", ""F"", ""M""]",identity.person.gender_code,high,identity.person.gender,1.0000,no,identity.person.gender,FineType confident (1.00); deferring to its prediction over blind label.,gender,sherlock
sherlock,,,"[""Ottawa Fury FC"", ""New York Cosmos"", ""Tampa Bay Rowdies"", ""Carolina RailHawks"", ""Minnesota United FC"", ""Indy Eleven"", ""Fort Lauderdale Strikers"", ""FC Edmonton"", ""San Antonio Scorpions"", ""Atlanta Silverbacks""]",representation.text.entity_name,high,representation.text.entity_name,0.7273,yes,representation.text.entity_name,,team,sherlock
sherlock,,,"[""4"", ""4"", ""5"", ""5"", ""7"", ""7"", ""6"", ""5"", ""4"", ""6""]",representation.numeric.integer_number,medium,representation.numeric.integer_number,0.9333,yes,representation.numeric.integer_number,,service,sherlock
sherlock,,,"[""Placement Consultants"", ""Consultancy Services""]",representation.text.plain_text,medium,representation.text.entity_name,1.0000,no,representation.text.plain_text,Business category names; entity_name is plausible but plain_text is better.,company,sherlock
sherlock,,,"[""Monday"", ""Tuesday"", ""Wednesday"", ""Thursday"", ""Friday"", ""Saturday"", ""Sunday""]",datetime.component.day_of_week,high,datetime.component.day_of_week,0.8571,yes,datetime.component.day_of_week,,day,sherlock
sherlock,,,"[""F Norton"", ""J P Spencer"", ""Adam Beschizza"", ""P Hills (3)"", ""L Morris"", ""N Callan"", ""G Baker"", ""R Winston"", ""Nanna Hansen (5)""]",identity.person.full_name,medium,representation.text.entity_name,0.4444,no,identity.person.full_name,Jockey names (some with weight allowances in parentheses); entity_name is plausible but full_name is more accurate.,jockey,sherlock
sherlock,,,"[""chevrolet"", ""buick"", ""plymouth"", ""amc"", ""ford"", ""ford"", ""chevrolet"", ""plymouth"", ""pontiac"", ""amc""]",representation.text.word,medium,representation.discrete.ordinal,0.1250,no,representation.text.word,"Car manufacturer names (lowercase); ordinal is incorrect, word/entity is better.",manufacturer,sherlock
sherlock,,,"[""http://www.ldc.upenn.edu/Catalog/CatalogEngry.jsp?catalogId=LDC94T4A"", ""None"", ""None""]",technology.internet.url,medium,geography.address.street_suffix,0.6667,no,technology.internet.url,"One URL value plus 'None' strings; street_suffix is wrong, url is correct.",location,sherlock
sherlock,,,"[""1"", ""2"", ""4"", ""4""]",representation.numeric.integer_number,medium,representation.numeric.integer_number,0.8000,yes,representation.numeric.integer_number,,position,sherlock
sherlock,,,"[""1/50 - 1/500."", ""1/50 - 1/500."", ""1/50 - 1/200.""]",representation.text.plain_text,low,representation.file.excel_format,1.0000,no,representation.text.plain_text,Ratio range values like '1/50 - 1/500.'; excel_format is wrong.,notes,sherlock
sherlock,,,"["" Autauga County, Alabama"", "" Baldwin County, Alabama"", "" Barbour County, Alabama"", "" Bibb County, Alabama"", "" Blount County, Alabama"", "" Bullock County, Alabama"", "" Butler County, Alabama"", "" Calhoun County, Alabama"", "" Chambers County, Alabama"", "" Cherokee County, Alabama""]",geography.location.region,high,representation.text.entity_name,0.9000,no,representation.text.entity_name,FineType confident (0.90); deferring to its prediction over blind label.,county,sherlock
sherlock,,,"[""Borussia Dortmund"", ""Real Madrid"", ""Ajax"", ""Manchester City""]",representation.text.entity_name,high,geography.location.region,0.5000,no,representation.text.entity_name,Soccer team names; entity_name is correct; both agree.,team,sherlock
sherlock,,,"[""Taichung"", ""taipei"", ""Taitung"", ""Tainan"", ""Yilan"", ""Hualien"", ""Kinmen"", ""Nantou"", ""Pingtung"", ""Miaoli""]",geography.location.city,high,geography.location.region,0.4000,no,geography.location.city,Low FineType confidence (0.40); blind classification preferred.,city,sherlock
sherlock,,,"[""Dreamyard"", ""Pinwheel Forest (Outside)"", ""Pinwheel Forest (Inside)"", ""Cold Storage"", ""Dragonspiral Tower (Entrance)"", ""Dragonspiral Tower (Outside)"", ""Giant Chasm (Outside)"", ""Giant Chasm (Forest)"", ""Abundant Shrine"", ""Village Bridge""]",representation.text.plain_text,medium,representation.text.entity_name,0.7500,no,representation.text.plain_text,Fictional game location names; entity_name is plausible but plain_text is better for fictional places.,area,sherlock
sherlock,,,"[""AS"", ""FPAY"", ""REMI"", ""LAPS"", ""FP""]",representation.text.word,low,representation.identifier.alphanumeric_id,0.6000,no,representation.text.word,"Short patent/legal codes (AS, FPAY, REMI); alphanumeric_id is plausible but word is safer.",code,sherlock
sherlock,,,"["""", """", """", """", """", """", ""EU"", """", ""EU"", ""EU""]",geography.location.continent,medium,geography.location.country_code,0.3000,no,geography.location.continent,"Values are continent codes (EU, SA) with many blanks; country_code is wrong, continent is correct.",continent,sherlock
sherlock,,,"[""Full"", ""Unavailable"", ""Unavailable"", ""Unavailable"", ""Unavailable""]",representation.discrete.categorical,medium,representation.discrete.categorical,0.8000,yes,representation.discrete.categorical,,status,sherlock
sherlock,,,"[""Wednesday"", ""Thursday"", ""Friday"", ""Saturday"", ""Sunday"", ""Monday"", ""Tuesday"", ""Wednesday"", ""Friday"", ""Saturday""]",datetime.component.day_of_week,high,datetime.component.day_of_week,0.8500,yes,datetime.component.day_of_week,,day,sherlock
sherlock,,,"[""United States"", ""\u2014 Alabama"", ""\u2014 Alaska"", ""\u2014 Arizona"", ""\u2014 Arkansas"", ""\u2014 California"", ""\u2014 Colorado"", ""\u2014 Connecticut"", ""\u2014 Delaware"", ""\u2014 Florida""]",geography.location.country,medium,geography.location.country,0.5000,yes,geography.location.country,,country,sherlock
sherlock,,,"[""Helsinki Commission"", ""Helsinki Commission"", ""Helsinki Commission"", ""Helsinki Commission"", ""Helsinki Commission"", ""State Department"", """", ""Baptist Union, Georgia"", """", ""Institute for Peace, Development, Democracy""]",representation.text.entity_name,medium,representation.text.entity_name,0.5455,yes,representation.text.entity_name,,affiliation,sherlock
sherlock,,,"[""KY"", """", """", """", """", """", ""SC"", ""GA"", ""TN"", ""MI""]",geography.location.region,high,geography.location.country_code,0.5455,no,geography.location.region,"US state abbreviations (KY, SC, GA, TN, MI); country_code is wrong, region is correct.",state,sherlock
sherlock,,,"[""Mon"", ""Tues"", ""Wed"", ""Thurs"", ""Fri"", ""Sat"", ""Sun""]",datetime.component.day_of_week,high,identity.person.last_name,0.0714,no,datetime.component.day_of_week,Low FineType confidence (0.07); blind classification preferred.,order,sherlock
sherlock,,,"[""Alabama"", ""Oregon"", ""Clemson"", ""Florida State"", ""Ohio State"", ""LSU"", ""UCLA"", ""Louisville"", ""Miami (FL)"", ""South Carolina""]",representation.text.entity_name,medium,geography.location.region,0.1000,no,representation.text.entity_name,College football team names (mix of schools and state names); entity_name is best.,team,sherlock
sherlock,,,"[""Bab\u00c3\u00a1m, ha te Ricin t\u00c3\u00balm\u00c3\u00a9sz"", ""H\u00c3\u00a9jsza"", ""A Gyica Bal\u00c3\u00a1n\u00c3\u00a9"", ""S\u00c3\u00adr a Szemem, Hull a K\u00c3\u00b6nnyem"", ""Baszom, Aki Hov\u00c3\u00a1 Val\u00c3\u00b3""]",representation.text.plain_text,medium,geography.address.full_address,0.4000,no,representation.text.plain_text,Song titles with garbled encoding; entity_name is plausible but plain_text is better.,name,sherlock
sherlock,,,"[""Little Girl"", ""Celtic Pride, Crazy in Love, 2011"", ""Sneak Peek"", ""Twig"", ""Soul Food"", ""Fun House"", ""Antiquities, part 1, and Antiquities, part 2"", ""Soul Food Embellishments, part 1, and Soul Food Embellishments, part 2"", ""The Great Outdoors papers, and The Great Outdoors embellishments"", ""Spring in Bloom, part 1, and Spring in Bloom, part 2""]",representation.text.plain_text,medium,representation.text.entity_name,0.5000,no,representation.text.plain_text,Product/album collection names; entity_name is plausible.,product,sherlock
